mention_id	entity_name	mention_pos	words	sentences_before	sentences_after	definitions
MENTION_GENE_journal.pone.0049879.pdf_213_18_18	TRIM27	{18}	{The,GluA2,/,[,3-actin,ratio,increased,signiﬁcantly,by,Ell,in,non-infected,or,RCASBP,(,B,),-,RFP,-,scrambled,siRNA-infected,embryos,.}	{"As indicated in Fig .","1E , the ratio of GluA2 to B-actin was signiﬁcantly low at E6 ."}	{"Infection of chicken embryos with the RCASBP ( B ) - RFP-GluA2 siRNA construct leads to a signiﬁcant reduction in the GluA2/B-actin ratio when compared with non-infected or RCASBP ( B ) - RFP-scrambled siRNA-infected embryos ( Fig .","1E ) ."}	red fluorescence protein|^|red fluorescent protein
MENTION_GENE_journal.pone.0059104.pdf_455_26_26	PEBP1	{26}	{We,observed,that,cells,with,low,levels,of,RKIP,had,in,vim,),a,viability,advantage,over,time,when,compared,with,cells,with,normal,levels,of,RKIP,.}	{"RKIP downregulation was done by cells transfection with a speciﬁc shRNA for RKIP , which resulted in the reduction of the protein levels , as already described [ 37,50 ] .","Firstly , we studied the role of RKIP in the control of cervical cancer cells growth ."}	{"This viability advantage was shown to be due to the high levels of proliferation of the cells , as evidenced by BrdU and colony formation assays , which is probably promoted by a shift in cell cycle distribution with a higher percentage of cells in G2 / M and S phase .","The in vitro effect of RKIP in cellular proliferation and cell cycle regulation has not been consistent in the literature , and this may reﬂect in part the assays used ."}	raf kinase inhibitor protein|^|raf kinase inhibitory protein
MENTION_GENE_journal.pone.0028557.pdf_547_6_6	RASA1	{6}	{B.,Sumoylated,neural,RGSZ2,protein,lacks,GAP,activity,but,this,is,restored,by,SENP2,treatment,.}	{"— .","RGSZ2 CT was used to detect those signals ."}	{"The observed kca , ( min ’ 1 ) were : Goci alone = 2.1 ; in the presence of endogenous RGSZ2 = 1.8 ; and of SENP2treated endogenous RGSZ2 = s. 7 .","Data are the mean : S.E.M. of triplicate samples collected at the intervals indicated ."}	gtpase accelerating protein
MENTION_GENE_journal.pone.0094313.pdf_158_1_1	VEGFA	{1}	{All,VEGF,+,cells,of,the,retina,were,vim,+,(,Fig,.}	{"Among the retinal non-immune cells reported to produce VEGF are astrocytes [ 18,19 ] and Muller cells [ 20,21 ] .","We used vimentin ( vim ) to identify these cells [ 25 — 27 ] , because GFAP staining [ 28 ] in our hands gave inferior staining results for this cell type using ﬂowcytometry ( data not shown ) ."}	{"2E ) , implying that also the VEGF producing MPs and ECs must be vim + .","Also ganglion cells have been reported to produce VEGF [ 29 ] ."}	vascular endothelial growth factor
MENTION_GENE_journal.pone.0036653.pdf_305_27_27	EGFR	{27}	{Nlolinari,F,",",l,"\\\\",’,Iartin,V,",",Saletti,P,",",Saletti,P,",",De,Dosso,S,",",et,al.,(,2009,),Differing,deregulation,of,EGFR,and,downstream,proteins,in,primary,colorectal,cancer,and,related,metastatic,sites,may,be,clinically,relevant,.}	{"The Lancet Oncology 6 : 279 — 286 .","12 ."}	{"Br J Cancer 100 : l087 — l094 .","S PLoS ONE | www ."}	epidermal growth factor receptor
MENTION_GENE_journal.pone.0029126.pdf_25_28_28	TNF	{28}	{Americans,",",serum,TNF,—,oc,levels,were,significantly,higher,relative,to,matched,controls,(,P,=,0.039,),",",and,patients,with,neurologic,disease,had,significantly,higher,TNF,—,ol,than,patients,lacking,this,manifestation,(,P,=,0.022,),.}	{"In African .","— ."}	{"In European .","— ."}	tumor necrosis factor
MENTION_GENE_SCPDFS_22338.pdf_334_23_23	RPSA	{23}	{Contrary,to,the,direct,(,aa,161-179,),PrP,interaction,site,",",the,putative,indirect,PrP,interaction,site,(,aa,180-285,),on,RPSA,(,Hundt,et,al.,",",2001,),is,not,conserved,between,mammals,at,three,positions,.}	{"Some amino acid exchanges exist between the porcine RPSA cDNA and one or several of its mammalian orthologs at position 107 ( bovine RPSA cDNA ) , at position 241 ( bovine and murine RPSA cDNA ) , at position 249 ( murine RPSA cDNA ) , at position 272 ( bovine , human and murine RPSA cDNA ) , at position 290 ( human and murine RPSA cDNA ) , and at position 293 ( human RPSA cDNA ) .","Nevertheless , the high overall protein similarity between the porcine RPSA and its orthologs between 98.3 % ( chicken ) and 98.99 % ( cattle and humans ) reﬂects clearly that the protein has remained highly conserved during species evolution ."}	{"In particular , the interspecies differences between cattle and pigs at positions 241 and 272 are of special interest .","Possible functional modifications of the receptor in the context of its potential to interact with PrP should gain a deeper understanding of its contribution particular in the emergence of TSE in mammals ."}	ribosomal protein sa
MENTION_GENE_journal.pcbi.0030194.pdf_956_20_20	TNF	{20}	{Algood,HM,",",Lin,PL,",",Yankura,D,",",Jones,A,",",Chan,J,",",et,al.,(,2004,),TNF,influences,chemokine,expression,of,macrophages,in,vitro,and,that,of,CD11b,+,cells,in,vivo,during,Mycobacterium,tuberculosis,infection,.}	{"Denis M , Gregg Eo , Ghandirian E ( 1990 ) Cytokine modulation of Mycobacterium tuberculosis growth in human macrophages .","Int J Immunopharmacol 12 : 721 — 727 ."}	{"J Immunol 172 : 6846 — 6857 .","Roach DR , Bean AG , Demangel C , France MP , Briscoe H , et al. ( 2002 ) TNF regulates chemokine induction essential for cell recruitment , granuloma formation , and clearance of mycobacterial infection ."}	tumor necrosis factor|^|tumor necrosis factor , vct , virtual clinical trial
MENTION_GENE_SCPDFS_22284.pdf_47_7_7	DLC1|HP	{7}	{HP-20,",",HP,—,25,",",and,HP,—,27,contain,collagenlike,Gly,.}	{"D. Zsukamoto et al. / Gene 396 ( 2007 ) 268-272","and Kondo , 1992 ) ."}	{"— .","X ."}	hibemation-speciﬁc protein|^|hibemationspeciﬁc proteins
MENTION_GENE_journal.pone.0102797.pdf_427_29_29	TBP	{29}	{In,conclusion,",",we,propose,a,unique,epigenetic,model,in,which,modiﬁed,guanine,attributed,to,oxidative,stress,derepresses,the,sFRP,—,4,gene,by,sequestering,MeCP2,and,conversely,recruiting,TBP,at,TATA-box,(,Fig,.}	{"S2 ) .","Moreover , because sFRP — 4 is a soluble factor , it can be a good therapeutic target with the use of a neutralizing antibody or blocking agent ."}	{"6 ) .","Supporting Information"}	tata-box binding protein
MENTION_GENE_journal.pone.0067830.pdf_142_19_19	CP	{19}	{Limited,amounts,of,the,material,did,not,allow,us,to,measure,the,near,UV,CD,spectrum,of,isolated,PVA,CP,.}	{"Such intensity ( and the position of the maximum ) are similar to those of thermally denatured isolated single-stranded RNA [ 14,15 ] .","On the basis of the data for tobamoviruses , we suggested [ 1 1 ] that the RNA contribution to their near UV CD spectra constitutes about 60 — 70 % ."}	{"In 2008 , we demonstrated that isolated CP of potato virus X ( PVX ) had negative ( although not too strong ) near UV CD spectrum [ 16 ] .","In any case , the near UV CD spectrum of intravirus PVA RNA should be more or less close to the spectrum of denaturated isolated single-stranded RNAs and may also indicate some kind of structural disorder ."}	coat protein
MENTION_GENE_journal.pone.0094413.pdf_923_26_26	APC	{26}	{Nakagawa,H,",","l\\\\/Iurata",Y,",",Koyama,K,",",Fujiyama,A,",","l\\\\/Iiyoshi",Y,",",et,al.,(,1998,),Identification,of,a,brain,~,specific,APC,homologue,",",APCL,",",and,its,interaction,with,beta,~,catenin,.}	{"Grohmann A , Tanneberger K , Alzner A , Schneikert J , Behrens J ( 2007 ) Al \\\\ ’ lER1 regulates the distribution of the tumor suppressor APC between microtubules and the plasma membrane .","J. Cell Sci 120 : 3738 — 3747 ."}	{"Cancer Res 58 : 5176 * 5l81 .","van Es JH , Kirkpatrick C , van de VVetering l \\\\ ’ I , l\\\\/Iolenaar IVI , l \\\\ ’ 1iles A , et al. ( 1999 ) Identification of APC2 , a homologue of the adenomatous polyposis coli tumour suppressor ."}	adenomatous polyposis coli
MENTION_GENE_journal.ppat.0020113.pdf_429_0_0	ACP5|SCYL1|CD40LG	{0}	{TRAP,was,processed,by,TgROM5,as,well,as,by,PfROM4,",",but,not,by,PfROMs,1,",",7,",",and,8,(,Figure,7A,),.}	{"Like its homolog MIC2 in Toxoplasma , TRAP contains many small residues that would be expected to result in helix destabilization in its transmembrane domain ( Figure IB ) , and in addition to AMA1 is the only other Plasmodium adhesin that we found can be cleaved by DmRho-l ( unpublished data ) .","To test whether TRAP is a substrate for parasite rhomboid proteases , we tagged its N terminus with GFP and expressed it as a full-length adhesin in COS cells by transient transfection ."}	{"Although it is not known which adhesins link to the cytoskeleton in merozoites , recently several TRAP homologs have been identiﬁed , including MTRAP ( PFlO_O281 ) , PFF0800w , and PTRAMP , some of which display expression in merozoites as determined by RT-PCR [ 21,43 ] .","Both MTRAP and PFF0800w have transmembrane domains that might be expected to confer rhomboid cleavage , while PTRAMP does not ."}	thrombospondin — re | ated anonymous protein
MENTION_GENE_journal.pone.0076906.pdf_294_28_28	EGFR	{28}	{Cunningham,IVIP,",",Essapen,S,",",Thomas,H,",",Green,l,"\\\\",’,I,",",Lovell,DP,",",et,al.,(,2006,),Coexpression,of,the,IGF-IR,",",EGFR,and,HER-2,is,common,in,colorectal,cancer,patients,.}	{"In Cancer Staging Handbook , Seventh edition edn , Chapter Part III Di gestive System , pp 1734 206 .","New York : Springer ."}	{"IntJ Oncol 28 : 3294335 .","Nlendelsohn J , Baselga J ( 2003 ) Status of epidermal growth factor receptor antagonists in the biology and treatment of cancer ."}	epidermal growth factor receptor
MENTION_GENE_journal.pone.0021209.pdf_259_13_13	PLIN2	{13}	{VLDL,stimulation,of,COS,cells,expressing,HL,doubled,the,activity,of,the,cotransfected,ADRP,promoter-Luc,reporter,;,no,effect,was,seen,in,an,ADRP,promoter,construct,in,which,the,PPRE,contained,a,point,mutation,(,D1,ADRP-Luc,",",Fig,.}	{"Previous work has identiﬁed a functional PPRE in the human ADRP promoter region ( -2361 to -2345 bp ) [ 31 ] .","To determine if HL/VLDL activates ADRP expression through this PPRE , we used a 4 kb human ADRP promoter-luciferase reporter construct ( 4 kb ADRP-Luc ) transfected into COS cells ."}	{"3D ) .","HLNLDL regulates PPAR6 target gene expression in FAO hepatoma cells in vitro and in murine liver in vivo Given the data above , we next tested HL regulation of ADRP expression through PPAR5 in a hepatocyte-derived model system in vitro ."}	adipocyte differentiation related protein
MENTION_GENE_journal.pone.0025358.pdf_342_17_17	GHR	{17}	{Liver,lysates,from,SOCS2,KO,mice,and,control,mice,were,visualized,by,western,blot,and,analyzed,for,GHR,levels,with,an,anti,.}	{"GHR antibody .","( B ) GHRlevels in SOCS2 KO mice ."}	{"— .","GHR antibody ."}	growth hormone receptor
MENTION_GENE_journal.pone.0007349.pdf_1019_39_39	GPBAR1|OXER1	{39}	{Thus,",",the,limited,repertoire,of,heterotrimeric,G,protein,complexes,in,Ciona,provides,an,unique,opportunity,to,extend,the,predictions,to,guide,experimental,studies,to,explore,the,basis,of,receptor,activation,",",speciﬁcity,and,selectivity,",",phenotypic,effects,of,GPCR,signaling,events,",",reinforce,functional,importance,of,existing,receptor,G,protein/RGS,protein,interactions,and,for,identiﬁcation,of,new,partners,and,downstream,targets,.}	{"$ PLoS ONE | www .","p | osone.org evolution of the mechanistic basis of speciﬁcity and diversity of the chordate GPCR signaling pathways ."}	{"Supporting Information","Data S1 Amino acid sequences of heterotrimeric G proteins and RGS proteins used as queries in BLAST and HMM search programs ( FASTA format ) Found at : doi :10 ."}	g protein coupled receptor
MENTION_GENE_SCPDFS_23508.pdf_693_2_2	TFCP2	{2}	{Transcription,factor,CP2,is,crucial,in,hemoglobin,synthesis,during,erythroid,terminal,differentiation,in,vitro,.}	{"Cells 15 , 40-47 .","Chae , J.H. , Lee , Y.H. , Kim , C.G. , 1999 ."}	{"Biochem .","Biophys ."}	ccaat-binding protein-2
MENTION_GENE_journal.pone.0054605.pdf_389_33_33	APP	{33}	{Collectively,",",these,results,suggest,that,Npcl,deﬁciency,can,alter,the,expression,of,selected,genes,",",which,may,be,involved,either,directly,or,indirectly,in,NPC,pathogenesis,",",whereas,expression,of,mutant,human,APP,in,Npclnull,background,appears,to,inﬂuence,disease,pathology,by,regulating,the,changes,that,are,already,altered,by,Npcl-deﬁciency,rather,instigating,expression,of,additional,genes,.}	{"Interestingly , ANPC and Npcl-null mice , with the exception of a few genes , exhibited more or less similar changes , although more genes were differentially expressed in the affected cerebellar region than the relatively spared hippocampal formation .","The altered gene proﬁles were found to match with the corresponding alterations in the protein levels ."}	{"Our analysis of gene proﬁles is validated by two lines of evidence .","First , the genes that are known to be enhanced by Npcldeﬁciency such as M052 , Abra ] and Ctsb were found to be upregulated in our experiments [ 26 ] ."}	arnyloid precursor protein
MENTION_GENE_journal.pone.0094336.pdf_121_35_35	GFAP	{35}	{Doub,|,e,—,staining,for,GFAP,and,PAS,—,positive,granules,Brains,from,6-week-old,(,n,=,5,/,group,),male,offspring,mice,were,used,for,double-staining,for,glial,fibrillary,acidic,protein,(,GFAP,),and,PAS,—,positive,granules,.}	{"epoxy resin ( Epon 812 , Shell Chemicals Ltd. , Houston , TX , USA ) .","Ultrathin sections of each sample were stained with uranyl acetate and lead citrate and examined by transmission electron microscopy ( ] EOLloo-S , JEOL Ltd. , Tokyo , Japan ) with an accelerating Voltage of 80 kV ."}	{"The brain samples were fixed for 24 hr in 4 % paraformaldehyde .","Right brains were embedded in paraffin and cut into 6-um sections for wide-ﬁeld analysis ."}	glial fibrillary acidic protein
MENTION_GENE_journal.ppat.0030017.pdf_799_2_2	TMBIM4	{2}	{Construction,of,GAAP,mutant,Viruses,.}	{"The ﬁdelity of all DNA sequences was conﬁrmed by sequencing .","For transient transfection experiments , human and viral GAAPs cDNA were subcloned into pCI ( Promega , http://www.promega.com ) ."}	{"A VACV mutant lacking the GAAP gene was constructed using a plasmid assembled by splicing by overlap extension ( SOE ) - PCR [ 35 ] .","Two DNA fragments were ampliﬁed representing either the 5 ’ ( 307 bp ) or 3 ' ( 462 bp ) ﬂanking regions of the GAAP gene , using oligonucleotides AGAAP — l ( 5 ' - GCCCCGTCGACGATGTGATAAATACAGCGATACC ) and AGAAP-2 ( 5 ' - CCAATCCATGTTTTGACCTATATATTAATACTC ) or oligonucleotides AGAAP — 3 ( 5 ' TAATATATAGGTCAAAACATGGATTGGAAAC )"}	golgi anti » apoptotic protein
MENTION_GENE_SCPDFS_24177.pdf_355_4_4	TBP	{4}	{Early,experiments,indicated,that,TBP,overexpression,is,lethal,in,mot,],-1,cells,",",but,not,in,wild-type,cells,.}	{"Mechanism of BTAF1 and Motlp action","In vivo experiments indicated that both the positive and the negative effects of Motlp on transcription require its ATPase-driven functions and are likely to result from its direct action on TBP ( Auble et al. , 1994 ; Dasgupta et al. , 2002 ) ."}	{"Conversely , TBP overexpression can rescue lethality caused by the ATPase-defective D1408N mutant of mot ] ( Auble et al. , 1994 ) .","Together , these data underscore the notion that the ATPase function of Motlp is tightly associated with the regulation of TBP function ."}	tata-binding protein|^|tata box-binding protein|^|tata-box binding protein
MENTION_GENE_journal.pone.0031626.pdf_200_60_60	PNP|ZNF384|CTF2P	{60}	{The,mechanical,properties,that,varied,included,:,(,2,),extensibility,",",which,varied,in,all,three,species,by,decreasing,sequentially,between,the,HP,",",LP,and,NP,treatments,(,Table,4,),",",(,iz,),ultimate,strength,",",which,was,signiﬁcantly,lower,in,L.,blanda,MA,silks,from,the,HP,treatment,compared,to,those,on,the,LP,or,NP,treatments,(,Table,4c,),",",and,(,iiz,),Young,’s,modulus,",",which,was,signiﬁcantly,lower,in,L.,Manda,MA,silks,from,the,NP,and,LP,treatments,compared,to,those,on,the,HP,treatment,(,Table,4c,),.}	{"GPG motifs , consistent with a shift toward greater MaSpl expression .","Influences on mechanical properties While we found signiﬁcant variations in mechanical properties between the pre - and post-experimental MA silks , the variations differed only between species and species > < treatment interactions ( Table 3 ) ."}	{"Influence of phylogeny and protein intake on silk properties Multiple regression of all three species data combined found that extensibility , Young ’s modulus and thread diameter were inﬂuenced by a combination of variations in amino acid compositions , phylogenetic branch lengths ( i.e. “ phylogenetic inertia ” [ 54,57 ] ) between species , and protein intake ( Table 5 ) .","The composition of proline and glycine was positively associated with extensibility and negatively associated with Young ’s modulus , the composition of serine was positively associated with ultimate strength while glycine and alanine compositions were negatively associated ."}	no protein
MENTION_GENE_journal.pone.0079255.pdf_362_34_34	KHSRP	{34}	{KSRP,Limits,Axonal,Outgrowth,in,Cultured,Rat,Hippocampal,Neurons,Having,established,that,KSRP,binds,to,and,affects,GAP43,mRNA,half-life,",",we,set,out,to,determine,the,potential,physiological,effect,(,s,),of,KSRP,expression,in,cultured,rat,hippocampal,neurons,.}	{"Also , we conﬁrmed that the yield of RNA recovered from the assays was the same for all the time points , using a “ spike-in ” radiolabeled control RNA in addition to the GAP-43 mRNA ( Figure S1 ) .","Collectively , these experiments indicate that KSRP increases the decay rate of GAP43 mRNA in vitro and that the fourth KH domain in the protein is important for this function ."}	{"In this experimental system hippocampi from EI7 rat embryos were isolated , dissociated , and grown for 3 DIV before being transfected with various GFP-KSRP constructs ( Figure 3A ) .","Neurons were grown for 48 hours posttransfection before ﬁxation ."}	kh-type splicing regulatory protein
MENTION_GENE_SCPDFS_10193.pdf_136_0_0	TH	{0}	{TH,and,MelEM,Mabs,followed,by,isotype-speciﬁc,secondary,antibodies,as,already,mentioned,.}	{"In other series of experiments , cultures were labeled with anti .","— ."}	{"It has to be noted that SMP + and MelEM + cells could not be identiﬁed in the same clones since both Mabs share the same IgG1 isotype and therefore could not be used for doublelabeling experiments .","Melanocytes were identiﬁed under phase — contrast microscopy by the presence of pigment in their cytoplasm ."}	tyrosine hydroxylase
MENTION_GENE_journal.pone.0031323.pdf_119_0_0	ALK	{0}	{ALK,Two,independent,PCRS,were,performed,using,cDNA,synthesized,from,a,tumor,tissue,expressing,KIF5B-ALK,with,the,following,primer,sets,:,KLCl-NheI-M,(,5,’,-,GCGCTAGCGAATGTATGAG,AACATGTCCAC-3,’,),and,KLC,l-bpR,(,5,’,GTGCTTCCGGCGGTACACATCTACAGAACCAAACTC-3,’,),",",and,ALK-bpF,(,5,’,GGGAGTTTGGTTCTGTAGATGTGTACCGCCGGAAGC-3,’,),and,ALK-EcoRI,(,5,’,-,GATAGAATTCTCAGGGCCCAGGCT-3,’,),.}	{"Synthesis of the putative cDNA of KLC1 .","— ."}	{"Then , the second PCR was performed using a 1 / 100 dilution of a mixture of the first PCR products as a template with the KLC lNheIM and ALK-ECORI primers ( Figure 2 ) .","Transformation assay for KLC1 ."}	anaplastic lymphoma kinase
MENTION_GENE_SCPDFS_19502.pdf_383_13_13	TP53BP1	{13}	{E,:,Individual,PML,bodies,and,PML,bodies,that,co,—,localized,with,53BP1,bodies,in,non,—,irradiated,and,irradiated,cells,;,observed,30,min,after,irradiation,.}	{"C : Association of 53BP1 bodies ( red ) and PML bodies ( green ) in non — irradiated and y — irradiated nuclei .","D : Fibrillarin-positive regions ( immunoﬂuorescence shown in red ) surrounded by several PML bodies ( GFP shown in green ) in both non — irradiated and y — irradiated nuclei ."}	{"F : Individual PML bodies and PML bodies that co — localized with 53BP1 bodies in non — irradiated cells , irradiated cells , and cells treated with hydroxyurea ( HU ) prior to y — irradiation ; observed 2 h after irradiation .","remained stable ."}	p53 — binding protein
MENTION_GENE_SCPDFS_11593.pdf_254_4_4	NGF	{4}	{The,ability,of,mouse,NGF,to,bind,speciﬁcally,to,receptors,of,different,species,has,been,supported,by,the,high,degree,of,homology,of,the,extracellular,portions,of,the,chicken,(,Escandon,and,Chao,",",1989,',",",Large,et,al.,",",1989,),",",rat,(,Radeke,et,al.,",",1987,),",",and,human,receptors,(,Johnson,et,(,LL,",",1986,),.}	{"In this study we took advantage of the highly conserved functional ligand binding domain between NGF and its receptor .","Mouse NGF has been shown to bind efﬁciently to human , rat , bovine , and chicken NGF receptors , and has been used to induce physiological responses in lower vertebrates such as goldﬁsh ( Turner et al. , 1980 ; Yip and Grafstein , 1982 ) and Xenopus tadpoles ( Levi-Montalcini and Aloe , 1985 ) ."}	{"Similarly , the cloned chicken NGF gene shares more than 80 % amino acid homology with both the mouse and human NGF genes ( Ebendal et al. , 1986 ; Wion et aL , 1986 ) .","_ Using mouse 1251-NGF and the crosslinking agents EDAC , we have observed a regulated pattern of expression for the NGF receptor during an early embryonic age ."}	nerve growth factor
MENTION_GENE_journal.pone.0076094.pdf_10_2_2	APP	{2}	{|,ength,APP,upon,sequential,cleavage,by,either,01,-,or,B,—,secretase,followed,by,y,—,secretase,.}	{"Background : The amyloid precursor protein ( APP ) intracellular domain ( AICD ) is released from fu | | .","— ."}	{"Together with the adaptor protein Fe65 and the histone acetyltransferase Tip60 , AICD forms nuclear multiprotein complexes ( AFT complexes ) that function in transcriptional regulation .","Objective : To develop a medium — throughput machine — based assay for visualization and quantification of AFT complex formation in cultured cells ."}	amyloid precursor protein
MENTION_GENE_journal.pone.0052357.pdf_359_25_25	TNF	{25}	{Confluent,HUVEC,monolayers,were,pre,—,treated,with,different,concentrations,(,10-1000,nM,),of,E2,for,45,minutes,prior,to,4,hour,stimulation,with,TNF,(,5,ng/ml,),.}	{"Figure 5 .","17 - [ 3-estradiol ( E2 ) alone has no effect on TNFmediated endothelial | CAM — 1 and VCAM-1 expression ."}	{"Cells were lysed and the lysates were immunoblotted with antibodies against | CAM — 1 ( A ) , VCAM-1 ( B ) and oc — tubu | in .","Data are shown as mean : SEM of 4 independent experiments ."}	tumor necrosis factor
MENTION_GENE_journal.pone.0014664.pdf_167_4_4	DLC1|HP	{4}	{The,switch,to,a,HP,diet,led,to,a,dramatic,but,transient,decrease,in,Fat,balance,during,the,ﬁrst,day,(,-5.4,:,1.2,K,],",",signiﬁcantly,different,from,o,),suggesting,that,in,the,1,“,day,fat,oxidation,exceeded,dietary,delivery,",",but}	{"Energy nutrient balance during the 4 h postprandial period was computed as the difference between the amount of energy ingested and the amount oxydized ( Figure 4 ) .","Postprandial protein balance increased to positive value as soon as the ﬁrst day of HP feeding and remained positive thereafter ."}	{":1 ) Liver Iipogenesis","Diet effect p < 0_oo01 Diet effect p < 0.0001 \\""}	high protein
MENTION_GENE_SCPDFS_12788.pdf_450_21_21	NGF	{21}	{Koike,(,1983,),had,shown,that,PC12,cells,cultured,in,FBS-containing,medium,on,polylysine-coated,dishes,extend,neurites,in,response,to,NGF,and,that,this,neurite,formation,is,dependent,on,the,presence,of,Mg,“,ions,in,the,medium,.}	{"In general , the substratum requirements for nerve ﬁber outgrowth appear to be more stringent than those for attachment of dissociated nerve cells ( Carbonetto et al. , 1983 ) .","This may be because neuronal somata possess cell — substratum adhesion mechanisms ( including some that are nonspeciﬁc ) which do not exist , or can not function effectively , at the growth cone ."}	{"Under Koike ’s conditions the effective substratum presumably consisted of a mixture of serum proteins adsorbed to polylysine .","Despite the difference in substrata , Koike ’s results suggested to us that the Mg “ - dependent attachment mechanism described in our experiments might operate at the growth cone to stabilize neurite outgrowth ."}	nerve growth factor
MENTION_GENE_journal.pone.0067542.pdf_272_2_2	EGF	{2}	{Treatment,with,EGF,enhanced,MMP7,expression,at,the,level,of,transcription,in,AGSpu6,cells,but,not,in,AGS-sipk,cells,(,Fig,.}	{"This result is the opposite of what was observed with the BGC823 and SGC790l cells ; in AGS cells , PKM2 came into play as a stimulus and promoted cell migration and invasion .","We next investigated MMP7 expression using RTPCR in AGS-sipk cells and the control cells ."}	{"4B ) .","The activity of ERKl / 2 was obviously higher in AGS-pu6 cells compared with AGS-sipk cells after o h and 24 h treatment with EGF ( Fig ."}	epidermal growth factor
MENTION_GENE_SCPDFS_20571.pdf_304_2_2	MTHFR	{2}	{Homocysteine,",",MTHFR,gene,polymorphisms,",",and,cardio,—,cerebrovascular,risk,.}	{"1 , 199-208 .","Trabetti , E. , 2008 ."}	{"J. Appl .","Genet ."}	methylenetetrahydrofolate reductase
MENTION_GENE_journal.pone.0056749.pdf_466_5_5	DSP	{5}	{lmmunohistochemical,detection,of,osteocalcin,",",DSP,and,MEPE,after,treatment,with,MEPE-ASARM,peptides,.}	{"20 pm 20 um - 20 um \\" 20 um","Figure 5 ."}	{"SHED cell cultures were maintained in nonmineralizing ( NM ) or mineralizing ( M ) conditions in the absence or presence of 20 uM of either phosphorylated ( pASARM ) or nonphosphorylated ( np .","— ."}	dentin sialoprotein protein
