mention_id	entity_name	mention_pos	words	sentences_before	sentences_after	definitions
MENTION_GENE_SCPDFS_20509.pdf_44_0_0	CFD	{0}	{ADN,",",also,named,Acrp30,or,adipoQ,_,(,Wang,et,al.,",",2005,),",",is,a,30,kDa,adipocytokine,hormone,containing,244,amino,acids,.}	{"be one of the hormones inﬂuencing the upregulation of genes .","Adipose tissues produce and secrete various bioactive molecules ( Guzik et al. , 2006 ; Ahima , 2006 ) known as adipocytokines ( Ronti et al. , 2006 ) , including leptin , ADN , resistin , apelin , and visfatin ( Guzik et al. , 2006 ; Ronti et al. , 2006 ) ."}	{"This hormone contains an N — terrninal collagenous domain and a C — terrninal globular domain ( Scherer et al. , 1995 ; Waki et al. , 2003 ) .","ADN exists in the blood as low — molecular weight dimers or trimers and high — molecular weight complexes ( Waki et al. , 2003 ) ."}	adiponectin
MENTION_GENE_journal.pone.0010479.pdf_236_33_33	PEBP1	{33}	{It,is,",",however,",",possible,that,a,further,decrease,in,pH,",",particularly,in,the,range,near,the,pKa,of,carboxylates,(,4,—,4.5,),may,induce,substantial,changes,in,the,RKIP,pocket,structure,and,its,ligand-binding,properties,.}	{"The difference in the binding afﬁnity of PA between the two pH values can be explained by a change in the protonation state of the phosphate group of PA , suggesting that the microenvironment of the cell will determine the localized effect of ligand binding as well as protein-protein interaction .","RKIP binds more strongly to the di-anionic form than the mono-anionic form of the phosphate group ."}	{"Also in this study , we observed that there are conserved His residues that are sensitive to pH which suggests that they may be involved in localized protein-protein interaction and are not involved in ligand binding .","While prior structural information regarding binding of ligands to the conserved pocket of RKIP was limited to crystal structures that contained only small anions [ l7 , l9 ] , this work signiﬁcantly expands our knowledge of the chemical space for RKIP ligands and demonstrates a deﬁnitive speciﬁcity for phospholipids under near physiological conditions ."}	raf kinase inhibitory protein|^|raf-l kinase inhibitory protein
MENTION_GENE_journal.pone.0067298.pdf_456_7_7	DLC1|HP	{7}	{Lp6_830,Starch,synthase,35,lpp30l8,HP,Lp6_831,HP,22,|,pg2485,HP,Lp6_832,HP,32,|,pg20l5,ProC,Pyrro,|,ine,—,5,»,carboxy,|,ate,reductase,Lp6_833,Glycosyl,transferase,family,2,35,|,pg1183,HP,Lp6_976,HP,55,|,pg098l,HP,Lp6_977,YwfO,Phosphohydrolase,45,|,pg1267,HP,Lp6_l186,HP,Lp6_1249,XerD,lntegrase/recombinase,Lp6_2002,integ,rase,59,lpcl,833,HP,Lp6_2003,Protein,of,unknown,function,DUF1016,34,|,pg1228,HP,Lp6_2041,HP,50,|,ppO850,HP,Lp6_2164,HP,44,|,pg148O,MutH,DNA,mismatch,repair,protein}	{"— .","acety | » D » ga | actosamine dehydrogenase 23 | pg1942 3 — hydroxyacy | CoA dehydrogenase Lp6_829 UDP — glucose 4 — epimerase 33 | pg2214 Nuc | eoside — diphosphate sugar epimerase"}	{"Proteins were defined as divergent when they shared less than 65 % homology and 75 % coverage .","HP identiﬁes hypothetical proteins ."}	hypothetical proteins
MENTION_GENE_journal.pbio.0040113.pdf_48_56_56	APOC3	{56}	{Analysis,of,the,frequency,trend,with,age,(,in,centenarian,and,control,groups,combined,),for,polymorphisms,in,APOC3,and,CETP,(,Figure,1,),",",revealed,a,highly,signiﬁcant,(,p,<,0.0006,;,[,32,1.89,[,95,%,CI,",",0.2,—,3.6,],),monotonically,increasing,frequency,trend,for,homozygosity,for,the,APOC3,-641,C,allele,(,CC,),(,rs2542052,),",",and,near-signiﬁcance,(,[,3,=,3.06,[,95,%,CI,",",0.33,—,5.8,",",p,:,0.069,],),for,homozygosity,for,the,CETP,codon,405,valine,allele,(,VV,),(,rs5882,),.}	{"We studied 66 single nucleotide polymorphisms ( SNP ) in 36 candidate genes in pathways related to lipoprotein metabolism and other risk factors for CVD .","After applying the Bonferroni correction for multiple comparisons , two of the associations with exceptional longevity remained statistically signiﬁcant ."}	{"The CC genotype at position — 641 of APOC3 had a prevalence of 25 % among the centenarians and 20 % in their offspring compared with only 10 % in controls ( p = 0.0001 and [ 7 = 0.001 , respectively ) .","Five additional SNPs in APOC3 and six SNPs in CETP ( Figure 2 ) showed no evidence of association with longevity ."}	apolipoprotein c3|^|apolipoprotein c3 gene
MENTION_GENE_journal.pbio.1001283.pdf_589_44_44	MYLK3|MYLK	{44}	{(,E,",",F,),Time,—,course,(,E,),and,quantitative,summary,at,30,min,(,F,),after,the,conditioning,stimulus,of,the,blockade,of,spinal,synaptic,potentiation,by,ML,—,7,",",an,inhibitor,of,myosin,light,chain,kinase,(,MLCK,),(,n,=,8,slices/group,),.}	{"Note increased staining in superficial neuropil as well as cell bodies .","Scale bars : 100 pm ."}	{"( G ) MLCK blockade does not significantly affect basal transmission upon dorsal root stimulation ( 3 mA ) .","doi :10.1371 / journa | ."}	myosin light chain kinase
MENTION_GENE_journal.pone.0041776.pdf_318_14_14	APP	{14}	{In,contrast,",",when,Tip6OE431QA,was,expressed,in,the,nervous,system,in,combination,with,APP,or,APP,dCT,",",it,resulted,in,partial,lethality,wherein,only,a,fraction,of,the,F1,progeny,in,each,of,these,cases,died,as,second,and,third,instars,",",respectively,similar,to,that,seen,in,APP,;,Tip6OE431Q,B,and,APP,dCT,;,Tip60E431QB,ﬂies,.}	{tO02,"was dependent upon the Tip6O interacting C-terminal domain of APP ( Table 3 ) ."}	{"However , the majority of F1 progeny did not have any lethal developmental effect ( Table 2 ) .","This milder effect observed with Tip60E431Q A expressing ﬂies is likely due to the low level of dTip6O HAT mutant that is expressed in these ﬂies ."}	amyloid precursor protein
MENTION_GENE_journal.pone.0061788.pdf_569_12_12	VEGFA	{12}	{The,TNBC,subtypes,previously,identiﬁed,[,18,],demonstrated,similar,expression,of,VEGF,-,and,semaphorin-related,genes,with,the,exception,of,the,mesenchymal,stem-like,subtype,.}	{"However , it would not be expected to beneﬁt from an anti-VEGFA therapy ; instead , a different target would be needed to inhibit angiogenesis .","This is supported by a report that low IHC staining of VEGFC and NRP1 is associated with improved progression-free survival in patients receiving bevacizumab , while the level of VEGF A was not associated with changes in progression-free survival [ 56 ] ."}	{"This subtype was noted for its enrichment of genes involved with migration and growth factor pathways , including KDR [ 18 ] .","Here , we found a cluster of angiogenesis-related genes with increased expression in the MSL subtype , including VEGFC and KDR ( TNBC cluster M in Figure 5 , corresponding to tumor cluster D in Figure 4 ) ."}	vascular endothelial growth factor
MENTION_GENE_journal.pone.0028216.pdf_153_0_0	EGFR	{0}	{EGFR,is,activated,by,NTHi,in,middle,ear,epithelial,cells,.}	{EGFR,"Figure 1 ."}	{"HMEEC — 1 cells were treated with NTHi for the time indicated , then were lysed and blotted with anti .","— ."}	epidermal growth factor receptor
MENTION_GENE_SCPDFS_26570.pdf_277_33_33	MBP|PRG2	{33}	{I,gene,activity,",",stages,E7,+8,h,E7,+12,",",E7,+,16,",",E7,+20,h,",",and,is,no,longer,detected,at,stage,E7,+24,h.,After,adsorption,with,the,MBP,—,BhB10,—,1,fusion,protein,",",the,anti,.}	{"the period of BhB10 .","— ."}	{"— .","BhBlo ."}	maltose binding protein
MENTION_GENE_journal.pone.0008857.pdf_60_27_27	SLC27A1	{27}	{A,database,search,for,sequences,similar,to,human,FATP,members,revealed,homologues,in,various,animals,",",including,the,simple,multicellular,animal,",",Caenor/zabditir,elegans,",",suggesting,that,FATP,plays,a,fundamental,role,in,animals,[,14,],.}	{"A mouse strain , wrin/cle — ﬁee ( 1/U09 ) , containing a spontaneous mutation that abrogates Fatp4 expression , and Faz : b4-KO mice display features of lethal dermatology , such as tight , thick , shiny skin and a defective skin barrier , and die shortly after birth , symptoms that are strikingly similar to those of a human skin disease called restrictive dermopathy [ 3,4,5 ] .","How Fatp4 contributes to the skin barrier function , however , is unknown ."}	{"Here we characterized two C. elegans FATP genes , acs — 20 and acs — 22 , and revealed that C. elegans FATPs are involved in forming the cuticle barrier and can be substituted for by human Fatps ‘ .",Results}	fatty acid transport proteins
MENTION_GENE_journal.pone.0050394.pdf_454_11_11	VEGFA	{11}	{The,importance,of,TLR4,independent,CD14,signaling,in,the,induction,of,VEGF,by,Prxl,is,unclear,.}	{"CD14 is a co-receptor for TLRs1 — 4 and TLR6 .","CD14 has recently been shown to signal independently of TLRs and activate Src family kinases leading to activation of PLCY2 , which can trigger NF-KB activation [ 46 ] ."}	{"Furthermore , our previous study indicated that Prxl may bind additional receptors that have not been identiﬁed [ 15 ] .","These receptors could synergize with TLR4 to promote VEGF expression in endothelial cells ."}	vascular endothelial growth factor
MENTION_GENE_journal.pgen.1003792.pdf_87_18_18	APP	{18}	{"\\\\",/,Ve,found,that,overexpression,of,APP,led,to,pT668-APP,accumulations,in,the,photoreceptor,axons,",",whereas,APP,and,nebula,co-overexpression,signiﬁcantly,enhanced,the,delivery,of,pT668-APP,to,synaptic,terminals,in,the,medulla,(,Fig,.}	{"1D ; yellow arrow head ) .","Previous studies have shown that APP phosphorylated on threonine 668 ( pT668-APP ) is preferentially transported in axons [ 37 ] , we thus further monitored the distribution of pT668-APP ."}	{"1D ) .","These results suggest that APP overexpression may lead to blocked transport that is alleviated by Nebula ."}	a_myloid precursor protein|^|amyloid precursor protein
MENTION_GENE_SCPDFS_26098.pdf_439_10_10	RUNX1	{10}	{TLE,",",the,human,homolog,of,groucho,",",interacts,with,AML1,and,acts,as,a,repressor,of,AML1-induced,transactivation,.}	{"274 , 31557 — 31582 .","Imai , Y. , Kurokawa , M. , Tanaka , K. , Friedman , A.D. , Ogawa , S. , Mitani , K. , Yazaki , Y. , Hirai , H. , 1998 ."}	{"Biochem .","Biophys ."}	gene encoding acute myeloid leukemia protein 1 ( amli )
MENTION_GENE_journal.ppat.1000921.pdf_468_0_0	MSLN	{0}	{MPF,alone,also,activates,macrophages,and,increased,uptake,of,SchuS4,.}	{g006,"treated cells had signiﬁcantly more intracellular bacteria compared to untreated cells ( p < 0.05 ) ( Table 2 ) ."}	{"Thus , it is possible that the exacerbation of infection observed in macrophages treated with either CLDC or MPF alone may be a direct result of increased phagocytosis in the absence of effective killing .","In contrast to exacerbation of infection in mice treated with CLDC alone , we observed a small increase in the mean time to death among animals treated with CLDC alone 3 days prior to infection ( Table 3 ) ."}	membrane protein fraction|^|membrane protein fractions
MENTION_GENE_journal.pone.0011343.pdf_44_7_7	HSP90B2P	{7}	{Recently,",",the,heat,shock,proteins,(,HSP,),96,and,HSP22,",",ligands,for,TLR2,and,4,","}	{"Recent studies have demonstrated that endogenous nucleic acids may activate plasmacytoid dendritic cells ( pDC ) via TLR7 and TLR9 , leading to the production of Type I interferons ( INFoc / [ 7 ] , that may drive many of the clinical features of systemic lupus erythematosis ( SLE ) [ 8 ] .","Experimental models of SLE using TLR7 and / or TLR9-deﬁcient mouse strains have further clariﬁed the role that these receptors play in the production of autoantibodies and in the development of immunopathology ( reviewed in [ 9,10 ] ."}	{"respectively , have been reported to play a role in the development of or exacerbation of rheumatoid arthritis [ 11,12 ] .","Whether alterations in TLR-mediated immune responses to foreign ligands such as PAMPs contribute to the increased susceptibility to infections seen in affected patients is unclear ."}	heat shock proteins
MENTION_GENE_SCPDFS_45090.pdf_14_15_15	CD46|CAPG	{15}	{Studies,to,determine,the,genetic,organization,of,the,RCA,gene,cluster,have,shown,that,the,MCP,",",CR1,",",CR2,",",DAF,",",and,C4BP,genes,are,located,",",in,this,order,",",in,a,segment,of,800,kb,of,DNA,(,Rey-Campos,et,al.,",",1988,;,Carroll,et,al.,",",1988,;,Bora,et,al.,",",1989,),.}	{"— .","Campos et al. , 1988 ; Carroll et al. , 1988 ; Bora et al. , 1989 ; Rodriguez de Cordoba and Rubinstein , 1987 ) ."}	{"This group of genes is , however , some 7 cM ( ~ 7 Mb ) apart from that encoding factor H ( HF ) ( Rodriguez de Cordoba and Rubinstein , 1987 ) .","Using formal genetic analysis we have recently shown that the human gene encoding F13B ( F13B ) is linked to the RCA gene cluster and suggested that it is probably located in close vicinity to the HF gene ( Rodriguez de Cordoba et al. , 1988 ) ."}	membrane cofactor protein
MENTION_GENE_SCPDFS_25880.pdf_371_27_27	ETV4	{27}	{In,addition,",",a,potential,binding,site,for,the,transcription,factor,AP,—,1,is,detected,at,position,-73,and,",",although,less,likely,",",a,putative,PEA3,—,like,element,at,position,—,156,.}	{"Part of the nucleotide sequence according to the sequencing reactions from lanes 1 — 4 is shown on the left .","to the transcription start site ."}	{"A similar arrangement of TATA — box and AP — l site is found in many MMP promoters ( Fini et al. , 1998 ) .","For the collagenase promoter , the combination of the AP — 1 motif and PEA3 site has been reported to confer responsiveness to a variety of growth factors , oncogene products and tumor promoters ( Gutman and Wasylyk , 1990 ) ."}	polyoma virus enhancer a-binding protein 3
MENTION_GENE_SCPDFS_47872.pdf_342_15_15	PML	{15}	{et,al.,(,1997,),SMRT,co,—,repressor,interacts,with,PLZF,and,with,the,PML,—,retinoic,acid,receptor,or,(,RAROL,),and,3LZF/RARoc,oncoproteins,associated,with,acute,promyelocytic,eukemia,.}	{"CoR and histone deacetylase in Sin3 — mediated transcriptional repression .","Nature 387 , 49-55 - long , 8-H ."}	{"Proc .","Natl Acad ."}	promyelocyte gene
MENTION_GENE_SCPDFS_27186.pdf_207_5_5	BFSP2	{5}	{The,segregation,pattern,of,the,CP49,*,2,allele,in,the,backcross,progeny,was,compared,with,the,inheritance,of,previously,mapped,markers,.}	{"3.4 .","Linkage analysis of the chicken CP49 locus with other loci mapped in the East Lansing reference cross"}	{"The CP49 gene was mapped to chromosome 2 : COM0047A — 2.17 cM — CP49 — 23.2 cM ADL0257 ( data not shown ) .","The CP49 gene is located on human chromosome 3q2l — q25 ( Hess et al. , 1995 ) ."}	lens cytoskeletal protein of 49 kda
MENTION_GENE_journal.pmed.0020073.pdf_680_11_11	EGFR	{11}	{More,Information,Online,The,following,pages,contain,some,information,on,the,EGFR,kinase,inhibitors,.}	{"It is also important to find out what causes resistance in the other cases .","And knowing about this resistance mutation will help researchers to develop drugs that will work even against tumors with the mutation ."}	{"U. 5 .","Food and Drug Administration information page on Iressa ( geﬁtinib ) : http://www.fda.gov/cder/drug/infopage/iressa/iressaQ&A.htm Cancer Research UK information page about erlotinib ( Tarceva ) : http : / / www ."}	epidermal growth factor receptor
MENTION_GENE_journal.pone.0080385.pdf_212_30_30	DAG1	{30}	{This,optimization,is,time-consuming,and,expensive,when,proﬁling,lots,of,genes,using,high-throughput,technologies,such,as,48.48,microﬂuidic,dynamic,arrays,and,",",for,that,reason,",",the,method,used,by,DAG,expression,",",based,on,standard,curves,and,linear,regression,analysis,",",corrects,for,differences,in,PCR,efﬁciencies,between,target,and,endogenous,genes,without,the,need,for,further,qPCR,optimization,.}	{"The subtle differences observed between the two methods are most probably due to variations in the qPCR ampliﬁcation efficiencies obtained between experiments ( conventional qPCR vs microﬂuidic array ) , although slightly differences between measurement platforms can not be discarded [ 2 ] .","In the former experiment , qPCR of ELOVL6 and endogenous genes were optimized to obtain PCR efficiencies close to 2 and equal between target and endogenous genes ."}	{"On the other hand , our demo-results were compared with the results obtained using the mathematical model developed by [ 5 ] .","For this comparison , we used the target gene Genel7 , he reference gene Gene03 and the control sample 11 , obtaining also a high correlation coefﬁcient ( r = 0.999 ) ( Figure 3B ) ."}	data analysis gene
MENTION_GENE_SCPDFS_20396.pdf_29_25_25	PTGES3	{25}	{Abbreviations,:,MIC,",",micronucleus,;,MAC,",",macronucleus,;,HSP,",",heat,shock,protein,;,PIWI,",",P,—,element,induced,wimpy,testis,;,TEBP,",",telomere,—,binding,protein,;,POT,1,",",protection,of,telomeres,1,;,qRT,.}	{"A MAC develops anew from a MIC after sexual conjugation in a process that includes extensive DNA elimination , fragmentation , and ampliﬁcation .","As a result , the MAC contains a lower total DNA complexity than the MIC does , but"}	{"— .","PCR , quantitative realtime polymerase chain reaction ; MDP , macronuclear development protein ; MSC , mitochondrial solute carrier ; RPL29 , ribosomal protein L29 ; ORF , open reading frame ."}	telomere — binding protein
MENTION_GENE_journal.pmed.1000286.pdf_336_10_10	CRP|PPIAP10	{10}	{A,causal,role,in,disease,progression,is,still,possible,for,CRP,if,",",for,example,",",it,were,associated,with,thrombosis,and,necrosis,",",rather,than,the,development,of,atherosclerosis,.}	{"J \\" + PLoS Medicine | www .","p | osmedicine.org approaches , which in turn have questioned the role of CRP in disease onset ."}	{"The populations in our systematic review , compared to healthy population studies [ 6 ] , evaluated the role of higher initial CRP levels ( 2.3 versus 1.28 mg/l ) , shorter follow up periods ( median 2.5 y versus 3 — 2O y ) .","and higher annual risk of events ( 5.5 % versus < l % ) ."}	c — reactive protein
MENTION_GENE_journal.pone.0046275.pdf_583_5_5	CRP|PPIAP10	{5}	{A.,Sequence,analyses,of,the,CRP,binding,sites,of,fadL,",",fadD,and,fadH,.}	{"Figure 6 .","The cAMP-CRP complex binds the fadL , fadD and fadH promoters ."}	{"White letters shaded in black denote strictly conserved bases , bold letters in grey represent highly similar residues , and dots mean gaps .","The newly deduced CRP — binding site ( fadL1 of A ) binds the cAMP-CRP complex ( panel E whereas the CRP — binding site predicted earlier [ 17 ] ( abbreviated fadL2 ) does not ( panel C ) ."}	camp receptor protein
MENTION_GENE_SCPDFS_2877.pdf_734_10_10	TBP	{10}	{Eve,can,either,bind,to,the,TATA,binding,protein,(,TBP,),",",a,target,for,repression,(,Li,and,Manley,",",1998,;,Um,et,al.,",",1995,),",",or,bind,to,DNA,",",occluding,transcriptional,complex,formation,(,Austin,and,Biggin,",",1995,),.}	{"The presence of LiCl also reduced Eve phosphorylation in nuclear extracts , indicating that GSK3 phosphorylates Eve .","Eve silences gene transcription by interfering with the interaction between the general transcription factor TFIID and the TATA box within the promoter ."}	{"GSK3 — mediated phosphorylation can inhibit the TBP .","— ."}	tata binding protein
MENTION_GENE_journal.pone.0066597.pdf_308_28_28	HSP90B2P	{28}	{Insulators,were,inserted,between,the,polyA,sequence,under,the,control,of,HSP,promoter,and,TR3,",",and,also,inserted,into,the,boundary,region,of,the,two,promoters,",",HSP,and,Cgzstalline,to,prevent,position-effects,of,the,transgenes,.}	{"Ltd. , Osaka , Japan ) gene under the control of a mouse gamma F cpzstalline promoter [ 22 ] for selecting the proper transgenic lines .","It allowed us to select the embryos carrying HSPE Cre transgene by blue ﬂuorescence of their eyes without heat treatment ."}	{"The F1 embryos from wild type and Vectorinjected Fo were raised to sexual maturity and screened for germline transmission by a ﬂuorescent microscopy examining BFP expression .","Observation of fluorescent signals in brains slices of Tg line ( HuC : | oxP ."}	heat shock protein
MENTION_GENE_SCPDFS_21498.pdf_73_7_7	MST1|MSMB	{7}	{During,the,sequential,proteolytic,processing,of,the,MSP,—,7,precursor,",",a,22-kDa,carboxylterminal,fragment,is,secondarily,cleaved,to,yield,a,19-kDa,polypeptide,(,Supplementary,Fig,.}	{"MSP — 7 is another well — characterized member of the shed MSP — 1 complex ( Pachebat et al. , 2001 ) ( Fig .","1 ) ."}	{"1 online ) ; both the 22-kDa and the 19-kDa fragments associate with MSP — 1 ( Stafford et al. , 1996 ; Pachebat et al. , 2007 ) .","The Msp — 7 gene belongs to a tandem six — gene family ( with 2037 % amino acid identity between paralogs in the genome of the 3D7 clone ) on chromosome 13 ofP ."}	merozoite surface protein
MENTION_GENE_SCPDFS_33701.pdf_247_44_44	PCYT1B|CTBS	{44}	{Proteolysis,of,foreign,proteins,trapped,within,the,cytoplasm,of,E.,call,’,has,been,documented,(,Goff,et,al.,",",1984,),",",and,these,fragments,would,co,—,elute,with,the,chimera,",",as,long,as,they,retained,the,GM1,binding,site,of,CTB,.}	{"V1619 is an E. coli strain that carries pHK7 and expresses the truncated gtfB gene used to make the fusion ( Fig .3 ) .","Smaller immunopositive polypeptides were observed on the Western blot , especially to GTF , but these were postulated to be proteolytic degradation products ."}	{"One of these fragments ( 14 kDa ) produced a particularly strong reaction with both antisera .","This polypeptide appeared to be composed of CTB and a portion of GTF located near the junction of the fusion ."}	b subunit protein of cholera toxin
MENTION_GENE_journal.pone.0039066.pdf_476_24_24	EGFR	{24}	{",",Q,3,(,",3",3,9,Immunoprecipitation,studies,were,undertaken,in,all,animal,C,“,z,O,2,H,groups,to,ascertain,whether,EGFR,and,erbB2,could,be,co,’,_,‘,E,",",_,". . .",i,". . .",_,". . .",_,E,N,Ln,u,_,.}	{"Q. 32 , .",.}	{"Q precipitated an indicator of their co association or heterodimer","N o ‘ Ln I \\\\ Q : E"}	epidermal growth factor receptor
MENTION_GENE_SCPDFS_34340.pdf_440_0_0	NGF	{0}	{NGF,gene,.}	{"Both the coding region and the 3 ’ untranslated region of Mastomys 3-NGF share 95 \\" / , , homology with the mouse B .","— ."}	{"The 5 ’ region of Mastomys ,8 - NGF differs signiﬁcantly from the mouse [ 3-NGF sequence , however .","Thus , the longer precursors of mouse and Mastomys ,8 - NGF should differ at their N-terminal ends ."}	nerve growth factor
MENTION_GENE_journal.pone.0030773.pdf_58_18_18	DBP|GC|HSD17B4	{18}	{A,mathematical,model,for,estimation,of,‘,free,’,25OHD,and,"1,25",(,OH,),2D,based,on,DBP,concentration,and,affinity,Previous,studies,have,described,mathematical,models,to,estimate,serum,levels,of,‘,free,’,(,unbound,),25OHD,and,"1,25",(,OH,),2D,",",based,on,two-ligand-two-binding,protein,‘,steadystate,’,parameters,[,"10,22,23",],(,Figure,1,dark,text,and,arrows,),.}	{"This DBP mathematical model provides an important new tool for further analysis of the cellular actions of vitamin D but may also help to redefine parameters for vitamin D status used in clinical studies .",Results}	{"In each case , these models utilized a single binding coefficient for DBP binding of 25OHD and 1,25 ( OH ) 2D .","However , this does not reﬂect the natural variations in DBP binding affinity that occur as a consequence of group-speciﬁc component ( GC ) allelic inheritance ( Table 1 ) ."}	d binding protein
MENTION_GENE_journal.ppat.0020068.pdf_139_21_21	PTBP1|PTBP2	{21}	{PTB,Overexpression,Is,Sufficient,to,Cause,Virus,Production,by,Resting,CD4,+,T,Cells,from,Infected,Individuals,The,direct,binding,of,PTB,to,MS,HIV-1,RNA,",",and,the,differential,regulation,of,PTB,isoforms,with,T-cell,stimulation,",",suggested,that,PTB,might,act,as,a,positive,factor,for,HIV-1,gene,expression,.}	{"Three variants produce bands of 57-59 kDa , while the fourth variant of PTB has an apparent molecular weight of 25 l < Da .","Only the larger isoforms were upregulated following cellular stimulation , while total levels of the 25-kDa isoform ( PTBT ) decreased upon cellular stimulation ( Figure 2B ) ."}	{"To test this hypothesis , we generated expression constructs for various forms of PTB ( Figure 3A ) .","These included full-length PTB and a mutant form of fulllength PTB with a serine to alanine mutation in the nuclear export signal ( PTB ser-ala ) ."}	polypyrimidine tract binding|^|polypyrimidine tract binding protein|^|ptb with a serine to alanine mutation
MENTION_GENE_SCPDFS_24789.pdf_51_11_11	CREBBP|OPN1LW|PAG1	{11}	{Therefore,",",we,ﬁrst,cloned,the,nuclear,receptor-interaction,domain,of,rat,CBP,and,rat,p300,",",and,then,we,examined,whether,CBP,and,p300,differentially,interacted,with,the,two,major,subtypes,of,PPARs,expressed,in,the,small,intestine,",",i.e.,PPAROL,and,PPAR8,.}	{"Our previous study showed that several genes related to B-oxidation of fatty acids and those related to intracellular transfer of fatty acids and vitamin A are regulated by PPAR in the small intestine ( Mochizuki et al. , 2001a , b ; Suruga et al. , 1999a , b ) .","However , it is unclear between CBP and p300 which plays a major role in coactivation of PPARdependent genes in the small intestine ."}	{"2 .","Material and methods"}	creb-binding protein
MENTION_GENE_journal.pone.0021599.pdf_397_7_7	EGFR	{7}	{Columns,represent,relative,fold,change,of,phosphorylated,EGFR,as,compared,to,basal,level,:,SEM,.}	{"Kp-10 treatment resulted in a significant increase in EGFR phosphorylation ( One — way ANOVA followed by Dunnett 's multiple comparison test : * , P < 0.05 ) .","Basal levels of phosphorylated EGFR are regarded as 1 ."}	{"Data from three independent experiments .","( C ) Kp-10 stimulates MMP — 9 secretion and activity in breast cancer cells via an EGFR — dependent mechanism ."}	epidermal growth factor receptor
