mention_id	entity_name	mention_pos	words	sentences_before	sentences_after	definitions
MENTION_GENE_SCPDFS_24287.pdf_69_0_0	HSPA5	{0}	{BiP,binds,to,Irelp,and,PERK,in,unstressed,cells,",",thus,inhibiting,the,oligomerization,necessary,for,activation,of,these,ER,stress,sensors,(,Bertolotti,et,al.,",",2000,),.}	{"BiP expression can be increased by UPR , leading to its use as marker of ER stress in eukaryotic cells .","Another role for BiP as a functional constituent of UPR has been revealed in mammals ."}	{"BiP also binds to ATF6 , prohibiting ATF6 transport from the ER to the Golgi where proteolytic cleavage occurs ( Shen et al. , 2002 ) .","Accumulation of unfolded/misfolded proteins leads to dissociation of BiP from these ER stress sensors , allowing their activation ( Bertolotti et al. , 2000 ) ."}	luminal binding protein
MENTION_GENE_SCPDFS_22509.pdf_45_4_4	EIF2AK2	{4}	{Binding,of,dsRNA,to,PKR,through,these,motifs,causes,a,conformational,change,in,the,protein,that,leads,to,unmasking,of,the,ATP-binding,site,in,the,kinase,domain,and,results,in,autophosphorylation,of,PKR,on,several,sites,(,Galabru,and}	{"The dsRNA activation of PKR has been well-studied and characterized .","The dsRNA-binding domain ( DRBD ) of PKR resides at the amino terminus ( Green and Mathews , 1992 ; Patel and Sen , 1992 ) ( amino acids 1-170 ) and is composed of two copies of a dsRNA-binding motif ( dsRBM ) , a sequence motif conserved in many RNA-binding proteins ( St Johnston et al. , 1992 ) ."}	{"S. Fasciano et al. / Gene 388 ( 2007 ) 74-82 75","Hovanessian , 1987 ) ."}	rna-activated protein kinase
MENTION_GENE_journal.pone.0074359.pdf_64_9_9	MBP|PRG2	{9}	{Expression,with,a,non-cleavable,Nterminal,Maltose,Binding,Protein,(,MBP,),tag,and,C-terminal,Hise,tag,yielded,soluble,proteins,that,gave,crystals,",",but,these,crystals,did,not,diffract,X-rays,.}	{"PLOS ONE | www.pIosone.org at either G159 , G170 , A180 , or D192 of full length NR2E3 ( Figure 1 ) .","When expressed as His , Glutathione S-Transferase ( GST ) - or His 5Sumo-fusion proteins , all of them were poorly soluble and unstable ."}	{"Based on the poor behavior of these proteins and the weak conservation of the NR2E3 LBD N-terminus , we predicted that the NR2E3 LBD might not have an N-terminal helix 1 , which is a characteristic of the related orphan nuclear receptor Testicular Receptor 4 ( TR4 ) .","The Nterminal region of TR4 lacks a helical structure and instead adopts a long flexible loop that extends to the canonical helix 3 ( Figure 1 ) [ 39 ] ."}	maltose binding protein
MENTION_GENE_journal.pone.0054670.pdf_274_31_31	LIN9	{31}	{"\\\\",/,Ve,speculate,that,ASR602,would,first,hamper,TGS,initiation,on,the,supertransformed,ASR602,:,:,P35S,:,:,GUS,construct,",",simultaneously,preventing,the,supertransformed,construct,from,becoming,a,TGS,trigger,locus,(,loci,),",",and,consequently,TGS,would,not,occur,on,the,pre-existing,LUC,locus,.}	{"In this respect , the TGS-inducing system using the LUC plant is different from the ASR screening system using the tram-TGS plant , “ M66-9 ” , in which TGS already occurs at the pre-existing P35S : : Ced — 9 transgene loci ( Figures 1 and SlB ) .","In the TGS-inducing system ( Figure 2A ) , it would appear that the supertransformed P35S : : GUS construct become a TGS trigger locus ( loci ) , causing not only TGS on the supertransformed construct itself but also trans-TGS on the pre-existing LUC locus after supertransformation , although the mechanisms that make the supertransformed construct a TGS trigger locus ( loci ) remain unknown ."}	{"ASR602 , a species-speciﬁc sequence obtained from a genomic DNA library of L. japonicus , had no sequence characteristics similar to known scaffold / matrix attachment regions ( S/MARs ) using three prediction tools ( Text Sl ) .","Because we have not assessed experimentally whether ASRs can inﬂuence chromatin structure , our results at present do not rule out the possibility that ASRs have S/MAR-like or insulator-like activities ."}	transcriptional gene silencing
MENTION_GENE_journal.pbio.1001469.pdf_1037_4_4	VEGFA	{4}	{qRT-PCR,analysis,of,three,VEGF,A,isoform,and,angiopoietin-l,mRNA,expression,in,control,and,mutant,cortices,at,E16,.5,showed,no,signiﬁcant,differences,for,any,of,these,mRNAs,(,/,),>,0.4,and,I1,:,4,for,all,),.}	{"B ) and UVYA ( TIF )","Figure S7 Expression levels of VEGF A isoform and angiopoietin-1 mRNA are not affected in 0rc3/nestinwre mutant cortices at El6 .5 ."}	{"( TIF )","Figure S8 BAT-lacZ expression along cortical vessels during normal development and comparison of cortical Wnt ligand and inhibitor expression in 0rc3/nestz ' n — m > controls and mutants ."}	vascular endothelial growth factor|^|vascular endothelial growth factor * e — mai | : z.huang@neuro | ogy.wisc.edu
MENTION_GENE_journal.pone.0013470.pdf_292_21_21	EGFR	{21}	{All,of,these,cell,lines,also,exhibit,strong,tyrosine,phosphorylation,of,proteins,co-migrating,with,EGFR,",",suggesting,co-activation,of,MET,and,EGFR,signaling,in,this,group,.}	{"p | osone.org","( cluster 1 ) that is clearly separated from the other cell lines ."}	{"Information on MET and EGFR activation also allowed us to more broadly compare clustering results based on rosette and far-Western data .","This comparison revealed that four distinct clusters were common to both methods ( Fig ."}	epidermal growth factor receptor
MENTION_GENE_SCPDFS_28973.pdf_58_30_30	CRP|PPIAP10	{30}	{The,65-kDa,protein,encoded,by,CRP65,contains,645,aa,",",82,of,which,are,Cys,(,12.7,%,),",",many,occurring,in,the,motif,CXXC,",",typical,of,Gd,CRP,(,Gillin,et,al.,",",1990,),.}	{"The 5 ’ coding region of the gene is composed of 48 bp encoding a hydrophobic N terminus .","The downstream RR contains 4.2 copies of the 228-bp RU followed by 942 bp of the 3 ’ non-repeat region ( NRR ) ."}	{"( b ) Homology to CRP136 Analysis of the homology between CRP65 and CRP136 was carried out using the BESTFIT programme ( Smith and Waterman , 1981 ) in the GCG suite of programmes ( Devereux et al. , 1984 ) .","Results of the analysis indicated that the NRR of both proteins were highly homologous while the RR were different ."}	cysteine-rich protein ( s )|^|gene encoding crp
MENTION_GENE_journal.pone.0071524.pdf_252_5_5	TRIM27	{5}	{In,these,",",localization,of,RFP,(,v,),and,GFP,(,vi,),expression,was,clearly,displayed,within,the,labelled,(,blue,),membrane,boundaries,.,'}	{"Green and blue ﬂuorescent light paths showed green ﬂuorescence in the EBL cell cytoplasm within membrane boundaries ( blue ) ( iv ) .","Both 2D images were then processed with Volocity software to generate their respective 3D images ."}	{"( IV ) Mergedflb CUIMSSK O RFP",.}	red fluorescent protein
MENTION_GENE_journal.pone.0022228.pdf_118_5_5	MT-ATP6	{5}	{Meanwhile,",",the,process,of,RP,generation,is,accelerated,due,to,the,interactions,between,repair,mRNA,and,DSB,.}	{"As acute IR is applied , DNA is broken down stochastically and the resulting DSB occur into a cell [ 2 ] [ 3 ] .","As a result of the interactions between repair gene and DSB , the process of repair mRNA generation is prompted in cellular response to genome stress ."}	{"Suppose RP is available around damage sites , a normal cell can start its selfrepair mechanism , and then DNA damage can be synthesized into DSBC after DSB combining with RP .","As a result , most of the resulting DSBs can be correctly ﬁxed , and the correct repair part of DSBCS ( rDSBCs ) can transfer the damage signal into downstream gene and their regulation pathways further ."}	repair protein
MENTION_GENE_SCPDFS_18675.pdf_231_31_31	MTHFR	{31}	{As,far,as,another,study,is,concemed,",",the,frequency,of,genetic,mutation,occurrence,in,Turkey,has,been,found,as,;,FVL,11.7,%,",",prothrombin,II,G20210A,5.6,%,",",MTHFR,C667T,30.4,%,",",and,MTHFR,A1298C,39.1,%,(,Tug,et,al.,",",201,1,),.}	{"Although MTHFR ( C677T , A1298C ) is seen more common in Turkish society and does not show any tendency for thrombosis solely , there can be a signiﬁcant tendency seen when it comes together with FVL ( Dolek et al. , 2007 ) .","Nonetheless , FVL and FII G20210A mutations are found in very close relationships with thrombosis in Turkish society ( Dolek et al. , 2007 ) ."}	{"While FV1691A was held responsible for DVT development at 34.2 % level , MTHFR 677T was held responsible for pulmonary embolism at 37 % level ( Tug et al. , 2011 ) .","In the absence of other etiologic factors ( such as ; trauma , recent surgery , pregnancy , and postpartum period , oral contraceptive use , infection , cancer , hormonal treatment ) among idiopathic venous thromboembolism patients , embolism develops ."}	methylene tetrahydrofolate reductase
MENTION_GENE_SCPDFS_18972.pdf_13_3_3	UMOD	{3}	{Uromodulin,gene,(,UMOD,),mutations,",",leading,to,abnormalities,of,uromodulin,intracellular,trafﬁcking,contribute,to,the,progress,of,the,disease,.}	{"Article history : Accepted 12 August 2013 Available online 27 August 2013","Background : Familial juvenile hyperuricemic nephropathy ( Fjl-IN ) is an autosomal dominant disorder characterized by hyperuricemia and progressive chronic kidney disease ."}	{"Methods : We did UMOD screening in three Chinese FJI-IN families .","We thus constructed mutant uromodulin 531/3/Eras : express plasmids by site — mutagenesis from wild type uromodulin vector and transfected them into HEK293 . . . . . ."}	uromodulin gene
MENTION_GENE_SCPDFS_21754.pdf_16_18_18	MSMB	{18}	{Although,these,proteins,exhibited,only,limited,sequence,identity,to,mammalian,prostatic,secretory,protein,of,94,amino,acids,(,PSP94,),",",the,topological,pattern,of,disulﬁde,bonds,in,SSPs,was,identical,to,that,of,the,mammalian,proteins,.}	{"Five small serum proteins ( SSPs ) with molecular masses of 6.5 — 10 kDa were detected in Habu ( Trimeresurus ﬂavoviridis ) serum ; this included two novel proteins SSP — 4 and SSP — 5 .","The amino acid sequences of these proteins and of SSP — 1 , SSP — 2 , and SSP — 3 , which were reported previously , were determined on the basis of the nucleotide sequences of their cDNAs ."}	{"SSP — 3 and SSP — 4 lacked approximately 30 residues at the C — terminal .","Each of the full — length cDNAs encoded a mature protein of 62-90 residues and a highly conserved signal peptide ."}	prostatic secretory protein of 94 amino acids
MENTION_GENE_journal.pone.0050584.pdf_228_25_25	CRP|PPIAP10	{25}	{When,plasma,ferritin,was,used,",",the,prevalence,of,ID,was,1,%,",",9,%,and,12,%,",",depending,on,whether,age,",",CRP,levels,or,none,of,them,were,considered,",",respectively,.}	{"Iron Deficiency Assessment with Iron Markers Prevalence of iron stores deﬁciency by the different markers according to their internationally accepted normal levels is shown in table 2 .","The proportion of children classiﬁed as iron deﬁcient ranged from 1 % using plasma transferrin or ferritin by age , to 77 % using transferrin saturation ."}	{"TIBC was associated with the lowest ID prevalence after plasma ferritin and transferrin ( Table 2 ) .","Table 3 shows the sensitivity and speciﬁcity of the different iron markers using the internationally accepted cut-off values and iron content in the bone marrow as reference ."}	c reactive protein
MENTION_GENE_journal.pone.0033359.pdf_64_45_45	MT-CO1	{45}	{Puriﬁed,nucleic,acids,were,resuspended,in,DNase-free,water,and,stored,at,—,20,°,C.,Universal,(,LCOI1490,+,HCOI2198,[,29,],),and,vesicomyid-speciﬁc,(,VesLCO,+,VesHCO,[,12,],),primers,were,used,to,amplify,a,partial,fragment,of,the,mitochondrial,COI,gene,.}	{"DNA extraction , amplification and sequencing Total genomic DNA from the adductor muscles of 29 C12 .","regab , three L. c/mm \\" , two I. perplexum , and one individual for each of the six remaining species , was isolated using the CTAB extraction method ( Doyle and Doyle 1987 ) ."}	{"PCR ampliﬁcations were carried out in 50 pl reactions with the following ﬁnal concentrations : 1 > < Taq DNA polymerase buffer ( Promega ) ,","lz ) PLoS ONE | www ."}	cytochrome oxidase i
MENTION_GENE_journal.pgen.0030180.pdf_188_18_18	DAPK3	{18}	{Yet,",",we,found,that,the,physical,interaction,between,the,catalytic,domain,of,DAPK,and,the,full-length,rat,ZIPK,was,similar,to,that,of,human,ZIPK/DAPK,interaction,",",suggesting,that,the,serine-to-proline,substitution,had,no,effect,on,the,binding,property,(,unpublished,data,),.}	{"The basic loop ( aa 45-57 , mostly positively charged ) , known as the ﬁngerprint of the DAP kinase family of proteins , is exposed on the surface of the catalytic domain , as shown in the crystal structure of another member , DAPK [ 19 ] .","Previous work has indicated that the basic loops of human ZIPK and DAPK are essential for a physical interaction between the two kinases , a process followed by trams-phosphorylation and ampliﬁcation of the death signals [ 8 ] ."}	{"Recently , though , it has been suggested that serine 50 in human ZIPK undergoes autophosphorylation ( A. P. Turnbull et al. , Protein Data Bank entry 2 ] 90 ; http://www.rcsb.org/pdb/explore/explore .","do ?"}	zipper interacting protein kinase
MENTION_GENE_gb-2012-13-10-r88.pdf_301_3_3	AKR1B1|AR	{3}	{The,proportions,of,AR,binding,regions,that,mapped,to,poised,",",LNCaP-induced,DHS,sites,only,and,to,ADNase,regions,were,consistent,across,each,AR,binding,data,set,(,Figure,S2C,in,Additional,ﬁle,1,),.}	{"As expected , AR ChIP — seq peaks identified only within LNCaP-induced DHS sites ( Region III , Figure 3c ) show significant overlap with ADNase increase regions .","Interestingly , AR binding sites in peaks found in both LNCaP and LNCaP-induced cells ( Region 11 , Figure 3c ) were also enriched for ADNase increases , although not to the same extent as those sites that mapped only within LNCaPinduced DHS sites ."}	{"Analogously , we found that 36.5 % of strict ADNase increases and 16.7 % of loose ADNase increases overlapped the high confidence AR binding set ( All AR Intersect ) ( Figure S2D in Additional file 1 ) .","These observations indicate that although AR binding occurred within DNA in a poised open chromatin state , a substantial increase in chromatin accessibility occurred in many of these regions after AR activation ."}	androgen receptor
MENTION_GENE_journal.pone.0000621.pdf_460_13_13	TNF	{13}	{As,subsequent,evolution,and,speciation,events,proceeded,",",nucleotides,involved,in,induction,of,TNF,gene,expression,in,response,to,bacterial,infection,(,LPS,or,MTb,),of,monocytic,cells,",",rather,than,activation,of,T,cells,",",became,ﬁxed,in,the,gibbon-orangutan,and,the,African,great,ape,clades,.}	{"Variation at the upstream Sp ] site in the TNF promoter does not occur along geographic lines across all primate families , however : in all species of the Cercopithecidae ( OWM ) family examined in this study , including those native to Asia [ Francois ’ langur ( Trao/yzpit/zecus ﬁarzooisz ) and the red-shanked douc ( lﬁzgaﬂzrix rzemaeus ) ] , the upstream Spl site is identical to the human sequence ( see Figure 7A ) .","It is intriguing to speculate that the environmental conditions , perhaps consisting of novel pathogens that confronted the diverging populations derived from a common ancestor of Old World monkeys and the small and great apes , provided selective pressure on the TNF promoter locus ."}	{"For orangutans and gibbons , the considerable geographic ﬂux of the Malay Archipelago region of southeast Asia over millions of years , alternately isolating and reuniting local animal populations in the course of their adaptation and speciation [ 96 ] , may have contributed to ﬁxed genetic differences at the upstream Spl site of the TNF promoter .","Indeed , based on comparisons between human and chimpanzee genome sequences , positive selection has been proposed to have a greater inﬂuence in 5 ' untranslated regions as compared to protein coding regions [ 98 ] ."}	tumor necrosis factor
MENTION_GENE_journal.pone.0102204.pdf_17_29_29	HSP90B2P	{29}	{In,the,liver,",",oxidation,of,protein,was,alleviated,during,acute,heat,challenge,(,P,<,0.05,),",",however,",",gene,expression,HSF2,",",3,and,4,and,HSP,70,were,highly,induced,(,P,<,0.05,),.}	{"In the heart , acute heat challenge affected lipid oxidation ( P = 0.05 ) and gene expression of all 4 HSF gene expression was upregulated ( P < 0.05 ) .","During chronic heat treatment , the HSP 70 mRNA level was increased ( P < 0.05 ) and HSP 90 mRNA ( P < 0.05 ) was decreased ."}	{"HSP90 expression was increased by chronic thermal treatment ( P < 0.05 ) .","In the muscle , both types of heat stress increased protein oxidation , but HSFs and HSPs gene expression remained unaltered ."}	heat shock protein
MENTION_GENE_SCPDFS_26234.pdf_46_17_17	PTTG1	{17}	{However,",",the,mechanisms,that,regulate,the,expression,of,PTTG,in,tumors,and,the,mechanisms,utilized,by,PTTG,to,induce,cellular,transformation,remain,unknown,.}	{"With the exception of the testis , the levels of PTTG mRNA are either low or undetectable in normal human tissues .","Overexpression of PTTG in mouse ﬁbroblast cells ( NIH 3T3 ) resulted in an increase in cell proliferation and induced cellular transformation in vitro , as well as promoted tumor formation in nude mice in vivo ."}	{"0378-1119/99 / $ - see front matter © 1999 Elsevier Science B.V. All rights reserved .","PII : S0378-1119 ( 99 ) 00446-1"}	pituitary tumor transforming gene
MENTION_GENE_journal.pone.0023159.pdf_507_6_6	TBP	{6}	{How,Rrdl,might,operate,upstream,of,TBP,is,unclear,",",although,it,could,be,through,the,ability,of,Rrdl,to,activate,phosphatases,[,l7,",",l8,",45",],.}	{"k PLoS ONE | www .","p | osone.org to promoters to stimulate or repress transcription by regulating TBP and PIC assembly [ 4,5,8,42,43,44 ] ."}	{"For example , Rrdl could regulate a speciﬁc phosphatase thereby altering the recruitment of transcription factors and PIC assembly .","\\\\ / Ve note that TBP remained promoter-bound on a subset of down regulated genes from which RNAPII dissociated in response to rapamycin ."}	tata binding protein
MENTION_GENE_SCPDFS_22432.pdf_30_11_11	SH2D3A	{11}	{Abbreviations,:,BCAR3,",",breast,cancer,antiestrogen,resistance,locus,3,;,NSP1,",",novel,SH2-containing,protein,1,;,PCR,",",polymerase,chain,reaction,;,SHEP1,",",SH2,domain-containing,Eph,receptor,—,binding,protein,1,;,RT-PCR,",",reversetranscription,PCR,.}	{"Only three related proteins are known to contain both an SH2 domain and a domain similar to guanine nucleotide exchange factor domains for Ras family GTPases .","They are SHEP1 ( SH2 domain-containing Eph receptor — binding protein 1 , also known as CHAT , and NSP3 ; gene name SHZD3 C ) ( Dodelet et al. , 1999 ; Lu et al. , 1999 ; Sakakibara and Hattori , 2000 ) , BCAR3 ( breast cancer antiestrogen resistance locus 3 , also known as AND — 34 , SHEP2 , NSP2 and SH2D3B ; gene name BCAR3 ) ( van Agthoven et al. , 1998 ; Cai et al. ; 1999 ; Dodelet et al. , 1999 ; Lu et al. ,"}	{"* Corresponding author .","The Burnham Institute for Medical Research , 10901 N. Torrey Pines Rd. , La Jolla , CA 92037 , United States ."}	novel sh2-containing protein 1
MENTION_GENE_SCPDFS_2895.pdf_659_6_6	MST1|MSMB	{6}	{Our,results,support,the,model,that,MSP,and,SOD,—,1,act,antagonistically,to,control,ROS,and,MPI,(,.}	{"P56S acts as a dominant negative mutation in multiple model systems and prevents VAP MSP domain secretion in ﬂy cells ( Ratnaparkhi et al. , 2008 ; Teuling et al. , 2007 ; Tsuda et al. , 2008 ) .","Dominant mutations in sod1 are also associated with ALS and these are gain of function ( Rosen et al. , 1993 ; Rothstein , 2009 ) ."}	{"— .","1 signaling ."}	major sperm protein
MENTION_GENE_journal.pone.0012819.pdf_30_12_12	EGFR	{12}	{Activating,mutations,",",receptor,overexpression,and,other,modes,of,signal,ampliﬁcation,from,EGFR,can,prohibit,the,proper,attenuation,of,the,signal,",",and,have,been,linked,to,causing,a,range,of,cancers,",",particularly,lung,cancer,[,"5,6,7",],.}	{"EGFR is activated by speciﬁc ligands , including EGF and transforming growth factor cx ( TGF - Of ) , which stimulates receptor dimerization and the onset of intrinsic tyrosine kinase activity [ l ,2,3 ] .","This in turn results in the autophosphorylation of multiple residues within the intracellular region [ 4 ] , a mechanism common to various tyrosine kinases , leading to downstream signaling and changes to cell phenotype ."}	{"As as result , EGFR regulation has become the focus of many research laboratories .","Given that the kinase can undergo rapid autophosphorylation , it is imperative that a mechanism is in place to strictly control receptor signaling ; one key mechanism is through cCbl-mediated ubiquitination and degradation ."}	epidermal growth factor receptor
MENTION_GENE_SCPDFS_41713.pdf_23_22_22	MBP|PRG2	{22}	{The,genes,of,a,number,of,myelin,membrane,proteins,",",e.g.,",",proteolipid,protein,(,PLP,),",",myelin,basic,protein,(,MBP,),",",myelin-associated,glycoprotein,(,MAG,),",",and,myelin,oligodendrocyte,glycoprotein,(,MOG,),",",and,enzymes,responsible,for,the,biosynthesis,of,myelin,lipids,are,expressed,speciﬁcally,in}	{INTRODUCTION,"Oligodendrocytes are the myelinating glia cells of the central nervous system ( CNS ) ."}	{"Sequence data from this article have been deposited With the EMBL/GenBank Data Libraries under Accession Nos. .","U30930 , U31353 , U31461 , U31658 , U31861 , and U32370 ."}	myelin basic protein
MENTION_GENE_journal.pone.0102003.pdf_259_38_38	GFAP	{38}	{Mice,were,killed,at,12,hours,post,dosing,by,focused,microwave,irradiation,for,analyses,of,pSTAT3,‘,y,',7,°,5,by,quantitative,immunoblotting,or,were,killed,by,decapitation,at,72,hours,post,dosing,for,analyses,of,GFAP,and,TH,by,ELISA,.}	{"STAT3 activation , like GFAP up regulation , results from damage associated with multiple models of neurotoxicity : evidence from neuroprotective agents .","Mice were administered MPTP , METH , or KA alone or after pretreatment with nomifensine ( for MPTP ) , ethanol or low ambient temperature ( for METH ) or diazepam ( for KA ) ."}	{"Striatal samples were assayed after MPTP and METH and hippocampal samples were assayed after KA .","Representative immunoblot data from two different animals for each treatment condition are presented above the quantitative data obtained from scans ."}	glial fibrillary acidic protein
MENTION_GENE_SCPDFS_26209.pdf_661_2_2	CNBP	{2}	{A,short,CNBP,transcript,",",lacking,the,same,part,of,the,coding,region,",",is,constantly,present,in,various,species,.}	{"Both gene copies can generate alternative transcripts","( OL and B ) ."}	{"In Xenopus , however , the short transcript is generated by removing a different , but contiguous , portion of the coding region .","4 ."}	cellular nucleic acid — binding protein
MENTION_GENE_SCPDFS_18902.pdf_200_11_11	CRP|PPIAP10	{11}	{Male,Sex,Hypertension,Diabetes,Smoking,Obesity,MetS,TC,TG,HDLc,LDLC,CRP,level,C,allele,CRP}	{"Table 4 Risk factors of PCAD .",Variable}	{"Unstandardized coefﬁcients B Standard error 0.055 0.03 0.16 0.037 0.07 0.039 0.19 0.035 0.083 0.039 0.021 0.035 0.13 0.06 0.021 0.027 — 0.015 0.03 0.1 0.06 0.34 0.014 0.098 0.036","T. / l. Abd El ."}	c — reactive protein
MENTION_GENE_journal.pone.0025115.pdf_302_17_17	CD46|CAPG	{17}	{For,precipitation,Myc-tag,antibody,prior,to,immunostaining,against,Xpress,tag,of,IE1,",",pUL56,",",pULl04,and,MCP,was,used,.}	{"5B ) .","To further examine whether interactions between pUL77 and packaging proteins are obtained with solitary expressed proteins co-immunoprecipitation in 293T-transfected cells were performed ."}	{"In precipitates monomers of pUL56 , pUL104 and MCP were","A PLoS ONE | www ."}	major capsid protein
MENTION_GENE_SCPDFS_38724.pdf_254_24_24	REG1A|HRSP12|PSPN|BPIFA2|MSMB|PSPH	{24}	{Within,the,PSP,family,",",the,sequence,identity,was,low,",",ranging,typically,from,30,to,43,%,",",with,pig,PSP,and,human,PSP,sharing,a,higher,pair-wise,identity,of,56,%,",",rising,to,90,%,in,the,signal,peptide,region,(,Fig,.}	{"72 ° C 2 min , 30 cycles pig PSP sequences as the starting point .","This procedure identiﬁed that pig PSP was not only homologous to the PSP family , but also similar to the BPI/PLUNC family ( bactericidal/permeability-increasing protein ) to an extent [ 17,18 ] ."}	{"2A ) .","A weak sequence similarity was noted between pig PSP and the BPI/PLUNC family ( data not shown ) ."}	parotid secretory protein
MENTION_GENE_journal.pone.0091132.pdf_240_2_2	MZB1|ADCYAP1	{2}	{Furthermore,",",PACAP,increases,the,expression,of,vesicular,monoamine,transporter,VMAT,",",a,protein,responsible,for,packaging,monoamine,into,secretory,vesicles,[,"15,51",],.}	{gOO4,"extracellular Ca2 + signaling mechanisms [ 50 ] ."}	{"In addition to increasing quantal size , TEM measurements demonstrate that PACAP enlarges both vesicle and halo volumes .","The ﬁndings are consistent with previous data showing that increased quantal size is accompanied by correspondingly enlarged vesicle volume [ 33 — 39 ] ."}	pituitary adenylate cyclase activating polypeptide
MENTION_GENE_SCPDFS_29208.pdf_145_13_13	PDLIM4	{13}	{The,CLP-36,LIM,domain,",",which,is,identical,in,30/51,aa,to,rat,RIL,LIM,domain,",",is,more,closely,related,to,the,LIM,domain,of,the,RIL,(,Kiess,et,al.,",",1995,),than,other,C-terminal,LIM,domain,proteins,.}	{"There were no other LIM domains , homeodo — mains or transactivation domains detectable in the predicted CLP-36 aa sequence .","and thus it was considered a novel member of the C-terminal LIM domain protein ."}	{"In contrast to the N terminus ( aa 1-89 ) and C terminus ( aa 192-327 ) , there is no signiﬁcant sequence conservation between CLP-36 and Rat RIL in the central portion ( aa 90-191 ) , although both are rich in Ser ( 16.3 % and 15.5 % , respectively ) and Pro ( 11.1 % and 12.5 % , respectively ) .","An abundance of Pro in the central portion of CLP-36 protein ( aa 90-191 ) would be expected to affect signiﬁcantly the overall structure"}	reversioninduced lim protein
