relation_id	relation_name	gene_words	hpoterm_words	words	sentences_before	sentences_after	expectation	gene_expectation	hpoterm_expectation	features	weights
RELATION_GENEHPOTERM_SUP_MAP_journal.pone.0086790.pdf_612_612_0_0_16_16_UNSUP	DOCK8/HP:0000964|Eczema	{0}	{16}	{DOCK8,deﬁciency,results,in,autosomal,recessive,hyper-IgE,syndrome,with,severe,allergic,manifestations,",",characterized,by,severe,eczema,",",recurrent,skin,infection,",",mucocutaneous,candidiasis,",",elevated,serum,IgE,levels,",",and,eosinophilia,[,33,],.}	{"These genes may provide explanations for the phenotype of STAT5B-deﬁcient patients ( Table 8 ) .","For example , DOCK8 is critical to IgE production and to the survival and function of peripheral CD8 + T cells in humans and mice [ 32 ] ."}	{"These characteristics align with previous reports from our group of increased serum IgE levels , decreased CD8 + T cell number , and severe eczema in STAT5B-deﬁcient patients [ 1 1,34 ] , and suggest these characteristics of STAT5B deﬁciency may be related to downregulation of DOCK8 in the absence of STATSB .","SNX9 ( sorting nexin 9 ) encodes subunits of WASp ( Wiskott-Aldrich syndrome protein ) / SNX9/p85/CD28 , a complex involved in signal transduction of CD28-mediated T cell co-stimulation [ 35 ] ."}	1	1	1	{"EXT_NGRAM_[NULL]_[,]",VERB_[characterized],INT_NGRAM_[deﬁciency]_[severe],MIN_VERB_GENE_[result]_HPO_[characterize],VERB_[results]}	{3.13771,1.71428,1.57821,0.871015,-0.0498702}
RELATION_GENEHPOTERM_journal.pone.0099331.pdf_455_455_27_27_24_25	MT/HP:0010075|Duplication of the 1st metatarsal	{27}	{24,25}	{Cre,mice,showed,much,narrower,sagittal,and,interfrontal,sutures,(,arrows,;,B,),and,had,additional,toe,(,arrow,),originating,from,a,duplicated,metatarsal,(,MT,;,D,),",",but,the,femurs,and,tibiae,showed,no,apparent,difference,between,two,groups,(,C,),.}	{"Cre mice ; The Twistlﬂ ” / + ; Sox2 .","— ."}	{"( E ) Plain X-radiography of the hind limbs xix / +","from 7-day-old control and Twist } / I ; S0x2 ."}	0.992	1	0.008	{INV_WORD_SEQ_LEN_[1],INV_WORD_SEQ_[(],INV_WORD_SEQ_NER_[(],INV_MIN_VERB_[originate],INV_POS_SEQ_[NN],INV_DEP_PATH_[@amod],INV_INT_NGRAM_[(]_[(],INV_EXT_NGRAM_[a]_[;]}	{-13.9342,10.2313,3.57571,1.60897,1.33604,1.21634,0.697516,-0.272853}
RELATION_GENEHPOTERM_journal.pone.0067059.pdf_153_153_36_36_9_10	IL-6/HP:0006280|Chronic pancreatitis	{36}	{9,10}	{YKL-40,",",IL-6,and,CA,19.9,in,Patients,with,Chronic,Pancreatitis,Patients,with,chronic,pancreatitis,had,higher,plasma,YKL-40,(,median,102,pg/1,",",35,%,had,elevated,level,compared,to,upper,normal,level,),",",IL-6,(,3.5,ng/1,",",27,%,),and,serum,CA,19-9,(,15,KU/1,",",25,%,),compared,to,healthy,subjects,.}	{"Low correlations were found between plasma IL-6 and CA 19.9 ( rho = 0.22 , p < o. oool ) .","No correlations were found between age and plasma IL-6 ( rho = 0.03 ) and serum CA 19.9 ( rho = 0.02 ) ."}	{"Patients with chronic pancreatitis had signiﬁcantly lower concentrations of all three biomarkers compared to patients with PC ( all stages combined ) ( YKL-40 p = 0.047 ; IL-6 p < o. oool , CA 19-9 p < o. oool ) ( Supplementary Figure 1 ) .","OS and Pre — treatment YKL-40 , IL-6 and CA 19.9 in Patients Operated for PC Univariate Cox analysis of patients undergoing surgery for PC showed that elevated pre-treatment plasma IL-6 and serum CA 19.9 ( dichotomized according to normal levels ) , but not plasma YKL-40 were associated with short OS , Table 2 ."}	0.994	1	1	{"INV_INT_NGRAM_[patient]_[,]",INV_MIN_VERB_GENE_[have]_HPO_[compare],INV_VERB_[compared],INV_EXT_NGRAM_[with]_[(],INV_VERB_[had]}	{2.85521,2.41792,-1.86179,1.26174,0.0164325}
RELATION_GENEHPOTERM_journal.pone.0036125.pdf_15_15_6_6_16_17	DNMT3B/HP:0003003|Colon cancer	{6}	{16,17}	{Our,results,confirm,that,depletion,of,DNMT3B,specifically,reduced,the,proliferation,rate,of,DNMT3B,—,overexpressing,colon,cancer,cell,lines,.}	{"However , methylation changes have not been analyzed in detail yet .","Using RNA interference we reduced DNMT3B protein levels in colon cancer cell lines ."}	{"However , genome — sca | e DNA methylation proﬁling failed to reveal methylation changes at putative DNMT3B target genes , even in the complete absence of DNMT3B .","These results show that DNMT3B is dispensable for the maintenance of aberrant DNA methylation patterns in human colon cancer cells and they have important implications for the development of targeted DNA methyltransferase inhibitors as epigenetic cancer drugs ."}	0.996	1	1	{EXT_NGRAM_[of]_[cell],VERB_[overexpressing],VERB_[reduced],MIN_VERB_GENE_[reduce]_HPO_[overexpress],INT_NGRAM_[specifically]_[overexpress]}	{7.26619,-1.48054,-0.664698,0,0}
RELATION_GENEHPOTERM_SUP_MAP_journal.pone.0046130.pdf_12_12_3_3_8_9_UNSUP	WBS/HP:0000973|Cutis laxa	{3}	{8,9}	{Beuren,syndrome,(,WBS,),and,autosomal,dominant,cutis,laxa,(,ADCL,),.}	{"Major defects in the elastin gene ( ELN ) are associated with a number of disorders including Supravalvular aortic stenosis ( SVAS ) , Wi | | iams .","— ."}	{"Given the low turnover of elastin and the requirement for the long term durability of elastic fibres , we examined the possibility for more subtle polymorphisms in the human elastin gene to impact the assembly and | ong — term durability of the elastic matrix .","Surveys of genetic variation resources identified 118 mutations in human ELN , 17 being non — synonymous ."}	0.906	0.188	1	{MIN_VERB_GENE_[NULL]_HPO_[NULL],POS_SEQ_[NN_CC_JJ_JJ],INT_NGRAM_[)]_[dominant],WORD_SEQ_LEN_[4],DEP_PATH_[nn@conj_and],EXT_NGRAM_[(]_[(],"WORD_SEQ_NER_[) and autosomal dominant]","WORD_SEQ_[) and autosomal dominant]"}	{-3.59288,2.81361,1.73152,-1.64556,1.42213,1.18745,0.125186,0.125186}
RELATION_GENEHPOTERM_journal.pone.0094328.pdf_131_131_20_20_36_41	CAD/HP:0100545|Arterial stenosis	{20}	{36,41}	{CAD,patients,were,included,if,they,belonged,to,any,of,the,following,criteria,:,i,),angiographically,conﬁrmed,presence,of,CAD,with,>,70,%,stenosis,in,any,one,major,epicardial,artery,or,>,50,%,stenosis,in,two,or,more,arteries,",",ii,),having,past,history,of,myocardial,infarction,",",and,iii,),undergone/undergoing,percutaneous,transluminal,coronary,angioplasty,or,bypass,graft,surgery,.}	{"Brieﬂy , the IARS is an ongoing epidemiological study with an objective to investigate the genetic factors and biomarkers against a backdrop of the conventional cardiovascular risk factors in Asian Indians living in India .","Recruitment of cases and controls was based on predeﬁned inclusion / exclusion criteria ."}	{"Healthy volunteers who were clinically asymptomatic for CAD and other inﬂammatory disorders , enrolled from the same geographical area as that of the proband , having no family history of cardiovascular disease and showing normal ECG readings were treated as controls .","Informed consent was obtained from all the study participants ."}	0.936	1	0.008	{"EXT_NGRAM_[of]_[,]",MIN_VERB_GENE_[belong]_HPO_[belong],INT_NGRAM_[with]_[%]}	{2.78807,0,0}
RELATION_GENEHPOTERM_SUP_MAP_SCPDFS_23219.pdf_24_24_27_27_25_25	PEO/HP:0000602|Ophthalmoplegia	{27}	{25}	{To,date,over,40,disease,mutations,and,9,nonsynonymous,polymorphisms,in,POLG,have,been,found,to,be,associated,with,autosomal,recessive,and,dominant,progressive,extemal,ophthalmoplegia,(,PEO,),",",Alpers,syndrome,",",sensory,ataxia,",",neuropathy,",",dysarthria,and,ophthalmoparesis,(,SANDO,),",",Parkinsonism,",",and,male,infertility,.}	{"Human DNA polymerase ' y is composed of a 140-kDa catalytic subunit and a 55-kDa accessory subunit .","Mutations in the gene for the catalytic subunit ( POLG ) have been shown to be a frequent cause of mitochondrial disorders ."}	{"In this paper we review the literature of POLG mutations and discuss their impact on mitochondrial diseases .","We also describe a public access web database to annotate POLG mutations for the research community ."}	0.924	0.01	0.994	{INV_WORD_SEQ_LEN_[1],INV_WORD_SEQ_[(],INV_WORD_SEQ_NER_[NUMBER],INV_POS_SEQ_[CD],INV_DEP_PATH_[nn@nn],INV_INT_NGRAM_[(]_[(],INV_EXT_NGRAM_[extemal]_[)],INV_MIN_VERB_[associate]}	{-13.9342,10.2313,2.36405,2.12943,0.80522,0.697516,0.45507,-0.363879}
RELATION_GENEHPOTERM_journal.pone.0074991.pdf_45_45_17_17_42_43	CRS/HP:0012265|Ciliary dyskinesia	{17}	{42,43}	{Because,of,many,similarities,in,anatomy,and,function,between,upper,and,lower,airways,[,5,],",",CRS,may,also,manifest,in,lung,diseases,with,dysfunctions,of,the,mucociliary,apparatus,",",such,as,patients,with,cystic,fibrosis,(,CF,),or,primary,ciliary,dyskinesia,(,PCD,),[,6,],.}	{"The high number of surgical interventions in patients suffering from CRS [ 4 ] indicates that Chronic rhinosinusitis ( CRS ) isacommon chronic disease of medical treatment by oral , systemic or topical drug the upper airways affecting approximately 10-15 % of the US and European population [ 1,2 ] .","The etiology of CRS is partially unclear , but it is assumed that one or more factors , such as anatomical obstruction , bacterial or fungal colonization of the sinuses or allergies trigger a chronic inflammation of the nasal administration is unsatisfactory and new treatment options are needed ."}	{"In addition there is epidemiological evidence for an increased rate of CRS in asthmatics [ 7 ] [ 8 ] .","Topical treatment options for patients with CRS include nasal saline irrigations with a number of different application systems ( nasal douches or neti pots ) and different saline concentrations ( hypertonic vs. isotonic ) [ 9 ] as well as the topical application of steroids by nasal pump sprays [ 10,11 ] ."}	0.952	1	1	{"EXT_NGRAM_[,]_[(]",MIN_VERB_[manifest],INT_NGRAM_[may]_[primary],SINGLE_VERB_[manifest]}	{2.14864,0.968864,-0.463278,0.335322}
RELATION_GENEHPOTERM_SUP_MAP_SCPDFS_18983.pdf_11_11_7_7_3_3_UNSUP	PH1/HP:0003159|Hyperoxaluria	{7}	{3}	{Article,hi5f0U/I,Primary,hyperoxaluria,type,1,(,PH1,),is,a,severe,autosomal,recessive,inherited,disorder,of,glyoxylate,metabolism,Accepted,25,A,“,3,“,5t,2013,caused,by,mutations,in,the,AGXT,gene,on,chromosome,2q37,.3,that,encodes,the,hepatic,peroxisomal,enzyme,Available,°,"\\"",““,e,5,September,2013,alaninezglyoxylate,aminotransferase,.}	{"3 Laboratoire de Gériétique Moléculaire Humaiiie , Faculté de Médecine de Sfax , Uiiiversité de Sfax , Tunisia ‘’ Unite cle Recherche UR12ES14 et Service de Néphrologie , Hopitcil Hécli Choker , Sfcix , Tunisia ‘ Laboratoire de Biochimie , Hﬁpital Habib Bourguibci , Sfax , Tunisia","ARTICLE INFO ABSTRACT"}	{"These mutations are found throughout the entire gene and cause a wide Keywomy spectrum of clinical severity .","Rare in Europe , Pl ."}	1	0	1	{"INV_WORD_SEQ_NER_[type NUMBER NUMBER]",INV_INT_NGRAM_[type]_[(],"INV_WORD_SEQ_[type 1 (]",INV_WORD_SEQ_LEN_[3],INV_POS_SEQ_[NN_CD_CD],INV_MIN_VERB_GENE_[cause]_HPO_[be],INV_DEP_PATH_[nn-nsubj|)-rcmod|disorder@nn],INV_EXT_NGRAM_[primary]_[)]}	{19.1676,11.7348,4.99609,-3.49346,3.10412,2.08118,1.11613,-0.41821}
RELATION_GENEHPOTERM_SUP_MAP_journal.pone.0037001.pdf_446_446_4_4_7_8_UNSUP	ORF1/HP:0000118|Phenotypic abnormality	{4}	{7,8}	{To,investigate,whether,ISKNV,ORF1,l,lL-induced,abnormal,phenotype,is,associated,with,apoptosis,",",a,TUNEL,assay,was,performed,on,RFP,-,or,RFP,—,1,l,lL-overexpressing,embryos,.}	{"C1injected control embryos were abnormal at 3 dpf ( Fig .","3E ) , which indicates that the abnormal phenotype was induced by ISKNV ORFlllL overexpression but not by physical trauma ."}	{"73.43 % of ISKNV ORF1 l lL-overexpressing embryos showed increasing positive cell death signal compared with only the 0.58 % in those of pdsRed2-Cl-injected control embryos ( Fig .","3E ) ."}	1	0.008	0	{POS_SEQ_[NN_JJ],WORD_SEQ_LEN_[2],MIN_VERB_[associate],DEP_PATH_[nsubjpass@nsubjpass],"WORD_SEQ_NER_[l ll-induced]","WORD_SEQ_[l ll-induced]",INT_NGRAM_[l]_[ll-induced],EXT_NGRAM_[ISKNV]_[be]}	{13.9043,-3.81388,-2.0099,-0.14411,0.0980622,0.0980622,0.0980622,0}
RELATION_GENEHPOTERM_SUP_MAP_journal.pone.0098947.pdf_49_49_73_73_68_68_UNSUP	ATR/HP:0001009|Telangiectasia	{73}	{68}	{The,involvement,of,intracellular,signaling,molecules,including,mitogen-activated,protein,kinases,(,MAPK,),and,their,downstream,proteins,[,"42,43",],",",protein,kinase,C,(,PKC,),isoforms,[,44,],",",tumor,protein,53,(,p53,),[,"45,46",],",",cyclin-dependent,kinase,inhibitor,lA,(,CDKNIA,",",p21,),[,47,],",",ataxia,telangiectasia,mutated,protein,(,ATM,),[,44,],",",and,ataxia,telangiectasia,and,Rad3,related,(,ATR,),DNA-dependent,protein,kinase,(,DNA-PK,),[,"44,48",],have,also,been,implicated,.}	{"Depending upon the cell and tissue type , bystander signals can be transmitted either through the culture medium [ 17 ] or by cellto-cell contact including gap junctional communication [ 37 ] .","Some of the candidate intercellular signaling molecules that have been implicated in bystander effects are reactive oxygen species [ 20,38 ] , reactive nitrogen species [ 20,38 ] , nitric oxide [ 27,38 ] , cytokines such as TGFB and interleukin 8 [ 39 ] , and small molecules such as amino acids [ 37,40,4 l ] ."}	{"Recently , some laboratories have suggested that the presence of serotonin in the serum is one of the key factors involved in the bystander effect [ 49 — 5l ] , however this ﬁnding has been disputed [ 52 ] .","Most bystander effect studies have been performed using x-rays [ 22,24,29 ] , gamma rays [ l7 ,35,53 ] and alpha particles [ 47,54,55 ] , however , little has been done concerning the effects of neutron radiation [ 56 ] ."}	1	1	0	{INV_EXT_NGRAM_[ataxia]_[)],INV_WORD_SEQ_LEN_[4],INV_INT_NGRAM_[and]_[(],"INV_WORD_SEQ_NER_[and rad3 related (]","INV_WORD_SEQ_[and rad3 related (]",INV_DEP_PATH_[dep@dep],INV_POS_SEQ_[CC_NN_JJ_NN],INV_MIN_VERB_[implicate]}	{9.88195,-2.48545,1.21066,0.403203,0.403203,-0.342047,0.254106,0.142571}
RELATION_GENEHPOTERM_SUP_MAP_SCPDFS_40427.pdf_36_36_8_8_24_24_UNSUP	LDLR/HP:0003124|Hypercholesterolemia	{8}	{24}	{Furthermore,",",knockout,mice,lacking,both,VLDLR,and,LDLR,exhibit,a,modest,hypercholesterolemia,(,3,),",",whereas,apoE,knockout,mice,exhibit,a,profound,hypercholesterolemia,(,4,),.}	{"In the chicken , VLDLR mediates the uptake of yolk precursors VLDL and vitellogenin and plays a critical role in nonmammalian vertebrate oogenesis ( 1 ) .","In contrast to chicken , mice lacking VLDLR exhibit modest decreases in body weight , body mass index , and adipose tissue mass , while their plasma cholesterol levels , triacylglycerol levels , and lipoprotein proﬁles are not altered significantly ( 3 ) ."}	{"These data suggest the presence of other apoE receptors .","To identify a new member of the LDLR family that may bind apoE-containing lipoproteins , we used a mixture of degenerate oligonucleotides [ 5 ’ - TGG ( A/C ) G ( A/C / G/T ) TG ( C/T ) GA ( C/T ) GG ( A/C/G / T ) GA-3 ’ ] , corresponding to the highly conserved amino acid sequence WRCDGD among the ligand-binding domains of LDLR , VLDLR , and apoER2 ."}	0.994	1	0.972	{EXT_NGRAM_[and]_[(],MIN_VERB_GENE_[lack]_HPO_[exhibit],VERB_[exhibit],INT_NGRAM_[exhibit]_[profound]}	{2.39538,1.32934,0.900445,0.0490311}
RELATION_GENEHPOTERM_journal.pone.0011482.pdf_156_156_9_9_7_7	CP/HP:0010528|Prosopagnosia	{9}	{7}	{During,feedback,training,",",participants,with,congenital,prosopagnosia,(,CP,),on,average,made,more,mistakes,during,initial,learning,than,controls,only,for,faces,but,not,for,shoes,(,B,",",solid,line,for,equality,),.}	{"Contrasting face and shoe recognition for frontal images .","( A ) In experiments 1-4 participants were first presented with 4 target stimuli , and were trained during at least 16 feedback trials prior to the test ."}	{"Reaction times during later training trials with unlimited viewing were strongly influenced by participants ’ age ( C , shown for faces only , solid lines represent linear model ﬁts ) .","Comparison of residuals , which account for age related differences , revealed longer reaction times for CPs compared to controls for face stimuli but not for shoe stimuli ( D , RTRS , inverse transformation i.e. -1 / RT see Methods ) ."}	0.992	0.224	0.012	{INV_WORD_SEQ_LEN_[1],INV_WORD_SEQ_[(],INV_WORD_SEQ_NER_[(],INV_EXT_NGRAM_[congenital]_[)],INV_POS_SEQ_[NN],INV_MIN_VERB_[make],INV_DEP_PATH_[nn@nn],INV_INT_NGRAM_[(]_[(],INV_SINGLE_VERB_[make]}	{-13.9342,10.2313,3.57571,3.4479,1.33604,-1.16294,0.80522,0.697516,-0.543134}
RELATION_GENEHPOTERM_SUP_MAP_journal.pone.0016366.pdf_440_440_29_29_44_44_UNSUP	RSPO4/HP:0001798|Anonychia	{29}	{44}	{Blaydon,DC,",",lshii,Y,",",O’Too1e,EA,",",Unsworth,HC,",",Teh,1,"\\\\",’,IT,",",et,al.,(,2006,),The,gene,encoding,R-spondin,4,(,RSPO4,),",",a,secreted,protein,implicated,in,Wlnt,signaling,",",is,mutated,in,inherited,anonychia,38,:,1245,—,1247,.}	{"Hum Nlutat 29 : 220 — 226 .",.}	{.,"Chassot AA , Gregoire EP , l \\\\ ’ 1agliano N1 , Lavery R , Chaboissier RIC ( 2008 ) Genetics of ovarian differentiation : Rspol , a major player ."}	0.996	0.034	1	{INT_NGRAM_[)]_[inherit],VERB_[mutated],VERB_[inherited],VERB_[secreted],VERB_[implicated],VERB_[is],MIN_VERB_GENE_[encode]_HPO_[inherit],EXT_NGRAM_[(]_[38]}	{2.46426,2.40572,2.25122,-2.20687,1.16709,-0.637309,0.537349,0}
RELATION_GENEHPOTERM_journal.pone.0001369.pdf_10_10_29_29_20_20	NRG1/HP:0100753|Schizophrenia	{29}	{20}	{Using,a,B,lymphoblast,cell,model,",",we,previously,demonstrated,impairment,in,NRG1a-mediated,migration,in,cells,derived,from,patients,with,schizophrenia,as,well,as,effects,of,risk,alleles,in,NRG1,and,catechol-O-methyltransferase,(,COMT,),",",a,second,gene,implicated,both,in,schizophrenia,susceptibility,and,in,cancer,.}	{"Background .","Neuregu | in — 1 ( NRG1 ) is a putative schizophrenia susceptibility gene involved extensively in central nervous system development as well as cancer invasion and metastasis ."}	{"Methodology/Principal Findings .","Here , we examine cell adhesion , an essential component process of cell motility , using an integrin-mediated cell adhesion assay based on an interaction between ICAM-1 and the CD11a/CD18 integrin heterodimer expressed on lymphoblasts ."}	0.986	1	1	{INV_INT_NGRAM_[as]_[in],INV_EXT_NGRAM_[with]_[and],INV_MIN_VERB_[derive]}	{2.24747,1.72595,-0.127939}
RELATION_GENEHPOTERM_SCPDFS_1046.pdf_89_89_7_7_5_5	PKD/HP:0100660|Dyskinesia	{7}	{5}	{Affection,status,for,paroxysmal,kinesigenic,dyskinesia,(,PKD,),",",infantile,convulsions,(,IC,;,under,the,age,of,2,years,),",",and,GS,(,generalized,seizures,;,occurring,after,age,2,),are,as,noted,.}	{"The specific mutation is denoted under each individual , when present .","Individuals with a DNA number but no mutation noted have the WT genotype ."}	{"Samples that were used for WGS are marked with an asterisk ( * ) .","One phenocopy was present in K3323 ( marked by an arrow ) ."}	0.972	0.344	0.976	{INV_WORD_SEQ_LEN_[1],INV_WORD_SEQ_[(],INV_WORD_SEQ_NER_[NUMBER],INV_POS_SEQ_[CD],INV_DEP_PATH_[nn-dep|)@],INV_INT_NGRAM_[(]_[(],INV_MIN_VERB_[generalize],INV_EXT_NGRAM_[kinesigenic]_[)]}	{-13.9342,10.2313,2.36405,2.12943,1.11142,0.697516,0.490644,0.182154}
RELATION_GENEHPOTERM_SCPDFS_37708.pdf_424_424_11_11_26_26	FAM46D/HP:0100843|Glioblastoma	{11}	{26}	{Finally,",",we,were,able,to,detect,speciﬁc,antibodies,against,the,FAM46D,protein,(,CAND1,.26,),in,plasma,samples,from,patients,with,lung,tumors,and,glioblastomas,.}	{"PASD1 predicted proteins have in common a PAS ( Per ARNT Sim ) domain , a putative leucine zipper and nuclear localization signal , suggesting that they may act as transcription factors .","Although we can not claim the discovery of PASD1 as a novel CTA , information presented in this manuscript on the high frequency of PASD1 expression in different types of solid tumors and immunogenicity in patients with cervix tumors and glioblastomas supports PASD1 as a promising target for cancer immunotherapy ."}	{"As many other CTAS , FAM46D is located on chromosome X and is a member of a large family of proteins with unknown function .","Due to its restricted expression pattern and immunogenicity FAM46D represents a novel target for cancer immunotherapy ."}	0.984	1	1	{EXT_NGRAM_[the]_[.],INT_NGRAM_[protein]_[and],MIN_VERB_[detect]}	{3.03416,2.9793,-2.12664}
RELATION_GENEHPOTERM_journal.pone.0059941.pdf_264_264_5_5_16_16	VEGF/HP:0002858|Meningioma	{5}	{16}	{These,ﬁndings,suggest,that,the,VEGF,pathway,may,not,be,a,driving,force,in,angiogenesis,in,meningiomas,and,may,explain,limited,clinical,response,in,meningiomas,.}	{"We did not identify any predictors of tumor response to bevacizumab in our cohort .","Pathologic analysis of components of the VEGF angiogenesis pathway and of tumor microvascular density in meningiomas showed robust expression of SEMA3 ( an angiogenesis inhibitor that was not expressed in schwannomas ) and in contrast of our ﬁndings in schwannomas , there was no correlation between expression of VEGF pathway components and tumor microvascular density in meningiomas ."}	{"Supporting Information","Text S1 Methods for determining tuxnor volmne and performing regression analysis ."}	0.992	1	0.55	{INT_NGRAM_[pathway]_[in],EXT_NGRAM_[the]_[and],NEG_VERB_[not]-be,VERB_[driving],MIN_VERB_GENE_[explain]_HPO_[be]}	{4.94341,2.37855,-0.858025,0.727474,-0.2843}
RELATION_GENEHPOTERM_journal.pone.0011801.pdf_58_58_31_31_46_47	p1/HP:0012125|Prostate cancer	{31}	{46,47}	{Suppression,of,p120ctn,expression,leads,to,downregulation,of,cell-cell,adhesion,proteins,and,disruption,of,cell-cell,contacts,To,investigate,the,effects,of,p120ctn,on,cell-cell,adhesion,",",we,compared,the,effects,of,p1,20ctn,depletion,in,two,different,cell,lines,that,have,adherens,junctions,",",the,human,prostate,cancer,cell,line,DU145,and,the,human,mammary,epithelial,cell,line,MCFloA,.}	{"For the first time we have knocked down cadherins as well as catenins and show that P-cadherin , B-catenin and oz-catenin but not E-cadherin depletion mimic the effects of p120ctn suppression and lead to a loss of cell-cell contacts and enhanced invasion .",Results}	{"DU145 and MCF 10A cells formed cell-cell contacts and expressed both E - and P-cadherin , which localized to cell-cell contacts ( Fig .","1A , B ) ."}	1	1	1	{EXT_NGRAM_[of]_[cell],MIN_VERB_GENE_[compare]_HPO_[have],VERB_[have],INT_NGRAM_[20ctn]_[human]}	{7.26619,-0.585628,0.383994,0}
RELATION_GENEHPOTERM_SUP_MAP_SCPDFS_47229.pdf_5_5_23_23_29_29_UNSUP	DAZ/HP:0000027|Azoospermia	{23}	{29}	{With,this,discovery,",",it,is,clear,that,the,genefamily,involved,in,germ,cell,development,in,humans,contains,at,least,three,members,:,DAZ,(,for,‘,deleted,in,azoospermia,‘,),",",a,¥,chromosomegene,cluster,that,arose,30-40,million,years,ago,and,whose,deletion,islinked,to,infertility,in,men,;,DAZL,",",agenethat,mapsto,human,chromosome,3,and,has,homologs,required,for,both,female,and,male,early,germ,cell,development,in,other,organisms,;,and,finally,BouIe,",",which,hasameioticfunction,and,is,proposed,to,bethe,ancestral,gene,of,the,DAZ,family,.}	{"The presence ofadedicated germ | ine , a population ofcellsthatgive rise exclusively to gametes , seemsto beauniquefeature of animal development .","Further support for this notion was recently given by the discovery in mammals of ahomolog of an invertebrate germline gene encoding the RNA-binding protein Bou | e , which is expressed in human sperm atocytes ."}	{"[ Xu , E.Y. etal .","( 2001 ) Proc ."}	0.966	1	0.008	{VERB_[deleted],WORD_SEQ_LEN_[5],DEP_PATH_[@nn-prep_in|)-partmod|delete],INT_NGRAM_[(]_[in],MIN_VERB_[delete],"WORD_SEQ_NER_[NUMBER for NUMBER delete in]",POS_SEQ_[CD_IN_CD_VBN_IN],"WORD_SEQ_[( for ‘ delete in]",EXT_NGRAM_[:]_[‘]}	{1.49736,-1.23123,1.09807,0.865958,-0.818593,0.488688,0.488688,0.488688,0.361984}
RELATION_GENEHPOTERM_journal.pone.0057759.pdf_244_244_34_34_48_49	MI/HP:0005268|Spontaneous abortion	{34}	{48,49}	{However,",",as,known,from,previous,reports,[,"20,21",],and,despite,postoperative,monitoring,",",during,follow,up,",",three,(,23,%,),of,the,fetuses,of,which,one,animal,underwent,induction,of,MI,only,and,two,animals,had,received,intramyocardial,transplantation,of,BMMSCs,died,due,to,spontaneous,abortion,and,were,expelled,overnight,which,was,primarily,related,to,the,fragile,in-utero,approach,itself,.}	{"n = 1 ) and no complications such as bleeding or organ damage occurred ( table 1 ) .","Postoperative Complications and Follow Up Postoperatively , no major complications occurred in the ewes and in the fetuses ."}	{"Table 1 summarizes the preoperative and procedural data .","MRI and Micro CT for Stem Cell Tracking CM-DiI + / MPIO + human BMMSCs and ATMSCs could be successfully detected after stem cell transplantation on high resolution MRI ."}	0.942	1	1	{EXT_NGRAM_[of]_[and],VERB_[died],VERB_[received],VERB_[had],MIN_VERB_GENE_[receive]_HPO_[die],INT_NGRAM_[only]_[to]}	{3.02321,0.731927,-0.700807,-0.345137,0,0}
RELATION_GENEHPOTERM_SUP_MAP_journal.pone.0054941.pdf_211_211_11_11_9_9_UNSUP	NHL/HP:0002665|Lymphoma	{11}	{9}	{The,patient,group,included,22,patients,with,non-Hodgkin,’s,lymphoma,(,NHL,),",",one,patient,with,Hodgkin,’s,lymphoma,(,HL,),",",and,one,patient,with,multiple,myeloma,p,(,³,*,The,median,number,of,previous,chemotherapy,courses,were,of,ﬁve,(,range,",",l,—,17,),",",and,the,median,interval,time,between,the,last,chemotherapy,and,MP,infusion,was,14,days,(,range,",",3,—,91,days,),.}	{"The study ﬂow chart is depicted in Figure 1 .","The median age was 37 years ( range , l5 — 65 years ) , and the median weight was 68.5 kg ( range , 50 — 92 kg ) ."}	{"Baseline characteristics are presented in Table 1 .","Our preclinical studies had established the method to efficiently inducing and expansing cord blood mononuclear cells ( MNCs ) to MPs ."}	1	0.008	1	{INV_WORD_SEQ_LEN_[1],INV_WORD_SEQ_[(],INV_EXT_NGRAM_[’s]_[)],INV_WORD_SEQ_NER_[(],INV_POS_SEQ_[NN],INV_DEP_PATH_[nn@nn],INV_INT_NGRAM_[(]_[(],INV_MIN_VERB_[include]}	{-13.9342,10.2313,6.58525,3.57571,1.33604,0.80522,0.697516,-0.325708}
