relation_id	relation_name	gene_words	hpoterm_words	words	sentences_before	sentences_after	expectation	gene_expectation	hpoterm_expectation	features	weights
RELATION_GENEHPOTERM_SUP_MAP_journal.pone.0002458.pdf_499_499_39_39_27_27_UNSUP	ATM/HP:0001009|Telangiectasia	{39}	{27}	{To,provide,a,genetic,proof,that,ATM,is,required,for,syncytial,apoptosis,induced,by,HIV,",",we,took,advantage,of,HSV-transformed,T,lymphoblasts,from,patients,with,ataxia,telangiectasia,(,A-T,),",",which,results,from,a,lossoffunction,mutation,of,ATM,.}	{"Moreover , the ATM inhibitor KU-55933 suppressed syncytial apoptosis of primary T lymphoblasts infected with HIV-1 WT or HIV-1 INWV with a similar efficiency ( Fig .","6C ) ."}	{"Such transformed A-T lymhoblasts formed syncytia in response to infection by HIV-ILAI or HIV-l INDMV .","A-T syncytia underwent less apoptosis than control syncytia obtained by infection of T HSV-transformed lymphoblasts from a healthy donor ( Fig ."}	0.982	1	0	{INV_INT_NGRAM_[(]_[of],INV_VERB_[results],INV_EXT_NGRAM_[ataxia]_[.],INV_MIN_VERB_GENE_[take]_HPO_[result]}	{2.22335,0.641836,0.423619,0.246648}
RELATION_GENEHPOTERM_journal.pone.0021546.pdf_592_592_28_28_35_36	fractalkine/HP:0003003|Colon cancer	{28}	{35,36}	{Vitale,S,",",Ca_mbien,B,",",Karimdjee,BF,",",Barthel,R,",",Staccini,P,",",et,al.,(,2007,),Tissuespecific,differential,antitumour,effect,of,molecular,forms,of,fractalkine,in,a,mouse,model,of,metastatic,colon,cancer,.}	{"Int ] Oncol 26 : 41447 .",.}	{"Gut 56 : 3654372 .",.}	0.976	1	1	{INT_NGRAM_[in]_[metastatic],MIN_VERB_GENE_[NULL]_HPO_[NULL],EXT_NGRAM_[of]_[.],WORD_SEQ_LEN_[6],POS_SEQ_[IN_DT_NN_NN_IN_JJ],DEP_PATH_[prep_of-prep_of|form-dobj|effect@prep_of-prep_in|model],"WORD_SEQ_[in a mouse model of metastatic]","WORD_SEQ_NER_[in a mouse model of metastatic]"}	{4.89757,-3.59288,3.37702,-1.13804,0,0,0,0}
RELATION_GENEHPOTERM_journal.pone.0013213.pdf_593_593_26_26_42_42	CD14/HP:0100602|Preeclampsia	{26}	{42}	{Kim,],S,",",Romero,R,",",Cushenberry,E,",",Kim,Yl,"\\\\",’,I,",",Erez,O,",",et,al.,(,2007,),Distribution,of,CD14,+,and,CD68,',macrophages,in,the,placental,bed,and,basal,plate,of,women,with,preeclampsia,and,preterm,labor,.}	{"Cupurdija K , Azzola D , Hainz A , Gratchev A , Heitger A , et al. ( 2004 ) Macrophages of human first trimester decidua express markers associated to alternative activation .","Am ] Reprod Immunol 51 : 1174122 ."}	{"Placenta 28 : 5714576 .","Da ."}	0.954	1	1	{EXT_NGRAM_[of]_[and],INT_NGRAM_[+]_[with],"MIN_VERB_GENE_[\\\\\\\\]_HPO_[\\\\\\\\]","SINGLE_VERB_[\\\\\\\\]"}	{3.02321,-0.695119,0.194965,0.191912}
RELATION_GENEHPOTERM_journal.pone.0022395.pdf_9_9_26_26_12_13	p44/HP:0012125|Prostate cancer	{26}	{12,13}	{Here,",",we,describe,studies,that,used,the,mouse,prostate,and,human,prostate,cancer,cells,as,model,systems,to,investigate,signals,that,control,subcellular,localization,of,p44,/,"\\\\",NDR77,.}	{"The androgen receptor ( AR ) cofactor p44/WDR77 , which regulates expression of a set of androgen target genes , is required for differentiation of prostate epithelium .","Aberrant localization of p44/WDR77 in the cytoplasm is associated with prostate tumorigenesis ."}	{"We observed distinct subcellular location of p44 / WDR77 during prostate development .","p44/WDR77 localizes in the cytoplasm at the early stage of prostate development , when prostate epithelial cells are rapidly proliferating , and in the nucleus in adult prostate , when epithelial cells are fully differentiated ."}	0.948	1	1	{INV_INT_NGRAM_[cell]_[of],INV_VERB_[control],INV_VERB_[investigate],INV_EXT_NGRAM_[human]_[/],INV_MIN_VERB_GENE_[use]_HPO_[control]}	{7.29201,-3.11393,-1.70363,0.326256,0}
RELATION_GENEHPOTERM_SUP_MAP_SCPDFS_39723.pdf_281_281_22_22_16_16_UNSUP	TOR1A/HP:0001332|Dystonia	{22}	{16}	{A,screen,for,additional,mutations,in,the,TOR1A,and,the,TOR1B,loci,in,several,types,of,dystonia,patients,with,features,consistent,with,TOR1A,involvement,did,not,reveal,additional,mutations,.}	{"The TOR1A ( DYT1 ) gene for early onset torsion dystonia is remarkable in two ways : the large majority of patients with this syndrome bear the same mutation ( GAG deletion ) in the heterozygous state ( Ozelius et al. , 1997b ; Klein et al. , in press , a ) , and identiﬁcation of this gene reveals a novel family of proteins with features of the heat-shock/chaperone and AAA + superfamily ( Ozelius et al. , 1997b ; Neuwald et al. , 1999 ) .","The present study deﬁnes the exon structure of this gene and its adjacent homologue , TOR1B ."}	{"The inability to identify additional mutations in the TOR1A gene suggests that the structural","change in the torsin A protein caused by the GAG deletion ( loss of a glutamic acid residue in the carboxy terminal ) may be functionally unique ."}	0.922	1	1	{INV_INT_NGRAM_[patient]_[with],INV_WORD_SEQ_LEN_[5],"INV_WORD_SEQ_NER_[patient with feature consistent with]",INV_DEP_PATH_[nn-prep_with|involvement-amod|consistent-prep_with|feature@nn],INV_POS_SEQ_[NNS_IN_NNS_JJ_IN],INV_EXT_NGRAM_[of]_[involvement],"INV_WORD_SEQ_[patient with feature consistent with]",INV_SINGLE_VERB_[do],INV_MIN_VERB_GENE_[reveal]_HPO_[NULL]}	{3.34302,-2.34145,0.222017,0.222017,0.222017,0.222017,0.222017,0.204607,-0.145256}
RELATION_GENEHPOTERM_journal.pone.0041845.pdf_297_297_19_19_26_26	PDPN/HP:0002861|Melanoma	{19}	{26}	{Human,melanoma,cells,express,PDPN,and,respond,to,MASL,We,examined,cell,lines,and,clinical,specimens,to,further,investigate,PDPN,expression,and,MASL,sensitivity,in,human,melanoma,cells,.}	{"R PLoS ONE | www .","p | osone.org numerous in tumors from MASL treated mice than from control animals ."}	{"As shown in Figure 9a , PDPN expression was drastically increased in primary and metastatic melanoma specimens from every patient that we examined .","As with mouse melanoma cells , PDPN expression was also much higher in human melanoma cell lines than normal skin ."}	0.924	1	1	{DEP_PATH_[nn@nn-prep_in|cell],INT_NGRAM_[expression]_[human],WORD_SEQ_LEN_[6],MIN_VERB_[investigate],POS_SEQ_[NN_CC_NN_NN_IN_JJ],"WORD_SEQ_NER_[expression and masl sensitivity in human]",EXT_NGRAM_[investigate]_[cell],"WORD_SEQ_[expression and masl sensitivity in human]"}	{2.93335,2.2178,-1.13804,-1.11833,-0.20179,0,0,0}
RELATION_GENEHPOTERM_SCPDFS_42854.pdf_11_11_10_10_23_23	ABR/HP:0002885|Medulloblastoma	{10}	{23}	{This,report,provides,new,physics,],mapping,data,for,the,ABR,gene,",",which,has,not,been,previously,shown,to,be,deleted,in,medulloblastoma,.}	{"Using pulsed-ﬁeld gel electrophoresis , we localized the polymorphic marker ( VNTR-A ) of the ABR gene locus to within 220 kb of the p144-D6 locus .","A cosmid contig constructed in this region was used to demonstrate by ﬂuorescence in situ hybridization that the ABR gene is oriented transcriptionally 5 ' to 3 ’ toward the telomere ."}	{"These results provide further evidence for the existence of a second tumor suppressor gene distinct from p53 on distal chromosome 17p .","Q 1994 Academic Press , Inc. ."}	0.994	1	0.84	{EXT_NGRAM_[the]_[.],INT_NGRAM_[gene]_[in],VERB_[deleted],NEG_VERB_[not]-be,VERB_[has],VERB_[be],VERB_[shown],MIN_VERB_GENE_[show]_HPO_[delete]}	{3.03416,2.21253,1.49736,-0.858025,-0.54247,-0.466615,-0.303796,0}
RELATION_GENEHPOTERM_SUP_MAP_journal.pone.0004563.pdf_108_108_39_39_42_42_UNSUP	ATR/HP:0001009|Telangiectasia	{39}	{42}	{Furthermore,",",additional,tests,excluded,the,induction,of,double-strand,break,DNA,repair,and,activation,of,cell-cycle,checkpoints,after,low-dose,Aza,",",because,:,a,),there,were,no,changes,in,the,levels,ofphosphorylation,of,proteins,known,to,transmit,the,ATR,(,ataxia,telangiectasia,mutated,(,ATM,),and,ATM,and,Rad-3,related,),response,",",CHK1,",",and,gammaH2AX,",",reported,to,be,activated,in,response,to,high,dose,Aza,(,1,—}	{"This test revealed that 0.5 ] .","LM and 1.0 11M , but not 0.2 11M Aza induced DNA damage in the Aza sensitive YUMAC , but not the resistant YURIF melanoma cells ( Table 2 ) ."}	{"PLoS ONE | www .","p | osone.org"}	1	1	0.008	{"WORD_SEQ_[( ataxia]","WORD_SEQ_NER_[NUMBER ataxia]",INT_NGRAM_[(]_[ataxia],DEP_PATH_[nn@],WORD_SEQ_LEN_[2],EXT_NGRAM_[the]_[mutate],POS_SEQ_[CD_NN],MIN_VERB_GENE_[mutate]_HPO_[transmit]}	{8.43077,8.43077,6.28826,-5.61723,-3.81388,2.52811,1.61756,0.34865}
RELATION_GENEHPOTERM_SUP_MAP_journal.pone.0016983.pdf_632_632_12_12_6_6_UNSUP	ATP13A2/HP:0000726|Dementia	{12}	{6}	{(,2006,),Hereditary,parkinsonism,with,dementia,is,caused,by,mutations,in,ATP13A2,",",encoding,a,lysosomal,type,5,P-type,ATPase,.}	{"8 .","Ramirez A , Heim1 ) ach A , Grundemannj , Stiller B , Hampshire D , et a1 ."}	{"Nat Genet 38 : 1l84 — l 191 .","9 ."}	1	1	0.998	{INV_VERB_[caused],INV_POS_SEQ_[VBZ_VBN_IN_NNS_IN],INV_WORD_SEQ_LEN_[5],INV_INT_NGRAM_[be]_[in],"INV_WORD_SEQ_NER_[be cause by mutation in]","INV_WORD_SEQ_[be cause by mutation in]",INV_MIN_VERB_[cause],INV_VERB_[is],"INV_EXT_NGRAM_[with]_[,]",INV_DEP_PATH_[prep_in-agent|mutation@prep_with-nsubjpass|parkinsonism]}	{3.98353,2.57809,-2.34145,2.132,1.4879,1.4879,1.19445,-0.838023,-0.729983,0.0980622}
RELATION_GENEHPOTERM_SCPDFS_40938.pdf_41_41_1_1_22_22	BWS/HP:0002859|Rhabdomyosarcoma	{1}	{22}	{Since,BWS,patients,suffer,from,a,variety,of,overgrowth,disorders,and,predisposition,to,embryonic,tumors,including,Wilms,tumor,(,WT,),and,rhabdomyosarcoma,",",the,breakpoints,may,disrupt,developmental,genes,or,their,regulation,.}	{"Wiedemann syndrome ( BWS ) patients and pediatric tumors map to 11p15 .5 ( Mannens et al. , 1994 ; Sait et al. , 1994 ) .","These breakpoints cluster in three regions of 11p15 .5 , most often in the BWSCR1 domain between D11S648 and D11S551 ( Hoovers et al. , 1995 ) ."}	{"Second , loss of heterozygosity ( LOH ) in 11p15 .5 has been detected in BWS and sporadic WT cases ( Mannens et al. , 1988 ; Reeve et al. , 1989 ; Wadey et al. , 1989 ) .","LOH in the same region of 11p15 .5 is also observed in a variety of adult tumors ( Seizinger et al. , 1991 ) , suggesting the presence of a common tumor suppressor gene or a cluster of cancer-related genes ."}	1	1	0.972	{VERB_[suffer],INT_NGRAM_[patient]_[and],MIN_VERB_[suffer],VERB_[including],"EXT_NGRAM_[since]_[,]"}	{4.16143,3.91561,2.15665,1.57058,-0.621156}
RELATION_GENEHPOTERM_journal.pone.0038780.pdf_72_72_12_12_43_44	IF/HP:0001402|Hepatocellular carcinoma	{12}	{43,44}	{In,addition,",",point,mutations,in,K8,and,Kl8,genes,lead,to,IF,disorganization,and,predispose,to,liver,cirrhosis,[,19,],and,in,turn,",",cirrhosis,reﬂects,increasing,hepatic,tissue,stiffness,",",a,ECM-linked,mechanical,alteration,often,associated,with,the,emergence,of,hepatocellular,carcinoma,[,"20,21",],.}	{"specialized Type II and Type I keratin classes , respectively , and constitute the ﬁrst cytoplasmic IF genes expressed in the embryo , at the time of stem cell differentiation along the different cell lineages [ 16,17 ] .","With regard to cancer , there is accumulating evidence showing , for instance , that persistence of K8 / K18 IFs is a hallmark of invasive squamous cell carcinoma , where such perturbed K8/K18 expression appears to contribute to cell invasiveness through an actin-dependent motility [ l 8 ] ."}	{"Thus , considering that keratin IFs constitute a resilient yet ﬂexible cytoskeletal network that is largely responsible for the capacity of epithelial cells to sustain mechanical stress [ 17 ] , one can hypothesize that K8 / K18 IFs need to be included in the interplay that takes place between actin-mediated cell stiffness and ECM rigidity in simple epithelial cells .","In the work reported here , we addressed this hypothesis using monolayer cultures of K8-knockdown H4-II-E-C3 ( shK8b ) rat hepatoma cells and their K8/K18-containing counterparts ( H4ev ) [ 22 ] ."}	0.946	1	1	{VERB_[predispose],VERB_[increasing],EXT_NGRAM_[to]_[[],VERB_[associated],INT_NGRAM_[disorganization]_[of],MIN_VERB_GENE_[lead]_HPO_[NULL]}	{2.75668,-2.72999,2.42139,0.631537,0,0}
RELATION_GENEHPOTERM_SCPDFS_40337.pdf_16_16_63_63_45_46	MRX30/HP:0001321|Cerebellar hypoplasia	{63}	{45,46}	{The,Xq21,—,q24,region,is,interesting,because,several,neurological,disorders,map,to,this,region,",",including,double,cortex/X-linked,lissencephaly,(,DC/XLIS,),(,6,",",26,),",",Xlinked,mental,retardation,limited,to,females,(,EFMR,),(,28,),",",X-linked,nonprogressive,congenital,cerebellar,hypoplasia,(,15,),",",and,several,nonspeciﬁc,mental,retardation,disorders,:,MRX23,(,13,),",",MRX30,(,9,),",",MRX35,(,14,),",",and,MRX47,(,7,),.}	{"The new contig extends and incorporates several previously published contigs , providing a total overlapping contig extending approximately 34 Mb from DXS441 in Xq13 .1 to DXS8088 in Xq23 .","© 1998 Academic Press"}	{"It is not known whether any of these disorders are allelic .","Further mapping information across this region would therefore facilitate the identiﬁcation of the genes responsible for these disorders ."}	0.96	1	1	{INV_EXT_NGRAM_[congenital]_[(],INV_MIN_VERB_[include],"INV_INT_NGRAM_[(]_[,]"}	{3.2,-0.325708,0.124396}
RELATION_GENEHPOTERM_journal.pone.0089777.pdf_91_91_7_7_24_24	AN/HP:0000790|Hematuria	{7}	{24}	{Seven,of,12,(,58.3,%,),AN,CA-positive,IE,patients,and,11,of,24,(,45.8,%,),AN,CAnegative,IE,patients,had,hematuria,",",whereas,4,of,12,(,33.3,%,),ANCA-positive,IE,patients,and,10,of,24,(,41.7,%,),AN,CA-negative,IE,patients,presented,with,proteinuria,.}	{"One ( 7.7 % ) ANCA-positive IE and 2 ( 7.7 % ) ANCA-negative IE patients exhibited elevated level of serum creatinine .","Eight ( 61.5 % ) ANCA-positive IE patients and 16 ( 61.5 % ) ANCA-negative IE patients appeared with low level of serum albumin ."}	{"LDH levels were higher in ANCA-positive IE .","There was no signiﬁcant difference between factors in other laboratory results ."}	0.906	1	1	{"EXT_NGRAM_[)]_[,]",MIN_VERB_GENE_[have]_HPO_[have],VERB_[had],INT_NGRAM_[ca-positive]_[have]}	{3.88981,-1.24692,-0.345137,0}
RELATION_GENEHPOTERM_SUP_MAP_journal.pone.0095528.pdf_299_299_68_68_63_64_UNSUP	CRD/HP:0000548|Cone-rod dystrophy	{68}	{63,64}	{One,previous,study,of,STGD,in,the,Chinese,PROA/II,can,lead,to,several,diseases,(,Table,3,),",",including,Stargardt,population,",",screened,part,of,ABCA4,coding,sequence,(,15,exons,),disease,(,STGD4,),[,"22,23",],",",retinitis,pigmentosa,(,RP41,),[,24,—,28,],",",and,identiﬁed,two,relatively,common,mutations,:,T1428M,and,autosomal,dominant,cone-rod,dystrophy,(,CORD12,",",CRD,),[,16,],",",R2040X,[,21,],.}	{"This may be a clinically relevant homozygous mutation of p. G607R and the parents come from observation .","We reviewed the literature and found mutations in different regions ."}	{"To further clarify ABCA4 mutation spectrum in the macular dystrophy ( MCDR2 ) [ 29 ] and autosomal recessive coneChinese population , further studies of large sample size are still rod dystrophy ( CRD ) [ 21 ] .","The major difference between these needed ."}	1	1	1	{INV_EXT_NGRAM_[dominant]_[)],INV_WORD_SEQ_LEN_[3],"INV_POS_SEQ_[CD_NN_,]","INV_INT_NGRAM_[(]_[,]","INV_WORD_SEQ_NER_[NUMBER cord12 ,]",INV_DEP_PATH_[appos-nsubj|cord12-conj_and|screen@conj_and-dep|t1428m-dobj|mutation-conj_and|identiﬁed],"INV_WORD_SEQ_[( cord12 ,]",INV_MIN_VERB_GENE_[identiﬁed]_HPO_[screen]}	{7.16045,-3.49346,2.32641,0.124396,0.035427,0.035427,0.035427,0.035427}
RELATION_GENEHPOTERM_journal.pone.0068361.pdf_89_89_36_36_42_42	ATR/HP:0000726|Dementia	{36}	{42}	{Comparison,of,individuals,without,dementia,(,NL,=,CDR,o,),",",with,questionable-mild,(,CDR,0.5-1,),and,with,moderate,to,severe,dementia,(,CDR,2-5,),showed,higher,levels,of,MDM4,",",ATM,and,ATR,gene,expression,in,individuals,with,dementia,(,F2,",",112,=,4.037,",",p,=,0.02,(,MDM4,),;,F2,",112",=,4.357,",",p,=,0.015,(,ATM,),and,F211,12,=,3.038,",",p,=,0.052,(,ATR,),;,see,Figure,2,),.}	{t001,"protein p53 ( TP53 ) and breast cancer 1 gene ( BRCA1 ) were selected for conformational qPCR analysis in the STG of an independent cohort of cases with varying severity of AD dementia , SZ and cognitively normal controls ."}	{"Comparisons of individuals with and without AD-associated neuropathology also showed high levels of MDM4 and ATM gene expression as a function of increasing neuritic plaque ( NP ) density ( F ; 1 ) 112 = 3.601 , p = 0.016 and F3 ,112 = 4.802 , p = 0.009 , respectively ) and Braak neuropathological stages ( F4 ) 112 = 3.042 , p = 0.020 and F. 1 ) 112 = 2.816 , p = 0.029 , respectively ) .","Changes in ATR gene expression as a function of NP density or Braak neuropathological stages were not signiﬁcant , but showed nominal increases ."}	0.948	1	0	{INT_NGRAM_[gene]_[with],MIN_VERB_[show],EXT_NGRAM_[and]_[(],WORD_SEQ_LEN_[5],POS_SEQ_[NN_NN_IN_NNS_IN],"WORD_SEQ_NER_[gene expression in individual with]",DEP_PATH_[nn-prep_of|expression-dobj|level@nn-prep_with|f2-prep_in|individual],"WORD_SEQ_[gene expression in individual with]"}	{3.84499,-2.84381,2.39538,-1.23123,0.592607,0,0,0}
RELATION_GENEHPOTERM_SCPDFS_42534.pdf_21_21_3_3_50_50	COL5A1/HP:0001009|Telangiectasia	{3}	{50}	{However,",",the,COL5A1,gene,",",which,encodes,the,type,V,collagen,(,11,chain,",",has,been,mapped,cytogenetically,to,human,chromosome,9q34,(,2,),",",to,which,the,autosomal,dominant,disorders,nail-patella,syndrome,(,NPS,),",",tuberous,sclerosis,1,(,TSC1,),",",and,hereditary,hemorrhagic,telangiectasia,or,Osler,.}	{"o 1995 Academic Press , Inc. .","Type V is the only ﬁbrillar collagen not yet implicated in the pathogenesis of genetic diseases ."}	{"— .","Rendu-Weber disease ( ORW ) also map ."}	0.97	1	1	{EXT_NGRAM_[the]_[or],INT_NGRAM_[gene]_[hemorrhagic],VERB_[encodes],VERB_[has],VERB_[mapped],VERB_[been],MIN_VERB_GENE_[encode]_HPO_[map]}	{2.46555,1.12564,0.622641,-0.54247,-0.468259,0.445938,0}
RELATION_GENEHPOTERM_SUP_MAP_journal.pone.0030075.pdf_420_420_8_8_6_6	HHT/HP:0001009|Telangiectasia	{8}	{6}	{p,|,osone.org,in,hereditary,haemorrhagic,telangiectasia,(,HHT,),where,mutation,in,ALKI,has,been,described,[,"43,44",],.}	{"Indeed , disruption in ALKI mediated signalling in endothelial cells is known to cause disordered angiogenesis , as seen","PLoS ONE | www ."}	{"Disruption of BMP-9 signalling through ALKI may therefore be important in the development of HHT related vascular changes .","Whereas ET — 1 has been shown to promote endothelial tubule formation [ 45,46 ] , in agreement with our ﬁndings , it is also generally known as a chemo-attractant , promoting migration [ 46 — 48 ] ."}	0.986	0.008	1	{INV_WORD_SEQ_LEN_[1],INV_WORD_SEQ_[(],INV_WORD_SEQ_NER_[(],INV_EXT_NGRAM_[haemorrhagic]_[)],INV_POS_SEQ_[NN],INV_INT_NGRAM_[(]_[(],INV_DEP_PATH_[dep@nn],INV_MIN_VERB_[describe]}	{-13.9342,10.2313,3.57571,2.36613,1.33604,0.697516,0.440794,-0.348903}
RELATION_GENEHPOTERM_SUP_MAP_SCPDFS_45909.pdf_567_567_12_12_22_23_UNSUP	FOXE1/HP:0000175|Cleft palate	{12}	{22,23}	{24,",",1519-1532,83,Moreno,",",L.M.,et,al.,(,2009,),FOXE1,association,with,both,isolated,cleft,lip,with,or,without,cleft,palate,",",and,isolated,cleft,palate,.}	{"82 Hu , B. et al. ( 2010 ) Control of hair follicle cell fate by underlying mesenchyme through a CSL-Wnt5a-FoxN1 regulatory axis .","Genes Dev ."}	{"Hum .","Mol ."}	0.912	1	1	{"EXT_NGRAM_[)]_[,]",MIN_VERB_GENE_[isolate]_HPO_[isolate],INT_NGRAM_[association]_[without],VERB_[isolated]}	{3.88981,-2.25003,0.733045,0.0296293}
RELATION_GENEHPOTERM_journal.pone.0048673.pdf_555_555_28_28_37_39	CD38/HP:0004808|Acute myeloid leukemia	{28}	{37,38,39}	{Feuring,~,Buske,l,"\\\\",’,I,",",Hogge,DE,(,2001,),Hoechst,33342,efflux,identifies,a,sub,»,population,of,cytogenetically,normal,CD34,(,+,),CD38,(,-,),progenitor,cells,from,patients,with,acute,myeloid,leukemia,.}	{"Garner DL ( 2009 ) Hoechst 33342 : the dye that enabled differentiation of living X-and Y-chromosome bearing mammalian sperm .","Theriogenology 71 ( 1 ) : ll — 21 ."}	{"Blood 97 ( 12 ) : 3882 * 3889 .","Bellve AR ( 1993 ) Puriﬁcation culture and fractionation of spermatogenic cells ."}	0.992	1	1	{EXT_NGRAM_[)]_[.],INT_NGRAM_[(]_[with],MIN_VERB_GENE_[identify]_HPO_[feur]}	{5.12129,-0.103197,0}
RELATION_GENEHPOTERM_SUP_MAP_SCPDFS_40198.pdf_40_40_8_8_13_13_UNSUP	ATM/HP:0001009|Telangiectasia	{8}	{13}	{Two,mammalian,homologs,of,S.,pombe,Rad3,",",ATM,(,mutated,in,ataxia,telangiectasia,),and,ATR,(,AT,and,Rad3related,),",",have,been,identiﬁed,as,members,of,the,PI,kinase,superfamily,and,exhibit,associated,protein,kinase,activity,(,reviewed,in,9,),.}	{"The MEC1 gene is a structural homolog of the S. pombe Rad3 PI kinase ( 2 , 9 ) , suggesting that in distantly related yeast strains signals from both DNA damage and blocked replication are transduced through a common pathway ( 8 ) .","Additional evidence for the conservation of the DNA structure checkpoint at the molecular level between both yeasts includes structural similarity between Rad53p and Cdsl , Rad17p and Radl , and Rad24p and Rad17 ( see 8 ) ."}	{"ATM mutant cells have defective G1 and G2 DNA-damage checkpoints and show radiation-resistant DNA synthesis , whereas indirect evidence suggests that ATR is required for the G2/M checkpoint in response to DNA damage and inhibition of replication ( 2 , 7 ) .","Together with the identiﬁcation of human structural and functional homologs"}	1	1	0	{INT_NGRAM_[(]_[ataxia],VERB_[mutated],WORD_SEQ_LEN_[4],"EXT_NGRAM_[,]_[)]",MIN_VERB_[mutate],DEP_PATH_[@nn-prep_in|)-partmod|mutate],POS_SEQ_[CD_VBN_IN_NN],"WORD_SEQ_[( mutate in ataxia]","WORD_SEQ_NER_[NUMBER mutate in ataxia]"}	{6.28826,2.40572,-1.64556,-0.770907,0.652915,0.501831,0.0980622,0.0980622,0.0980622}
RELATION_GENEHPOTERM_SUP_MAP_SCPDFS_42378.pdf_911_911_3_3_13_13_UNSUP	c-ABL/HP:0001909|Leukemia	{3}	{13}	{Ampliﬁed,CA,and,c-ABL,genes,are,on,the,same,marker,chromosome,i.n,K562,leukemia,cells,.}	{"Selden , J. R. , Emanuel , B. S. , Wang , E. , Cannjzzaro , L. , Palumbo , A. , Erikson , J .",", Nowell , P. C. , Rovers , G. , and Croce , C. M. ( 1983 ) ."}	{"Proc .","Natl. Acad ."}	0.938	1	1	{EXT_NGRAM_[and]_[cell],MIN_VERB_[be],SINGLE_VERB_[be],INT_NGRAM_[gene]_[k562]}	{5.47925,-1.56845,-1.12513,-0.180246}
RELATION_GENEHPOTERM_journal.pone.0035295.pdf_302_302_25_25_29_30	BAP1/HP:0100001|Malignant mesothelioma	{25}	{29,30}	{Testa,],R,",",Cheung,l,"\\\\",I,",",Pei,],",",Below,],E,",",Tan,Y,",",et,al.,(,2011,),Germline,BAP1,mutations,predispose,to,malignant,mesothelioma,.}	{"VViesner T , Obenauf AC , l \\\\ ’ Iura1i R , Fried I , Griewank KG , et al. ( 2011 ) Germline mutations in BAP1 predispose to melanocytic tumors .","Nat Genet 43 : 1018 — 1021 ."}	{"Nat Genet 43 : 102241025 .","Singh AD , Turell l \\\\ IE , Topha_m AK ( 2011 ) Uveal melanoma : trends in incidence , treatment , and survival ."}	0.998	1	1	{EXT_NGRAM_[germline]_[.],INT_NGRAM_[mutation]_[to],POS_SEQ_[NNS_VBP_TO],WORD_SEQ_LEN_[3],SINGLE_VERB_[predispose],MIN_VERB_[predispose],"WORD_SEQ_NER_[mutation predispose to]",DEP_PATH_[nn-dep|mutation-nsubj|(@prep_to],"WORD_SEQ_[mutation predispose to]"}	{4.70836,2.4358,1.75094,-1.68471,-1.43856,0.219625,0,0,0}
RELATION_GENEHPOTERM_journal.pgen.1004137.pdf_235_235_30_30_55_56	GRS/HP:0001370|Rheumatoid arthritis	{30}	{55,56}	{ROC,curves,for,models,trained,in,the,UK2,dataset,and,tested,on,(,a,),four,other,CD,datasets,",",(,b,),the,lmmunochip,CD,dataset,",",comparing,the,GRS,approach,with,that,of,Romanos,et,al.,[,21,],",",and,(,c,),three,other,autoimmune,diseases,(,Crohn,’s,disease,",",Rheumatoid,Arthritis,",",and,Type,1,Diabetes,),.}	{"Figure 3 .","Performance of the genomic risk score in external validation , when compared to other approaches , and on other related diseases ."}	{"We did not re — tune the models on the test data .","For ( b ) and ( c ) , we used a reduced set of SNPs for training , from the intersection of the UK2 SNPs with the lmmunochip or WTCCC SNPs ( 18,252 SNPs and 76,847 SNPs , respectively ) ."}	0.92	1	1	{"EXT_NGRAM_[the]_[,]",MIN_VERB_GENE_[compare]_HPO_[train],"INT_NGRAM_[approach]_[,]"}	{2.21219,0,0}
RELATION_GENEHPOTERM_SCPDFS_44236.pdf_10_10_11_11_45_46	STMY3/HP:0012254|Ewing's sarcoma	{11}	{45,46}	{As,demonstrated,using,a,panel,of,somatic,cell,hybrids,",",the,STMY3,gene,is,in,band,22ql1,.2,",",in,close,proximity,to,the,BCR,gene,involved,in,chronic,myeloid,leukemia,",",but,far,from,the,(,11,;,22,),translocation,breakpoint,observed,in,Ewing,sarcoma,.}	{"Received August 7 , 1991 ; revised December 2 , 1991","The human stromelysin 3 ( STMY3 ) gene , a new member of the matrix metalloproteinase ( MMP ) gene family , may contribute to breast cancer cell invasion , and has been localized by in situ hybridization to the long arm of chromosome 22 ."}	{"This position diﬁ ' ers from that reported on chromosomes 1 1 and 16 for the other MMP genes , suggesting that stromelysin 3 could be a member of a new MMP subfamily .","© 1992 Academic Press , Inc. ."}	0.958	1	0.008	{EXT_NGRAM_[the]_[.],INT_NGRAM_[gene]_[in],MIN_VERB_GENE_[be]_HPO_[observe],VERB_[is],VERB_[involved],VERB_[observed]}	{3.03416,2.21253,-1.31681,-0.637309,0.13412,-0.0321232}
RELATION_GENEHPOTERM_journal.pgen.1003695.pdf_54_54_0_0_22_24	DC/HP:0001597|Abnormality of the nail	{0}	{22,24}	{DC,is,a,heterogeneous,inherited,bone,marrow,failure,syndrome,(,IBMFS,),diagnosed,by,the,presence,of,the,classic,triad,of,dysplastic,nails,",",abnormal,skin,pigmentation,",",and,oral,leukoplakia,.}	{Introduction,"Hoyeraal Hreidarsson syndrome T Q is a clinically severe variant of the telomere biology disorder dyskeratosis congenita ( DC ) [ 1 ] ."}	{"However , substantial clinical heterogeneity has been observed and the phenotype may include pulmonary fibrosis , liver disease , esophageal , urethral , or lacrimal duct stenosis , developmental delay , and / or other complications .","Individuals with DC are at very high risk of bone marrow failure ( BMH , myelodysplastic syndrome , and cancer [ 2 ] ."}	0.964	1	1	{VERB_[inherited],VERB_[diagnosed],VERB_[is],MIN_VERB_GENE_[be]_HPO_[diagnose],EXT_NGRAM_[NULL]_[skin],INT_NGRAM_[be]_[dysplastic]}	{2.25122,1.21859,-0.637309,0.514427,0.299842,0}
