relation_id	relation_name	gene_words	hpoterm_words	words	sentences_before	sentences_after	expectation	gene_expectation	hpoterm_expectation	features	weights
RELATION_GENEHPOTERM_SCPDFS_25234.pdf_302_302_6_6_13_13	p53/HP:0001009|Telangiectasia	{6}	{13}	{A,mammalian,cell,cycle,checkpoint,utilizing,p53,and,gadd45,is,defective,in,ataxia,telangiectasia,.}	{"268 ( 32 ) , 24385-24393 .","Kastan , M.B. , Zhan , Q. , El-Deiry , W.S. , Carrier , F. , Jacks , T. , Walsh , W.V. , Plunkett , B.S. , Fomace Jr. , A.J. , 1992 ."}	{"Cell 71 ( 4 ) , 587-597 .","MacLeod , K.F. , Sherry , N. , Hannon , G. , Beach , D. , Tokino , K. , Kinzler , B. , Vogelsten , B. , Jacks , T. , 1995 ."}	0.99	1	0	{INT_NGRAM_[and]_[ataxia],WORD_SEQ_LEN_[6],VERB_[is],EXT_NGRAM_[utilize]_[.],POS_SEQ_[CC_NN_VBZ_JJ_IN_NN],"WORD_SEQ_NER_[and gadd45 be defective in ataxia]","WORD_SEQ_[and gadd45 be defective in ataxia]",MIN_VERB_GENE_[utilize]_HPO_[be],DEP_PATH_[dobj-partmod|utilize-nsubj|checkpoint@prep_in]}	{6.32774,-1.13804,-0.637309,0,0,0,0,0,0}
RELATION_GENEHPOTERM_journal.pone.0025166.pdf_816_816_28_28_31_32	TRAIL/HP:0012125|Prostate cancer	{28}	{31,32}	{Chen,X,",",Thakkar,H,",",Tyan,F,",",Gim,S,",",Robinson,H,",",et,al.,(,2001,),Constitutively,active,Akt,is,an,important,regulator,of,TRAIL,sensitivity,in,prostate,cancer,.}	{"p | osone.org regulation of apoptosis , metastasis and angiogenesis .","Clinical Cancer Res 14 : l — l6 ."}	{"Oncogene 20 : 607343083 .","Furuyama T , Kitayama K , Shimoda Y , Ogawa l \\\\ ’ I , Sone K , et al. ( 2004 ) Abnormal angiogenesis in Foxol ( Fkhr ) - deﬁcient mice ."}	0.998	1	1	{WORD_SEQ_LEN_[2],EXT_NGRAM_[of]_[.],POS_SEQ_[NN_IN],DEP_PATH_[nn@prep_in],INT_NGRAM_[sensitivity]_[in],MIN_VERB_[be],SINGLE_VERB_[be],"WORD_SEQ_NER_[sensitivity in]","WORD_SEQ_[sensitivity in]"}	{-3.81388,3.37702,3.29971,3.10021,2.74578,-1.56845,-1.12513,0.0345252,0.0345252}
RELATION_GENEHPOTERM_SUP_MAP_SCPDFS_48880.pdf_202_202_21_21_30_30_UNSUP	WAGR/HP:0000526|Aniridia	{21}	{30}	{As,no,clear,differences,have,been,observed,between,the,eye,phenotypes,associated,with,deletions,",",of,the,entire,PAX6,gene,(,WAGR,patients,),and,these,intragenic,mutation,cases,",",aniridia,seems,",",therefore,",",to,be,associated,with,complete,loss,of,function,of,one,PAX6,homologue,",",in,other,words,the,mutant,allele,is,an,amorph25,.}	{"2 ) .","There is a characteristic spectrum of mutations with all but one leading to premature termination of translation ( assuming that a functional RNA is made from the mutant allele ) ."}	{"An interesting contrast is provided by Waardenburg syndrome type 1 ( \\\\ X/SD24 , a dominantly inherited condition typified by sensorineural deafness and pigmentary disturbances in which the underlying defect is thought to be abnormal migration or differentiation of neural crest cells .","WS1 is caused by loss — of — function mutations in the PAX3 gene , and the mutational spectrum includes missense mutations , as well as chain terminations and deletions ."}	0.994	1	0.014	{"INT_NGRAM_[patient]_[,]",MIN_VERB_GENE_[associate]_HPO_[seem],EXT_NGRAM_[(]_[seem]}	{4.1458,0.103866,0.0329754}
RELATION_GENEHPOTERM_SUP_MAP_journal.pone.0032451.pdf_842_842_0_0_6_6_UNSUP	JAK2/HP:0001909|Leukemia	{0}	{6}	{JAK2,fusion,in,the,development,of,leukemia,in,the,general,population,.}	{"Further studies are necessary to elucidate the incidence of BCR .","— ."}	{"JAKQ inhibitors abrogate BCR .","— ."}	0.994	1	0.962	{POS_SEQ_[NN_IN_DT_NN_IN],MIN_VERB_GENE_[NULL]_HPO_[NULL],INT_NGRAM_[fusion]_[of],EXT_NGRAM_[NULL]_[in],WORD_SEQ_LEN_[5],DEP_PATH_[nn@prep_of-prep_in|development],"WORD_SEQ_NER_[fusion in the development of]","WORD_SEQ_[fusion in the development of]"}	{4.34773,-3.59288,3.24778,2.10891,-1.23123,0.938525,0.0504442,0.0504442}
RELATION_GENEHPOTERM_journal.pone.0062602.pdf_213_213_25_25_39_39	FOG/HP:0002067|Bradykinesia	{25}	{39}	{Bartels,AL,",",Balash,Y,",",Gurevieh,T,",",Sehaafsma,JD,",",HausdorffJlV1,",",et,al.,(,2003,),Relationship,between,freezing,of,gait,(,FOG,),and,other,features,of,Parkinson,’s,:,FOG,is,not,correlated,with,bradykinesia,.,]}	{"Eur ] Neurosci 21 : 239 — 243 .","4 ."}	{"Clin Neurosci 10 : 584 ~ 588 .","5 ."}	0.938	0.168	0.618	{INT_NGRAM_[)]_[with],EXT_NGRAM_[(]_[.],SINGLE_VERB_[be],MIN_VERB_GENE_[NULL]_HPO_[correlate]}	{1.97678,1.5354,-1.12513,-0.0245156}
RELATION_GENEHPOTERM_SUP_MAP_SCPDFS_41889.pdf_30_30_17_17_28_29_UNSUP	APP/HP:0002511|Alzheimer disease	{17}	{28,29}	{In,addition,",",analysis,of,regulatory,mechanisms,governing,APLP1,gene,expression,may,be,potentially,extrapolated,to,other,APP,family,members,",",including,those,involved,in,the,pathogenesis,of,Alzheimer,disease,.}	{"In this regard , APLP1 is of particular interest among members of the APP family , because it is localized to the postsynaptic density ( 10 ) .","The PSD is a discshaped proteinaceous structure attached to the inner surface of the postsynaptic membrane and appears to be central to synaptic function ( 20 , 25 , 26 ) ."}	{"Our results indicate that the mouse APLP1 gene spans approximately 10.5 kb and is organized into 17 exons varying between 24 and 409 bp in length ( Fig .","1A ) ."}	0.988	1	1	{EXT_NGRAM_[other]_[.],VERB_[including],INT_NGRAM_[family]_[of],VERB_[involved],MIN_VERB_GENE_[extrapolate]_HPO_[involve]}	{1.71401,1.57058,1.10308,0.13412,0.0378595}
RELATION_GENEHPOTERM_journal.pone.0063169.pdf_30_30_41_41_9_10	Pr/HP:0000819|Diabetes mellitus	{41}	{9,10}	{However,",",although,some,common,risk,factors,",",including,diabetes,mellitus,(,DM,),",",hypertension,and,M,th,d,coronary,artery,disease,(,CAD,),et,al.,[,3,—,5,],",",have,been,explored,e,o,S,in,Pr,‘,3Vi0u5,P0Pu1ati0n,',ba5Cd,Studies,»,Car1Yid,‘,3mitY,Of,indiV,',idua15,We,followed,the,Meta-Analysis,of,Observational,Studies,in,who,have,higher,risk,for,developing,CHF,is,still,difficult,",",especially,Epidemiology,protocol,[,14,],and,Coohraiio,Handbook,guidelines,for,the,general,population,without,apparent,cardiovascular,[,15,],throughout,the,design,),implementation,",",analysis,),and,diseases,(,CV13,),reporting,for,this,study,.}	{"Moreover ) We tried to Ciarify high rates of morbidity and mortality [ 1,2 ] .","Aggressive modiﬁca - which subgroups of Subjects with OH are at higher risk for tion of known CHF risk factors is critical for the primary incident CHF prevention of CHF ."}	{"Orthostatic hypotension ( OH ) , described as abnormal fall in blood pressure ( BP ) on standing , has been observed to be prevalent in both the elderly and the middle-age population [ 6 ] .","Although individuals with OH are often asymptomatic , evidence from several epidemiologic studies indicated that these subjects are associated with increased risk of future CVD or mortality [ 7 — 9 ] ."}	0.992	1	1	{INV_INT_NGRAM_[(]_[in],INV_VERB_[have],INV_VERB_[been],INV_MIN_VERB_[include],INV_VERB_[explored],INV_EXT_NGRAM_[include]_[‘]}	{3.51175,0.631942,-0.467597,-0.325708,0.237269,0}
RELATION_GENEHPOTERM_journal.pone.0059762.pdf_312_312_26_26_30_30	N-myc/HP:0003006|Neuroblastoma	{26}	{30}	{Brodeur,GIVI,",",Seeger,RC,",",Schwab,I,"\\\\",’,I,",",Varmus,HE,",",Bishop,],1,"\\\\",’,I,(,1984,),Ampliﬁcation,of,N-myc,in,untreated,human,neuroblastomas,correlates,with,advanced,disease,stage,.}	{"Lancet 369 : 2106 — 2120 .","2 ."}	{"Science 224 : 11214124 .","3 ."}	0.944	1	1	{POS_SEQ_[IN_JJ_JJ],MIN_VERB_[correlate],INT_NGRAM_[in]_[human],WORD_SEQ_LEN_[3],DEP_PATH_[@prep_in],EXT_NGRAM_[of]_[correlate],"WORD_SEQ_NER_[in untreated human]","WORD_SEQ_[in untreated human]"}	{2.70052,-2.13278,2.09954,-1.68471,1.14294,0.446555,0,0}
RELATION_GENEHPOTERM_gb-2011-12-11-r115.pdf_435_435_15_15_27_27	PBP/HP:0002090|Pneumonia	{15}	{27}	{Smith,AM,",",Klugman,KP,:,Amino,acid,mutations,essential,to,production,of,an,altered,PBP,2X,conferring,high-level,beta-lactam,resistance,in,a,clinical,isolate,of,Streptococcus,pneumoniae,.}	{"Role in the speciﬁcity for beta-lactam antibiotics .","J Biol Chem 1999 , 274:19175 -19180 ."}	{"Antimicrob Agents Chemother 2005 , 4924622-4627 .","Laible G , Hakenbeck R : Penicillin-binding proteins in beta-lactam-resistant laboratory mutants of Streptococcus pneumoniae ."}	1	0.008	1	{EXT_NGRAM_[altered]_[.],SINGLE_VERB_[confer],MIN_VERB_[confer],INT_NGRAM_[2x]_[streptococcus]}	{9.10162,-1.6054,-1.23342,0}
RELATION_GENEHPOTERM_journal.pone.0007904.pdf_1227_1227_12_12_1_1	AF10/HP:0100242|Sarcoma	{12}	{1}	{l,sarcoma,associated,protein,SYT,interacts,with,the,acute,leukemia,associated,protein,AF10,.}	{"Genes Chromosomes Cancer 34 : 2854298 .","de Bruijn DR , dos Santos NR , Thijssen ] , Balemans IVI , Debernardi S , et al. ( 2001 ) The synovia ."}	{"Oncogene 20 : 328143289 .","de Bruijn DR , van Dijk AH , VVillemse 1\\\\/IP , van Kessel AG ( 2008 ) The C terminus of the synovia ."}	0.972	1	0.008	{INV_INT_NGRAM_[associate]_[protein],INV_VERB_[interacts],INV_VERB_[associated],INV_EXT_NGRAM_[l]_[.],INV_MIN_VERB_GENE_[interact]_HPO_[associate]}	{4.02836,-0.514207,0.461037,-0.347413,0}
RELATION_GENEHPOTERM_SUP_MAP_SCPDFS_1613.pdf_55_55_6_6_9_10_UNSUP	HCN4/HP:0001688|Sinus bradycardia	{6}	{9,10}	{In,humans,",",haploinsufﬁ,ciency,of,HCN4,causes,familial,sinus,bradycardia,(,Baruscotti,et,al.,",",2011,;,Milanesi,et,al.,",",2006,),.}	{"Cardiac — speciﬁc deletion of murine Hcn4 causes embryonic lethality with fetal bradycardia ( Stieber et al. , 2003 ) .","Postnatal cardiac deletion of Hcn4 by different methods results in bradycardia of varying severity , from intermittent sinus pauses ( Herrmann et al. , 2007 ) to lethal bradycardia with AV block ( Baruscotti et al. , 2011 ) ."}	{"In addition to its role in sinoatrial automaticity , Hcn4 is expressed at the AV junction , where it regulates junctional pacemaker activity and AV conduction ( Yamamoto et al. , 2006 ) .","Hcn4 is also expressed in the inter — atrial groove and tricuspid annulus , and If is an important detenninant of ectopic atrial rhythms that arise from these tissues ( Shinohara et al. , 2010 ; Yamamoto et al. , 2006 ) ."}	1	1	1	{INT_NGRAM_[cause]_[familial],WORD_SEQ_LEN_[2],EXT_NGRAM_[of]_[(],POS_SEQ_[VBZ_JJ],"WORD_SEQ_NER_[cause familial]","WORD_SEQ_[cause familial]",MIN_VERB_[cause],SINGLE_VERB_[cause],DEP_PATH_[prep_of-nsubj|ciency@dobj]}	{4.48695,-3.81388,2.58999,2.3887,1.87808,1.87808,-0.319585,-0.224795,0.0980622}
RELATION_GENEHPOTERM_SCPDFS_46034.pdf_346_346_35_35_6_9	MT/HP:0001273|Abnormality of the corpus callosum	{35}	{6,8,9}	{We,propose,that,the,gyral,patterning,abnormalities,",",corpus,callosum,and,basal,ganglia,dysgeneses,associated,with,mutations,in,the,u,—,tubu,|,in,encoding,gene,TUBA,1A,could,be,affected,by,the,alteration,of,MT,—,based,functions,(,polarization,for,instance,),",",resulting,in,defective,neuronal,migration,and,axonal,growth,.}	{"Figure 2 .","intermingled and specific cellular defects could cause tubulin-related brain cortex dysgeneses ."}	{"These defects are also observed in cases of PMG with mutations in the Btubulin encoding gene TUBBZB .","The functional links that exist between the two genes further support the idea that the two disorders might share pathophysiological mechanisms ."}	0.944	1	0.996	{INV_VERB_[affected],INV_INT_NGRAM_[and]_[of],INV_MIN_VERB_GENE_[associate]_HPO_[base],INV_VERB_[be],INV_VERB_[encoding],INV_VERB_[associated],INV_EXT_NGRAM_[patterning]_[—]}	{2.37051,1.25136,-1.10618,-0.947328,0.683037,0.461037,0}
RELATION_GENEHPOTERM_journal.pone.0068361.pdf_71_71_61_61_41_41	ABL1/HP:0001009|Telangiectasia	{61}	{41}	{qPCR,Analysis,of,Gene,Expression,of,CCL,and,DNA,Damage,Response,Genes,in,the,STG,during,Progression,of,Dementia,Differentially,expressed,genes,in,the,microarray,analysis,that,encode,critical,proteins,involved,in,ATM-ATR,signaling,in,response,to,DNA,damage,:,ataxia,telangiectasia,mutated,(,ATM,),and,RAD3,related,(,ATR,),",",Abelson,murine,leukemia,viral,oncogene,homolog,1,(,ABL1,),;,checkpoint,homolog,(,CHEK1,),;,mouse,doubled,minute,4,homolog,(,MDM4,),;,nibrin,(,NB1,"\\\\",D,;,tumor}	{"The main converging and diverging hub gene of this network was tumor protein p53 ( TP53 ) .","Majority of the pathways within this network were related to DNA damage response and G1 / S phase transition ( all / ; < 1E-14 ) with the upstream converging nodes including the following genes : ATM , ATR , BRCA1 , CHEK1 and NBN , and thus implicating DNA damage ATM/ATR regulation of G1/S transition pathway in the progression of dementia ."}	{"Table 1 .","Most relevant common and unique gene networks in the STG ( BA22 ) derived from MetaCore analysis by comparing groups of cognitively impaired individuals with cognitively intact controls ( CDR = o ) ."}	1	0.998	0	{INV_EXT_NGRAM_[ataxia]_[)],INV_INT_NGRAM_[mutate]_[(],INV_VERB_[mutated],INV_MIN_VERB_GENE_[mutate]_HPO_[encode]}	{9.88195,9.29966,6.07406,0.820236}
RELATION_GENEHPOTERM_journal.pone.0080363.pdf_99_99_17_17_26_26	NTN4/HP:0100843|Glioblastoma	{17}	{26}	{Silencing,of,either,ITGB4,or,NTN4,induces,glioblastoma,cell,senescence,We,have,previously,analyzed,the,expression,of,NTN4,and,ITGB4,genes,in,the,U251MG,and,U87MG,glioblastoma,cell,lines,.}	{"Statistical significance was determined with the nonparametric MannWhitney U test .",Results}	{"By Q-RT-PCR , we conﬁrmed that both NTN4 and ITGB4 were expressed in all four analyzed glioblastoma cell lines , namely U251MG , U87MG , U118MG and T98G .","Interestingly , the expression of ITGB4 was much lower in U87MG than in the other three cell lines ( Figure 1A ) ."}	0.992	1	1	{EXT_NGRAM_[of]_[cell],MIN_VERB_[analyze],INT_NGRAM_[and]_[u87mg]}	{7.26619,-2.79625,0}
RELATION_GENEHPOTERM_SUP_MAP_journal.pone.0033213.pdf_37_37_1_1_10_10_UNSUP	MLL/HP:0001909|Leukemia	{1}	{10}	{The,MLL,gene,is,involved,in,many,chromosomal,translocations,in,leukemia,[,3,],and,can,also,be,altered,by,partial,tandem,duplication,.}	{"Although these somatic changes have considerable inﬂuence over clinical outcome and constitute valuable biomarkers for disease classiﬁcation [ 2 ] their role in the evolution of the stem cell to a fully transformed leukemic cell has yet to be completely understood .","It is clear that some of the genes altered in AML play key roles in epigenetic regulation both at the DNA and chromatin levels ."}	{"This gene is now recognized as a histone methyltransferase .","The EZH2 gene , which encodes a histone methyltransferase , is subject to inactivating monoallelic and biallelic mutations in myelodysplastic/myeloproliferative neoplasms [ 4 ] ."}	0.978	1	0.996	{EXT_NGRAM_[the]_[[],INT_NGRAM_[gene]_[in],MIN_VERB_[involve],VERB_[is],VERB_[involved]}	{3.11676,2.21253,-0.743378,-0.637309,0.13412}
RELATION_GENEHPOTERM_journal.pone.0061088.pdf_789_789_12_12_28_28	PI3K/HP:0002665|Lymphoma	{12}	{28}	{Together,",",the,data,suggest,the,elevated,expression,of,genes,in,the,PI3K,signaling,pathway,in,B-cell,lymphoma,",",a,ﬁnding,that,has,also,been,noted,in,human,lymphoma,.}	{"In summary , we have identiﬁed genes differentially expressed between the normal lymph nodes of disease free dogs and dogs diagnosed with B-cell lymphoma using two methods : RNA microarray and RNA-Seq .","We report statistical methods for treating the combined data from these technologies as a means for collaboratively supporting biological discovery from the different platforms ."}	{"Since dogs form tumors spontaneously and have a strong breed predilection towards speciﬁc types of cancer , the dog is an excellent translational model for identifying the genetic basis associated with lymphoma .","Supporting Information"}	1	1	0.516	{EXT_NGRAM_[the]_[.],INT_NGRAM_[signaling]_[human],VERB_[noted],VERB_[has],VERB_[been],MIN_VERB_GENE_[suggest]_HPO_[note]}	{3.03416,2.5378,1.88759,-0.54247,0.445938,0}
RELATION_GENEHPOTERM_journal.pone.0074359.pdf_417_417_32_32_28_29	rd7/HP:0000546|Retinal degeneration	{32}	{28,29}	{Akhmedov,NB,",",Piriev,NI,",",Chang,B,",",Rapoport,AL,",",Hawes,NL,et,al.,(,2000,),A,deletion,in,a,photoreceptor-speciﬁc,nuclear,receptor,mRNA,causes,retinal,degeneration,in,the,rd7,mouse,.}	{"PubMed : 18547563 .",.}	{"Proc Natl Acad Sci U S A 97 : 5551-5556 .","doi :10.1073 / pnas .97.10.5551 ."}	1	1	1	{INV_WORD_SEQ_LEN_[2],INV_POS_SEQ_[IN_DT],INV_DEP_PATH_[nn-prep_in|mouse@],"INV_WORD_SEQ_[in the]","INV_WORD_SEQ_NER_[in the]",INV_INT_NGRAM_[in]_[the],INV_MIN_VERB_[cause],INV_EXT_NGRAM_[cause]_[mouse],INV_SINGLE_VERB_[cause]}	{-5.45499,-3.9319,3.62389,3.39008,3.39008,2.03003,1.19445,0.909343,0.702884}
RELATION_GENEHPOTERM_journal.pone.0019234.pdf_52_52_20_20_9_10	HCC/HP:0001402|Hepatocellular carcinoma	{20}	{9,10}	{Finally,",",Sasaki,et,al,examined,cases,of,primary,hepatocellular,carcinoma,(,HCC,),",",showing,that,RANKL,expression,in,HCC,cells,correlated,with,the,development,of,bone,metastasis,after,hepatic,resection,[,20,],.}	{"However , breast tumors retaining RANKL expression tend to be less differentiated and estrogen receptor negative [ 17 ] .","In prostate , RANKL / RANK expression is low in normal tissue but high in neoplastic tissues and even higher in metastatic lesions [ 18,19 ] ."}	{"On the basis of a high constitutive RANK expression in breast cancer specimens and cell lines , recent data suggest that the RANK status in cancer cells determines their tendency to metastasize to bone whereas RANKL is abundantly expressed [ 16 ] .","This hypothesis is supported by the observation that RANKL induces the migration of various RANK-expressing cancer cell lines in vitro , in a manner that is blocked by RANKL inhibitors ( OPG or sRANK/RANK-Fc ) ."}	0.99	1	1	{INV_INT_NGRAM_[(]_[in],INV_VERB_[showing],INV_EXT_NGRAM_[primary]_[cell],INV_MIN_VERB_GENE_[examine]_HPO_[correlate]}	{3.51175,0.846992,0,0}
RELATION_GENEHPOTERM_SUP_MAP_SCPDFS_44102.pdf_9_9_9_9_6_7_UNSUP	DMD/HP:0003560|Muscular dystrophy	{9}	{6,7}	{Characterization,of,Xp21,distal,to,Duchenne,muscular,dystrophy,(,DMD,),in,the,region,containing,the,genes,for,adrenal,hypoplasia,congenita,(,AHC,),and,glycerol,kinase,deﬁciency,(,GKD,),has,been,limited,due,to,a,paucity,of,probes,.}	{"and *** Gifu University School of Medicine , Gifu 500 , Japan","Received December 26 , 7991 ; revised April 8 , 1992"}	{"Two probes were localized between DXS28 ( C7 ) and AHC , the yeast artiﬁcial chromosome insert YHX39 ( DXS727 ) and the polymorphic phage clone QST59 ( DXS319 ) .","A genomic clone , FT1 ( DXS7 26 ) , 3 ’ to DMD , was also characterized ."}	1	0.014	0.972	{INV_EXT_NGRAM_[Duchenne]_[)],INV_DEP_PATH_[dobj@],INV_WORD_SEQ_LEN_[1],INV_WORD_SEQ_[(],INV_MIN_VERB_[contain],INV_WORD_SEQ_NER_[NUMBER],INV_POS_SEQ_[CD],INV_INT_NGRAM_[(]_[(]}	{22.4432,-14.7767,-13.9342,10.2313,-3.0986,2.36405,2.12943,0.697516}
RELATION_GENEHPOTERM_journal.pone.0044996.pdf_408_408_4_4_16_17	APP/HP:0100316|Hirano bodies	{4}	{16,17}	{In,addition,",",the,APP,binding,adaptor,protein,Fe65,has,also,been,shown,to,co-localize,with,Hirano,bodies,in,brain,and,cell,cultures,[,"6,47",],.}	{"Our results obtained using the cell culture model system show that cell death induced by either APP/c31 in the presence or absence of 352PHPtau or APP / AICDc58 is signiﬁcantly reduced in the presence of model Hirano bodies .","Both tau and the c-terminal region of APP have been shown to co-localize with Hirano bodies in post-mortem samples as well as in model Hirano bodies in cell culture [ 6,35,43,47 ] ."}	{"Both C31 and 352PHPtau co-localize with model Hirano bodies , but unlike 352PHPtau , the distribution of c31 changes from diffuse in control samples to concentrated and co-localized with Hirano bodies .","The interaction of tau with Hirano bodies could occur through tau and its phosphorylated forms binding directly to F-actin [ 96 ] ."}	0.916	1	0.256	{EXT_NGRAM_[the]_[in],INT_NGRAM_[binding]_[with],VERB_[has],VERB_[been],VERB_[shown],VERB_[co-localize],MIN_VERB_GENE_[show]_HPO_[co-localize]}	{1.81657,0.739985,-0.54247,0.445938,-0.303796,0,0}
RELATION_GENEHPOTERM_SCPDFS_41023.pdf_163_163_22_22_27_27	WT1/HP:0000526|Aniridia	{22}	{27}	{Conversely,",",all,members,of,the,contig,were,within,the,deletions,of,WESMI,and,TAK,",",who,are,not,deleted,for,the,WT1,gene,but,who,have,aniridia,and,are,missing,one,copy,of,PAX6,.}	{"The distal DAR deletion breakpoint is known to be within the 375-kb NotI fragment ( Fig .","1 ) ."}	{"An individual , THOPH , with triphasic Wilms ’ tumor and hypospadias but no aniridia , was deleted for WT1 but not for cSRL9a9 .","FISH signal with H11148 was strong on the normal chromosome 11 from THOPH but weak on the deletion-bearing chromosome , suggesting that this cosmid spans the distal THOPH breakpoint ( Fig ."}	0.93	1	0.536	{EXT_NGRAM_[the]_[and],WORD_SEQ_LEN_[4],INT_NGRAM_[gene]_[have],VERB_[have],NEG_VERB_[not]-delete,DEP_PATH_[nn-prep_for|gene@dobj-conj_but|have],"WORD_SEQ_NER_[gene but who have]","WORD_SEQ_[gene but who have]",POS_SEQ_[NN_CC_WP_VBP],MIN_VERB_GENE_[delete]_HPO_[have]}	{2.37855,-1.64556,1.55251,0.383994,-0.191177,0,0,0,0,0}
RELATION_GENEHPOTERM_SUP_MAP_journal.pone.0024308.pdf_397_397_8_8_4_6_UNSUP	SMA/HP:0007269|Spinal muscular atrophy	{8}	{4,5,6}	{Similarly,modiﬁed,oligonucleotides,for,spinal,muscular,atrophy,(,SMA,),resulted,in,putative,therapeutic,levels,in,all,regions,of,the,spinal,cord,after,intrathecal,infusion,in,non-human,primates,[,62,],.}	{"for the treatment of neurodegenerative disorders and are found to be taken up by neurons when delivered into the cerebral lateral ventricles .","As treatment for ALS 2 ’ - O-methoxyethyl modiﬁed deoxynucleotides infused intraventricularly were found to reduce both SODI transcript and protein levels in rats and rhesus monkeys , which resulted in a slower disease progression [ 34 ] ."}	{"The exact mechanism by which the AONs are used in the current study to reduce transcript levels and why they show both an allele and gene preference is not known .","This selective repeatlength dependent reduction was also seen in myotonic dystrophy type 1 after ( CAG ) 7 AON treatment [ 63 ] ."}	0.92	0.996	1	{INV_WORD_SEQ_LEN_[1],INV_WORD_SEQ_[(],INV_WORD_SEQ_NER_[(],INV_POS_SEQ_[NN],INV_EXT_NGRAM_[for]_[)],INV_MIN_VERB_[result],INV_DEP_PATH_[nn@nn],INV_INT_NGRAM_[(]_[(],INV_SINGLE_VERB_[result]}	{-13.9342,10.2313,3.57571,1.33604,0.885514,-0.868969,0.80522,0.697516,-0.12715}
RELATION_GENEHPOTERM_SUP_MAP_journal.pone.0104154.pdf_216_216_31_31_56_56_UNSUP	FGF23/HP:0002749|Osteomalacia	{31}	{56}	{Phex,—,mutant,Hyp,mice,exhibit,elevated,FGF23,expression,",",hypophosphatemia,and,rickets/osteomalacia,Hyp,mice,with,inactivating,Phex,mutations,have,very,high,production,of,FGF23,in,osteocytes,and,markedly,elevated,circulating,FGF23,levels,leading,to,hypophosphatemia,and,abnormalities,in,vitamin,D,metabolism,",",as,well,as,impaired,mineralization,of,cartilage,and,bone,leading,to,rickets,and,osteomalacia,[,"31,39,47",],.}	{"As expected due to the inclusion of an Fgfrl null allele in the conditional knockout strategy , Fgfrl transcripts were reduced by ~ 50 % reduction in kidney of FgfrID \\" ‘ P1 \\" KO-null mice .","However , there were no signiﬁcant differences in the F GF23-regulated genes , including N , / bt2a , Npt2c , Cyp24aZ and Cy , / D2719 ] , or oc-Klotho transcripts in the kidney of FgfrID \\" ‘ p1 \\" ‘ KO-null mice ( Table 3 ) ."}	{"These features were present in Hyp mice in this study .","Hyp mice derived from the current breeding strategy were considerably smaller , had signiﬁcantly lower body weight , and demonstrated reductions in tail and femur lengths due to the presence of rickets/osteomalacia ( Figure 2A and 3A ) ."}	0.98	1	1	{INT_NGRAM_[level]_[and],EXT_NGRAM_[circulate]_[[],MIN_VERB_GENE_[lead]_HPO_[lead],VERB_[leading]}	{2.75878,1.74899,0.30319,-0.21364}
RELATION_GENEHPOTERM_journal.pone.0021050.pdf_608_608_87_87_64_65	TS/HP:0008763|No social interaction	{87}	{64,65}	{GC,:,General,conditions,",",LD,:,Light,/,Dark,transition,test,",",OF,:,Open,ﬁeld,test,",",EP,:,Elevated-plus,maze,",",PS,:,Porsolt,forced,swim,test,",",HP,:,Hot,plate,test,",",SI,:,Social,interaction,test,",",RR,:,Rotarod,treadmill,test,",",PPI,:,Prepulse,inhibition,test,",",YM,:,Y-maze,test,",",CSI,:,Crawley,’s,social,interaction,test,",",BM,:,Barnes,maze,test,",",MW,:,Morris,water,maze,test,",",FZ,:,Fear,conditioning,test,",",TS,:,Tail,suspension,test,.}	{"Supporting Information","Figure S1 Tirne course of each task of behavioral analysis ."}	{"( TIF )","Figure S2 General conditions in 13-week-old mice ."}	0.996	0.1	0	{INV_EXT_NGRAM_[’s]_[:],INV_MIN_VERB_[swim],"INV_INT_NGRAM_[test]_[,]"}	{4.49964,0,0}
RELATION_GENEHPOTERM_journal.pbio.1000031.pdf_241_241_19_19_15_17	HED/HP:0007607|Hypohidrotic ectodermal dysplasia	{19}	{15,16,17}	{Human,mutations,in,these,and,other,members,of,the,ectodysplasin,pathway,cause,various,forms,of,hypohidrotic,ectodermal,dysplasia,(,HED,),",",which,manifests,by,speciﬁcally,affecting,ectodermal,appendages,[,52,],.}	{"not related to an epithelial appendage per se ( e.g. , hair , tooth , or scale ) .","edu and edar are members of the tumor necrosis factor ( TNF ) superfamily and are imperative for the correct formation and patterning of ectodermal appendages in vertebrates such as feathers , hair , teeth , scales , and glands [ 52 — 56 ] ."}	{"“ Dental ” Genes Similarly Pattern Skeletal Structures on PA3 — 6 Both add and edar are involved in “ gill raker ” patterning along the mesiodistal axis of each gill bar .","Gill rakers are skeletal elements of the oropharyngeal cavity that line the dorsal region of the cartilaginous gill arches from PA ? )"}	0.928	0.384	0	{INV_WORD_SEQ_LEN_[1],INV_WORD_SEQ_[(],INV_WORD_SEQ_NER_[(],INV_POS_SEQ_[NN],INV_INT_NGRAM_[(]_[(],INV_EXT_NGRAM_[of]_[)],INV_DEP_PATH_[@nn-prep_of|(-nsubj|form],INV_MIN_VERB_[hed]}	{-13.9342,10.2313,3.57571,1.33604,0.697516,0.43859,0,0}
