relation_id	relation_name	gene_words	hpoterm_words	words	sentences_before	sentences_after	expectation	gene_expectation	hpoterm_expectation	features	weights
RELATION_GENEHPOTERM_journal.pone.0042644.pdf_48_48_23_23_9_10	TOR/HP:0007325|Generalized dystonia	{23}	{9,10}	{DYT1,",",the,most,common,inherited,",",early-onset,",",generalized,dystonia,[,3,],",",is,caused,by,dominant,mutations,in,the,gene,TOR,],/,1,which,encodes,the,protein,torsinA,[,4,],.}	{"Answering this question could help us gain a better understanding of the neurobiological process underlying both inherited and sporadic forms of this heterogeneous condition .","The identiﬁcation of causative genes in some forms of inherited dystonia has led to the generation of animal models that can be used to explore the neurobiological bases of this syndrome [ 2 ] , including geneenvironment interactions ."}	{"Most patients with DYT1 present in the first two decades of life with dystonia affecting an extremity that subsequently generalizes , causing signiﬁcant disability [ 5 ] .","An interesting feature of the DYT1-causing mutation is its reduced clinical penetrance ."}	0.954	1	0.008	{INV_VERB_[caused],INV_VERB_[is],INV_INT_NGRAM_[[]_[gene],"INV_EXT_NGRAM_[,]_[]]",INV_MIN_VERB_GENE_[generalize]_HPO_[cause]}	{3.98353,-0.838023,0.369832,-0.348948,0.00115118}
RELATION_GENEHPOTERM_journal.pone.0082767.pdf_697_697_25_25_32_34	VAPB/HP:0007354|Amyotrophic lateral sclerosis	{25}	{32,33,34}	{Nishimura,AL,",",Mitne-Neto,M,",",Silva,HC,",",Richieri-Costa,A,",",Middleton,S,et,al.,(,2004,),A,mutation,in,the,vesicle-trafficking,protein,VAPB,causes,late-onset,spinal,muscular,atrophy,and,amyotrophic,lateral,sclerosis,.}	{"doi : 10.3390 / ijms140610908 .","PubMed : 23708095 ."}	{"Am J Hum Genet 75 : 822-831 .","doi :10.1086 / 425287 ."}	1	1	1	{INT_NGRAM_[cause]_[and],EXT_NGRAM_[protein]_[.],WORD_SEQ_LEN_[6],MIN_VERB_[cause],SINGLE_VERB_[cause],"WORD_SEQ_NER_[cause late-onset spinal muscular atrophy and]",POS_SEQ_[VBZ_JJ_JJ_JJ_NN_CC],DEP_PATH_[prep_in-rcmod|(-appos|S-nsubj|AL@dobj],"WORD_SEQ_[cause late-onset spinal muscular atrophy and]"}	{6.3635,2.80959,-1.13804,-0.319585,-0.224795,0,0,0,0}
RELATION_GENEHPOTERM_journal.pone.0013238.pdf_282_282_11_11_38_39	FXR/HP:0004943|Accelerated atherosclerosis	{11}	{38,39}	{This,contention,results,from,the,aggregate,evaluation,of,the,fact,that,FXR,gene,ablation,results,in,a,pro-atherogenic,lipoproteins,proﬁle,[,15,],and,FXR,and,ApoE,double,knockout,male,mice,fed,an,high,fat,diet,develop,an,accelerated,atherosclerosis,in,comparison,to,ApoE,_,/,_,single,knock,out,mice,[,27,],.}	{"P PLoS ONE | www .","p | osone.org be an interesting target for preventing development of atherosclerosis ."}	{"In addition , we and others have demonstrated that FXR activation protects against atherosclerosis plaque formation in ApoE _ / _ and LDLr _ / _ mice [ 16,17 ] .","In the present study we have provided evidence that FXR activation with CDCA effectively protects against dyslipidemia and atherosclerosis development in rodents fed ritonavir , a widely used HIV PI ( Figure 8 ) ."}	0.972	1	1	{VERB_[fed],INT_NGRAM_[gene]_[a],VERB_[develop],EXT_NGRAM_[that]_[in],VERB_[results],MIN_VERB_GENE_[result]_HPO_[accelerate],VERB_[proﬁle]}	{-3.0889,2.79353,2.6613,1.41659,-0.0498702,0,0}
RELATION_GENEHPOTERM_SUP_MAP_SCPDFS_19511.pdf_168_168_22_22_0_0_UNSUP	DM1/HP:0000518|Cataract	{22}	{0}	{Cataracts,Cataract,formation,occurs,early,in,DM1,and,loss,of,SIX5,gene,is,one,of,the,possible,causes,of,cataract,formation,in,DM1,patient,(,Personius,et,al.,",",2005,),.}	{"Respiratory problem therapeutics If the patient has normal sleep though symptoms persist in spite of treatment of sleep disordered breathing , then CNS stimulant drugs such as modaﬁnil ( 200 — 400 mg/day ) and dexamphetamine or methylphenidate can be used ( Wintzen et al. , 2007 ) .",.}	{"In such cases surgery is recommended ( Garrott et al. , 2004 ) .",.}	0.998	1	0.998	{INV_EXT_NGRAM_[NULL]_[patient],INV_MIN_VERB_GENE_[occur]_HPO_[be],INV_VERB_[is],INV_INT_NGRAM_[cataract]_[in],INV_VERB_[occurs]}	{3.85171,1.62426,-0.838023,0.740871,0.156809}
RELATION_GENEHPOTERM_SUP_MAP_SCPDFS_38512.pdf_92_92_5_5_52_56_UNSUP	SOX3/HP:0011747|Abnormality of the anterior pituitary	{5}	{52,55,56}	{However,",",a,mutation,of,SOX3,that,resulted,in,an,in-frame,duplication,of,33,bp,with,a,subsequent,expansion,of,a,polyalanine,tract,has,been,reported,to,cause,mental,retardation,and,growth,deﬁciency,in,one,family,",",and,a,conditional,disruption,of,SOX3,in,mice,has,been,reported,to,result,in,developmental,abnormalities,of,the,anterior,pituitary,and,midline,CNS,structures,[,"15,16",],.}	{"nervous system ( CNS ) , the urogenital ridge , and the sensory placodes [ 11,12 ] .","Moreover , in chicken , SOX3 is expressed in the epibranchial placodes adjacent to the endoderrnal tissue from which the parathyroid glands are proposed to develop [ 13,14 ] ."}	{"These congenital endocrine defects due to SOX3 abnormalities suggest that SOX3 may have a role in the endocrinopathy associated with X — linked recessive HPT [ 16 ] .","The U7snRNA homologue belongs to a family of short , metabolically stable , nonpolyadenylated RNA molecules that are located in the nuclei of all eukaryotic cells where they are associated with speciﬁc proteins to form small nuclear riboproteins ( snRNP ) ."}	0.996	1	0.996	{EXT_NGRAM_[of]_[and],VERB_[cause],VERB_[result],VERB_[resulted],VERB_[has],VERB_[been],MIN_VERB_GENE_[result]_HPO_[result],VERB_[reported],INT_NGRAM_[that]_[developmental]}	{3.02321,1.66888,1.35068,-0.687196,-0.54247,0.445938,0.392366,-0.12181,0}
RELATION_GENEHPOTERM_SUP_MAP_journal.pgen.1000649.pdf_49_49_32_32_44_45_UNSUP	SCN9A/HP:0002373|Febrile seizures	{32}	{44,45}	{In,a,genomic,region,on,human,chromosome,2,known,to,harbor,the,febrile,seizure,SCNIA,sodium,channel,gene,",",we,now,report,a,disease,—,causing,mutation,in,the,adjacent,gene,",",SCN9A,(,Na,",",",1.7",),",",in,a,large,family,with,febrile,seizures,.}	{"— .","documented , efforts to uncover these genes have yielded only a few genes in a small proportion of cases ."}	{"We introduced the family mutation ( N64lY ) into the orthologous mouse gene to create a knockin mouse model , and tested seizure susceptibility in these mice .","Compared to wild — type mice , our $ cn9a knockin mice have a signiﬁcantly lower threshold to electrically induced seizures and experience seizures at a significantly faster rate with repeated subthreshold stimulation ."}	0.904	1	1	{"EXT_NGRAM_[,]_[.]",MIN_VERB_[cause],INT_NGRAM_[(]_[with]}	{2.79598,-0.319585,-0.103197}
RELATION_GENEHPOTERM_journal.pone.0057445.pdf_29_29_6_6_30_31	TSC/HP:0012469|Infantile spasms	{6}	{30,31}	{Interestingly,",",however,",",seizures,in,TSC,are,highly-responsive,to,the,drug,",",vigabatrin,(,V,GB,),",",with,a,~,95,‘,),/,o,efﬁcacy,in,stopping,infantile,spasms,in,TSC,patients,[,"8,9",],.}	{"| nt | - oduction form of seizures in infants , occur in about one-third of TSC patients .","Overall , the majority of patients with TSC and epilepsy have medically-intractable epilepsy [ 7 ] ."}	{"Furthermore , resolution of seizures is often associated with improved developmental progress .","Recently it has been proposed that starting VGB at an early age , at or prior to the onset of clinical seizures , may improve the long-term outcome of epilepsy and neurodevelopment in TSC patients [ 10 , ] 1 ] ."}	0.952	1	0.02	{EXT_NGRAM_[in]_[in],VERB_[are],INT_NGRAM_[be]_[stop],VERB_[stopping],MIN_VERB_GENE_[be]_HPO_[stop]}	{3.83264,-0.452099,-0.311616,0,0}
RELATION_GENEHPOTERM_SUP_MAP_journal.pone.0081625.pdf_177_177_12_12_21_22_UNSUP	IKBKG/HP:0000968|Ectodermal dysplasia	{12}	{21,22}	{In,conclusion,",",we,have,identiﬁed,a,nonsense,variant,in,the,equine,IKBKG,gene,as,most,likely,causative,for,a,hereditary,ectodermal,dysplasia,in,horses,.}	{"If the causative variant in the IP affected horses had been located e.g. in exon 4 , which is currently not contained in the genomic reference sequence or in one of the later exons , which are not all correctly annotated , our whole genome sequencing experiment would have failed to yield the causative variant .","This clearly emphasizes the need for continuous updating and improving of genome reference sequences , which are an enormously important asset in current veterinary genetics ."}	{"A mutation event at the homologous nucleotide position has independently occurred in a human family segregating for IP .","Thus , the genetic ﬁndings in humans and horses mutually corroborate the causality of the variant and conﬁrm that horses with this genetic defect are a valuable large animal model for human IP ."}	0.982	1	1	{INT_NGRAM_[gene]_[hereditary],MIN_VERB_[identiﬁed],EXT_NGRAM_[equine]_[in]}	{4.4167,-0.791596,0.0178149}
RELATION_GENEHPOTERM_journal.pone.0054525.pdf_10_10_40_41_55_55	glucosylceramide_synthase/HP:0001909|Leukemia	{40,41}	{55}	{We,found,that,the,combination,of,D,",",L,—,threo,—,1,—,phenyl,—,2,—,decanoy,|,amino,—,3,—,morpho,|,ino,—,1,—,propano,|,(,PDMP,),hydrochloride,",",an,inhibitor,of,glucosylceramide,synthase,",",potently,synergized,with,ABT,—,263,in,the,killing,of,multiple,human,leukemia,cell,lines,.}	{"BCL2 — | ike family members are key proteins that regulate apoptosis .","We conducted a screen to identify drugs that could be combined with an inhibitor of anti — apoptotic BCL2 — | ike proteins , ABT — 263 , to kill human leukemia cells lines ."}	{"Treatment of cells with PDMP and ABT — 263 led to dramatic elevation of two pro — apoptotic sphingolipids , namely ceramide and sphingosine .","Furthermore , treatment of cells with the sphingosine kinase inhibitor , SKi — II , also dramatically synergized with ABT — 263 to kill leukemia cells and similarly increased ceramides and sphingosine ."}	0.998	1	1	{EXT_NGRAM_[of]_[cell],"INT_NGRAM_[,]_[human]",MIN_VERB_[synergize],VERB_[synergized]}	{7.26619,-2.74323,0.656162,0}
RELATION_GENEHPOTERM_journal.pone.0062200.pdf_54_54_5_5_16_16	HJURP/HP:0100843|Glioblastoma	{5}	{16}	{Furthermore,",",we,demonstrated,that,HJURP,knockdown,in,different,cell,lines,signiﬁcantly,affected,the,survival,of,glioblastoma,cells,but,did,not,impact,nontumoral,cells,.}	{"We previously demonstrated that HJURP is highly overexpressed in GBM [ 19 ] .","Here we found that HJURP over expression in astrocytoma patients of our cohort is also associated with poor survival ."}	{"After HJURP silencing , T98G and U87MG cells showed cell cycle arrest and premature senescence , respectively , which culminated in elevated levels of cell death for both cell lines .","These ﬁndings support the hypothesis that HJURP might have an important role in the progression and / or maintenance of malignant gliomas , and possibly represent a novel target for development of new therapies for glioma patients ."}	0.998	1	1	{EXT_NGRAM_[that]_[cell],VERB_[affected],INT_NGRAM_[knockdown]_[of],MIN_VERB_GENE_[do]_HPO_[affect]}	{5.69705,0.883654,0.61929,-0.160651}
RELATION_GENEHPOTERM_journal.pone.0061916.pdf_118_118_16_16_6_6	YAP/HP:0009733|Glioma	{16}	{6}	{For,that,purpose,we,used,the,glioma,cell,line,SF268,",",which,expresses,high,levels,of,YAP,due,to,genomic,ampliﬁcation,of,the,gene,(,https,:,/,/,cansar,.}	{"In an attempt to identify novel regulators of YAP and the Hippo pathway we carried out a YAP immunoprecipitation ( IP ) experiment .","As most of the current studies on YAP interaction partners have been restricted to overexpression of YAP in mechanistic settings , we decided to look at interaction partners of endogenous YAP in a cancer-relevant model ."}	{"icr .","ac ."}	0.998	1	1	{INV_INT_NGRAM_[cell]_[of],INV_MIN_VERB_[express],INV_VERB_[expresses],INV_EXT_NGRAM_[the]_[due]}	{7.29201,-2.35635,0.931266,0}
RELATION_GENEHPOTERM_SCPDFS_40383.pdf_180_180_0_0_30_30	BID/HP:0000589|Coloboma	{0}	{30}	{BID,maps,outside,the,duplication,region,deﬁned,by,the,dic,r,[,22,],CES,patient,and,is,thus,not,a,candidate,for,this,child,’s,malformations,",",which,included,coloboma,",",imperforate,anus,",",preauricular,skin,tags,and,pits,",",cardiac,and,urogenital,defects,",",cleft,palate,",",and,micrognathia,(,10,),.}	{"This suggestion is supported by the evidence that misregulation of other BCL-2 family members ( both apoptotic agonists and antagonists ) results in speciﬁc tissue defects ( 5 ) .","For example , Bcl2 ( antagonist ) - deﬁcient mice have kidney and lymphoid hypoplasia ( 13 ) , while Bax ( agonist ) - deﬁcient mice have lymphoid hyperplasia as well as atrophic testes ( 6 ) ."}	{"Length , weight , and head circumference of the baby were within the normal range , which is not unusual in CES .","However , because the child died at 17 days , physical and mental development could not be assessed ."}	0.982	1	0.996	{"EXT_NGRAM_[NULL]_[,]",VERB_[is],VERB_[included],VERB_[deﬁned],VERB_[maps],MIN_VERB_GENE_[map]_HPO_[include],INT_NGRAM_[map]_[include]}	{3.13771,-0.637309,0.609039,0.566329,0.211608,0,0}
RELATION_GENEHPOTERM_SCPDFS_39788.pdf_210_210_23_23_15_15	BAT/HP:0002666|Pheochromocytoma	{23}	{15}	{Interestingly,",",PPARGC1,mRNA,was,also,expressed,in,perirenal,adipose,tissue,of,a,patient,with,pheochromocytoma,",",a,tumor,associated,with,expansion,of,BAT,and,induction,of,UCP1,gene,expression,in,perirenal,fat,(,14,),(,Fig,.}	{"PPARGC1 mRNA was highly expressed in heart , skeletal muscle , and kidney , to a lesser degree in liver , and at a low , but clearly detectable , level in pancreas and brain ( Fig .","4A ) ."}	{"4B ) .","Within each tissue , two bands , differing in length according to the two polyadenylation signals described , were detected ."}	0.938	1	0.998	{INV_WORD_SEQ_LEN_[7],INV_MIN_VERB_GENE_[express]_HPO_[associate],INV_EXT_NGRAM_[with]_[and],"INV_INT_NGRAM_[,]_[of]",INV_VERB_[associated],"INV_POS_SEQ_[,_DT_NN_VBN_IN_NN_IN]","INV_WORD_SEQ_NER_[, a tumor associate with expansion of]",INV_DEP_PATH_[prep_of-prep_with|expansion-partmod|associate-appos|tumor@],"INV_WORD_SEQ_[, a tumor associate with expansion of]"}	{-2.01984,1.75263,1.72595,0.780273,0.461037,0,0,0,0}
RELATION_GENEHPOTERM_SUP_MAP_journal.pone.0052312.pdf_10_10_25_25_43_44_UNSUP	SNCA/HP:0100315|Lewy bodies	{25}	{43,44}	{Synuc,|,ein,is,a,key,protein,in,PD,",",with,missense,and,multiplication,mutations,in,the,gene,encoding,cx,—,synuc,|,ein,(,SNCA,),having,been,reported,in,familial,cases,of,PD,",",and,accumulation,of,the,protein,identified,in,Lewy,bodies,(,LBs,),and,Lewy,neurites,(,LNs,),in,affected,brain,regions,.}	{"oi .","— ."}	{"With the objective of validating the use of oi — synuc | ein as a clinical or progressive biomarker in an accessible tissue , we used an enzyme — linked immunosorbent assay ( ELISA ) to measure oc — synuc | ein levels in the peripheral blood plasma of idiopathic PD and LRRK2 mutation carrier patients and compared our ﬁndings with healthy control subjects .","Compared to healthy controls , we found a signiﬁcant decrease in plasma total oc — synuc | ein levels in idiopathic PD ( iPD ) patients ( n = 134 , p = 0.010 ) ."}	0.996	0.05	0	{INT_NGRAM_[)]_[in],EXT_NGRAM_[(]_[(],VERB_[identified],VERB_[been],MIN_VERB_GENE_[report]_HPO_[identify],VERB_[having],VERB_[reported]}	{2.54473,1.18745,0.596652,0.445938,0.319994,-0.123649,-0.12181}
RELATION_GENEHPOTERM_SUP_MAP_journal.pone.0061369.pdf_550_550_45_45_22_22_UNSUP	PTRF/HP:0011675|Arrhythmia	{45}	{22}	{Rajab,A,",",Straub,V,",",NIcCann,LJ,",",Seelow,D,",",Varon,R,",",et,al.,(,2010,),Fatal,Cardiac,Arrhythmia,and,Long-QT,Syndrome,in,a,New,Form,of,Congenital,Generalized,Lipodystrophy,with,l,"\\\\",’,Iuscle,Rippling,(,CGL4,),Due,to,PTRF,~,CAV,IN,.}	{"Hayashi T , Arimura T , Ueda K , Shibata H , Hohda S , et al. ( 2004 ) Identification and functional analysis of a caveolin-3 mutation associated with familial hypertrophic cardiomyopathy .","Biochemical and Biophysical Research Commu4 nications 313 : 1784184 ."}	{"\\\\ Iutations .","PLoS Genet 6 : e1000874 ."}	0.91	1	1	{INV_INT_NGRAM_[and]_[to],INV_MIN_VERB_[ripple],INV_SINGLE_VERB_[ripple],INV_EXT_NGRAM_[cardiac]_[~]}	{1.46062,0.375237,0.375237,0.186763}
RELATION_GENEHPOTERM_SUP_MAP_journal.pgen.1002608.pdf_537_537_7_7_14_15_UNSUP	DMD/HP:0003560|Muscular dystrophy	{7}	{14,15}	{p53,mutations,are,involved,in,cancers,;,DMD,and,CMD,mutations,are,involved,in,muscular,dystrophies,;,CF,mutations,are,involved,in,cystic,ﬁbrosis,and,beta,mutations,are,involved,in,beta-thalassemia,disease,(,see,Materials,et,Methods,for,references,),.}	{"These sequences were inserted into the dual reporter vector in order to determine readthrough level .","Nonsense mutations are named by the gene or the disease related to and by their position ( amino-acid ) ."}	{"Nonsense mutations are classiﬁed according to their gentamicin induced readthrough level .","( PDP )"}	0.998	1	1	{EXT_NGRAM_[;]_[;],DEP_PATH_[nn-nsubjpass|mutation@prep_in],INT_NGRAM_[and]_[in],WORD_SEQ_LEN_[6],MIN_VERB_[involve],VERB_[are],VERB_[involved],POS_SEQ_[CC_NNP_NNS_VBP_VBN_IN],"WORD_SEQ_NER_[and CMD mutation be involve in]","WORD_SEQ_[and CMD mutation be involve in]"}	{5.1938,2.31211,2.06853,-1.13804,-0.743378,-0.452099,0.13412,0.0980622,0.0980622,0.0980622}
RELATION_GENEHPOTERM_journal.pgen.1003573.pdf_7_7_4_4_0_2	ACC/HP:0001057|Aplasia cutis congenita	{4}	{0,1,2}	{Aplasia,cutis,congenita,(,ACC,),manifests,with,localized,skin,defects,at,birth,of,unknown,cause,",",mostly,affecting,the,scalp,vertex,.}	{"Cutaneous Biology Research Center , Massachusetts General Hospital , Department of Dermatology , Harvard Medical School , Charlestown , Massachusetts , United States of America",Abstract}	{"Here , genome — wide linkage analysis and exome sequencing was used to identify the causative mutation in autosomal dominant ACC .","A heterozygous Arg ."}	0.936	0.21	0.844	{INV_WORD_SEQ_LEN_[1],INV_WORD_SEQ_[(],INV_WORD_SEQ_NER_[NUMBER],INV_POS_SEQ_[CD],INV_DEP_PATH_[nn-dep|)@],INV_INT_NGRAM_[(]_[(],INV_EXT_NGRAM_[NULL]_[)],INV_MIN_VERB_[manifest]}	{-13.9342,10.2313,2.36405,2.12943,1.11142,0.697516,0.409907,-0.0990252}
RELATION_GENEHPOTERM_journal.pone.0048084.pdf_137_137_4_4_7_7	TSA/HP:0003006|Neuroblastoma	{4}	{7}	{Membrane,potential,depolarization,and,TSA,treatment,of,neuroblastoma,cells,cause,splicing,factors,accumulation,in,speckles,.}	{"ie § E","Figure 1 ."}	{"( A ) N2a cells were transiently transfected with plasmids encoding SRSF2 or SRSF1 splicing factors fused to EGFP , along with a plasmid encoding histone H3 fused to mCherry .","After one day , cells were either treated for 6 hours with 0.2 ng/pl TSA ( TSA ) , 60 mM KCI ( DEPOL ) or left untreated ( CONTROL ) ."}	0.996	1	1	{EXT_NGRAM_[and]_[cell],WORD_SEQ_LEN_[2],POS_SEQ_[NN_IN],DEP_PATH_[nn@nn-prep_of|cell],INT_NGRAM_[treatment]_[of],"WORD_SEQ_[treatment of]","WORD_SEQ_NER_[treatment of]",MIN_VERB_[cause],SINGLE_VERB_[cause]}	{5.47925,-3.81388,3.29971,-1.44247,1.43754,0.814955,0.814955,-0.319585,-0.224795}
RELATION_GENEHPOTERM_journal.pone.0044996.pdf_408_408_8_8_16_17	Fe65/HP:0100316|Hirano bodies	{8}	{16,17}	{In,addition,",",the,APP,binding,adaptor,protein,Fe65,has,also,been,shown,to,co-localize,with,Hirano,bodies,in,brain,and,cell,cultures,[,"6,47",],.}	{"Our results obtained using the cell culture model system show that cell death induced by either APP/c31 in the presence or absence of 352PHPtau or APP / AICDc58 is signiﬁcantly reduced in the presence of model Hirano bodies .","Both tau and the c-terminal region of APP have been shown to co-localize with Hirano bodies in post-mortem samples as well as in model Hirano bodies in cell culture [ 6,35,43,47 ] ."}	{"Both C31 and 352PHPtau co-localize with model Hirano bodies , but unlike 352PHPtau , the distribution of c31 changes from diffuse in control samples to concentrated and co-localized with Hirano bodies .","The interaction of tau with Hirano bodies could occur through tau and its phosphorylated forms binding directly to F-actin [ 96 ] ."}	0.988	1	0.256	{EXT_NGRAM_[protein]_[in],INT_NGRAM_[have]_[with],WORD_SEQ_LEN_[7],VERB_[has],VERB_[been],VERB_[shown],POS_SEQ_[VBZ_RB_VBN_VBN_TO_VB_IN],"WORD_SEQ_[have also be show to co-localize with]",VERB_[co-localize],"WORD_SEQ_NER_[have also be show to co-localize with]",MIN_VERB_GENE_[show]_HPO_[co-localize],DEP_PATH_[nsubjpass@prep_with-xcomp|co-localize]}	{3.88284,2.13467,-0.993558,-0.54247,0.445938,-0.303796,0,0,0,0,0,0}
RELATION_GENEHPOTERM_journal.pone.0039653.pdf_53_53_5_5_37_39	BRAF/HP:0002895|Papillary thyroid carcinoma	{5}	{37,38,39}	{Similarly,",",various,fusions,of,BRAF,have,been,implicated,in,cancer,such,as,pediatric,astrocytomas,(,KIAA1549-BRAF,;,exons,9/11,),[,24,],",",melanocytic,nevi,(,FCHSDI-BRAF,",",exon,9,),[,25,],",",papillary,thyroid,carcinomas,(,AKAP9-BRAF,;,exon,9,),[,26,],",",prostate,cancer,(,SLC45A-BRAF,;,exon,8,),[,27,],",",and,gastric,cancer,(,AGTRAP-BRAF,;,exon,8,),[,27,],.}	{"Mutations to this protein such as G469A , E586K , V600E , and K60lE can increase BRAF catalytic activity [ 20 ] .","BRAF V600E has been implicated in papillary thyroid carcinoma [ 21 ] , colorectal carcinoma [ 22 ] , and melanoma [ 23 ] ."}	{"In our model , the resultant SND1-BRAF fusion protein contains a constitutively active BRAF kinase which increases phosphorylation of ERK .","Functionally , this fusion protein signals downstream of c-Met and bypasses its inhibition by METi ."}	1	1	1	{EXT_NGRAM_[of]_[(],VERB_[implicated],"INT_NGRAM_[have]_[,]",VERB_[been],VERB_[have],MIN_VERB_[implicate]}	{2.58999,1.16709,0.768216,0.445938,0.383994,-0.0794312}
RELATION_GENEHPOTERM_SUP_MAP_journal.pgen.1000649.pdf_443_443_0_0_7_8_UNSUP	SCN9A/HP:0002373|Febrile seizures	{0}	{7,8}	{SCN9A,is,mutated,in,multiple,patients,with,febrile,seizures,(,FS,),and,Dravet,syndrome,.}	{"GFSEL ...","Figure 5 ."}	{"( A ) Phenotypic profile and secondary structure locations of all variants found in SCN9A .","Red text , variants in FS patients ; blue text , variants in Dravet syndrome patients ; black text , variants in both phenotypes ; * variants also found in controls ."}	0.998	1	0.982	{EXT_NGRAM_[NULL]_[(],VERB_[mutated],INT_NGRAM_[be]_[with],WORD_SEQ_LEN_[6],MIN_VERB_[mutate],VERB_[is],POS_SEQ_[VBZ_VBN_IN_JJ_NNS_IN],DEP_PATH_[nsubjpass@nsubj-advcl|(],"WORD_SEQ_[be mutate in multiple patient with]","WORD_SEQ_NER_[be mutate in multiple patient with]"}	{3.27467,2.40572,1.6266,-1.13804,0.652915,-0.637309,0.169544,0,0,0}
RELATION_GENEHPOTERM_journal.pone.0055758.pdf_63_63_8_8_27_28	HE/HP:0002401|Stroke-like episodes	{8}	{27,28}	{Clinical,examination,revealed,that,symptoms,/,signs,of,HE,included,seizures,(,n,=,4,),;,psychological,or,psychiatric,disorders,(,n,=,3,),;,stroke-like,episodes,(,n,=,2,),and,corticospinal,abnormalities,(,n,=,1,),.}	{"The average age of the HE group was 38.88 il1 .57 years ( 3 males , 5 females ; Table l ) .","The educational levels included elementary school ( n = 1 ) ; junior high school ( n = 2 ) , senior high school ( n = 3 ) and college ( n = 2 ) ."}	{"The clinical features of the HE cases are summarized in Table 2 .","The tests for antithyroid antibodies ( conducted to satisfy the diagnostic criteria ) revealed that anti-TPO levels were greater than 1,300 IU / ml in ﬁve HE patients ; the other three patients had antiTPO levels greater than 400 IU/ml ( i.e. , 1253.63 IU/ml , l1l3 .21 U/ml and 495.3 IU / ml ) ."}	0.98	1	1	{EXT_NGRAM_[of]_[(],VERB_[included],INT_NGRAM_[include]_[;],MIN_VERB_GENE_[include]_HPO_[reveal]}	{2.58999,0.609039,0.502356,0}
RELATION_GENEHPOTERM_journal.pone.0061267.pdf_395_395_3_3_6_6	EGFR/HP:0001909|Leukemia	{3}	{6}	{In,contrast,to,EGFR,—,negative,leukemia,and,lymphoma,cells,",",EGFRoverexpressing,cancer,cells,of,solid,tumor,origin,were,resistant,to,the,cytolytic,activity,of,NKL,cells,.}	{"Cytotoxicity of NKL/GrB-T cells was abrogated by addition of EGTA , which chelates Ca2 + essential for the release of granular proteins and for perforin activity [ 34,35,36 ] .","This suggests that ectopically expressed GrB-T is released via the same mechanism as endogenous wildtype GrB , and likely employs perforin to gain access to GrB substrates in target cells ."}	{"Unexpectedly , this was also the case for NKL/GrB-T cells that express the EGFR-speciﬁc fusion protein .","This could be explained by insufficient activation of the NK cells upon contact with the NKL-resistant targets ."}	0.94	1	1	{POS_SEQ_[CD_JJ],WORD_SEQ_LEN_[2],INT_NGRAM_[—]_[negative],DEP_PATH_[@dep],MIN_VERB_[be],"WORD_SEQ_NER_[NUMBER negative]","WORD_SEQ_[— negative]",EXT_NGRAM_[to]_[and]}	{3.88238,-3.81388,2.31006,-1.85919,-1.56845,1.50146,1.50146,0.95488}
RELATION_GENEHPOTERM_journal.pone.0071445.pdf_237_237_6_6_10_12	CDH13/HP:0007354|Amyotrophic lateral sclerosis	{6}	{10,11,12}	{CDH13-G113R,was,one,out,of,ﬁve,CDH13,mutations,identiﬁed,in,amyotrophic,lateral,sclerosis,(,ALS,),patients,",",all,of,which,were,absent,in,controls,[,44,],.}	{"The N39S missense variant was the only variant with allele frequency above 1 % , ( 1.3 % ) in our patient sample .","Out of the seven variants we identiﬁed , only G1 13R has been previously reported in connection with a phenotype ."}	{"There was , however , no evidence of any effects of CDH13 ’ variants in ALS in that study .","Based on the observed frequency of mutations in patients and controls ( Table 1 ) , we performed power calculations to estimate the number of samples required to obtain statistical signiﬁcance ."}	1	1	1	{INT_NGRAM_[mutation]_[in],POS_SEQ_[NNS_VBN_IN],WORD_SEQ_LEN_[3],MIN_VERB_[identiﬁed],VERB_[identiﬁed],"WORD_SEQ_[mutation identiﬁed in]","WORD_SEQ_NER_[mutation identiﬁed in]",EXT_NGRAM_[ﬁve]_[(],DEP_PATH_[nn-prep_out_of|mutation@prep_in]}	{10.3845,1.85912,-1.68471,-0.791596,0.409626,0.0980622,0.0980622,0,0}
